site,tier,url,title,author,published_at,description,site_name,language,word_count,text,extracted_at,error
almasry,tier1,https://www.almasryalyoum.com/news/details/4281257,اعرف عائدك السنوي.. تفاصيل شهادات بنك مصر 2026 بفائدة تصل ل 20.5% | المصري اليوم,محمود أحمد الشاهد,2026-05-30 03:07:00+00:00,في ظل تقلبات المشهد الاقتصادي العالمي وتصاعد حدة التوترات الجيوسياسية التي تفرض حالة من «عدم اليقين»، عادت شهادات الادخار لتتصدر واجهة المشهد الاستثماري في مصر كأداة آمنة...,المصري اليوم,ar,167,في ظل تقلبات المشهد الاقتصادي العالمي وتصاعد حدة التوترات الجيوسياسية التي تفرض حالة من «عدم اليقين»، عادت شهادات الادخار لتتصدر واجهة المشهد الاستثماري في مصر كأداة آمنة توفر تدفقات نقدية مستقرة للمدخرين خاصة مع تنوع الأدوات الاستثمارية المطروحة التي تشمل شهادات ذات عائد ثابت يصل إلى 17.25% وأخرى ذات عائد متناقص يصل إلى 20.50%. شهادات بنك مصر شهادة ابن مصر ذات العائد الشهرى المتناقص تعتمد شهادة «ابن مصر» نظام العائد المتناقص، والذي يمنح المدخرين عائدا شهريا بنسبة 20.50% خلال السنة الأولى، ثم يتراجع هذا العائد إلى 16.25% في السنة الثانية، ليستقر عند 12.25% في السنة الثالثة والأخيرة من مدة الشهادة. شهادة يوماتي سجل سعر الفائدة على شهادة «يوماتي» مستوى 19%. قد يهمك أعلى شهادات البنك الأهلي 2026 لمدة 3 سنوات.. فائدة متناقصة تصل ل 22% شهادة القمة وكان بنكا الأهلى ومصر قد قررا رفع العائد السنوى على الشهادات الثلاثية ذات العائد الثابت إلى 17.25% بدلا من 16%، حيث شمل القرار الشهادتين «البلاتينية» و«القمة»، مع إتاحة صرف العائد للعملاء بصفة شهرية منتظمة طوال مدة الشهادة البالغة 3 سنوات.,2026-05-30T08:33:02.861969+00:00,
almasry,tier1,https://www.almasryalyoum.com/news/details/4281086,رضا عبد السلام ل«المصري اليوم»: أطالب بالاستماع للأزهر في «الأحوال الشخصية» ولم أُصرِّح بسحب القانون | المصري اليوم,ريهام سعيد أحمد,2026-05-29 17:40:00+00:00,قال النائب رضا عبد السلام، إن ما تم تداوله بشأن تصريحاته حول سحب مشروع قانون الأحوال الشخصية من البرلمان، «جاء في غير سياقه الصحيح»، مضيفًا أنه «أشار في مقال كتبه قبل ساعات...,المصري اليوم,ar,179,قال النائب رضا عبد السلام، إن ما تم تداوله بشأن تصريحاته حول سحب مشروع قانون الأحوال الشخصية من البرلمان، «جاء في غير سياقه الصحيح»، مضيفًا أنه «أشار في مقال كتبه قبل ساعات إلى ما تداولته بعض المواقع الإخبارية بشأن سحب المشروع، خاصة بعد تصريحات وكيل الأزهر التي أكد خلالها أن الأزهر الشريف لم يُستشر بشأن مشروع القانون». وصرح عبد السلام ل«المصري اليوم»: بأنه «لم يُدلِ بأي تصريح مستقل يؤكد سحب مشروع القانون، وإنما قال نصًا: إذا صح هذا الكلام فهي خطوة طيبة وممارسة ديمقراطية محمودة تعكس تفاعل الحكومة مع الشارع، إلا أن بعض المواقع تداولت الأمر باعتباره تصريحًا مباشرًا منه بسحب القانون». وطالب عضو مجلس النواب بالاستماع إلى رأي الأزهر الشريف، باعتباره القوة الناعمة لمصر وأقدم مؤسسة إسلامية تحظى باحترام واسع داخل وخارج البلاد، مؤكدًا أن قانون الأسرة من أخطر القوانين المرتبطة باستقرار المجتمع ومستقبل الأسرة المصرية. وأشار إلى ضرورة التريث في مناقشة مشروع قانون الأحوال الشخصية، وإتاحة الفرصة للاستماع إلى جميع الآراء ووجهات النظر الوطنية، بما في ذلك المؤسسات الدينية والنقابات والمتخصصين، حتى يخرج القانون معبرًا بحق عن طموحات الأسرة المصرية، ومتجنبًا أوجه القصور والسلبيات الموجودة في القانون.,2026-05-30T08:33:02.959389+00:00,
almasry,tier1,https://www.almasryalyoum.com/news/details/4281209,«التموين»: تحرير 4416 مخالفة خلال 3 أيام فى حملات رقابية | المصري اليوم,رنا حمدي,2026-05-30 00:37:00+00:00,تلقى الدكتور شريف فاروق، وزير التموين والتجارة الداخلية، تقارير تفصيلية من غرفة العمليات المركزية لشؤون الرقابة بالوزارة بشأن الموقف التموينى على مستوى الجمهورية خلال فترة...,المصري اليوم,ar,316,آخرون الدكتور شريف فاروق وزير التموين والتجارة الداخلية آخرون الدكتور شريف فاروق وزير التموين والتجارة الداخلية تلقى الدكتور شريف فاروق، وزير التموين والتجارة الداخلية، تقارير تفصيلية من غرفة العمليات المركزية لشؤون الرقابة بالوزارة بشأن الموقف التموينى على مستوى الجمهورية خلال فترة وقفة وأول وثانى أيام عيد الأضحى المبارك، وذلك خلال الفترة من ٢٦ إلى ٢٨ مايو الجارى. وأكدت التقارير الواردة من مديريات التموين بالمحافظات انتظام العمل بكافة عناصر المنظومة التموينية، واستقرار الحالة التموينية بشكل كامل، مع توافر السلع الغذائية والأساسية والمواد البترولية وأسطوانات البوتاجاز، واستمرار ضخ السلع واللحوم بالمجمعات الاستهلاكية وفروع «كارى أون» والمنافذ التابعة للوزارة بما يلبى احتياجات المواطنين خلال أيام العيد. كما أوضحت التقارير انتظام عمل المخابز البلدية والمجمعات الاستهلاكية ومحطات الوقود ومستودعات البوتاجاز، وعدم رصد أى أزمات أو معوقات تؤثر على توافر السلع أو الخدمات المقدمة للمواطنين، بما يعكس جاهزية المنظومة التموينية وكفاءة خطط المتابعة الميدانية التى تم تنفيذها خلال فترة العيد. وفى إطار تنفيذ توجيهات وزير التموين بتكثيف الرقابة الميدانية خلال الإجازات والأعياد، واصلت الأجهزة الرقابية حملاتها المكثفة على الأسواق والمخابز البلدية ومحطات الوقود ومستودعات البوتاجاز، بالتنسيق الكامل بين الإدارة المركزية لشؤون الرقابة ومديريات التموين بالمحافظات. وأسفرت تلك الحملات عن تحرير ٤٤١٦ مخالفة تموينية متنوعة خلال الأيام الثلاثة، شملت ٣١٦٣ مخالفة فى قطاع المخابز البلدية، و١٢٠٣ مخالفات فى قطاع الأسواق والأنشطة التجارية والمعاملات التموينية، بالإضافة إلى ٥٠ مخالفة فى مجال المواد البترولية ومحطات الوقود ومستودعات الغاز. كما أكد التقرير استقرار وانتظام العمل بقطاع المطاحن ومستودعات تخزين الدقيق التى شملتها حملات المرور والمتابعة الميدانية طوال فترة العيد، دون رصد أى مشكلات أو معوقات تؤثر على كفاءة التشغيل أو انتظام منظومة إنتاج وتداول الدقيق. وأكد «فاروق» أن غرفة العمليات المركزية بالوزارة تواصل انعقادها على مدار الساعة بالتنسيق مع غرف العمليات الفرعية بمديريات التموين فى جميع المحافظات لمتابعة الموقف التموينى أولًا بأول، والتعامل الفورى مع أى شكاوى أو بلاغات ترد من المواطنين، بالتنسيق مع الجهات الرقابية والتنفيذية المعنية، بما يضمن الحفاظ على استقرار الأسواق وتوافر السلع الأساسية، وردع أى محاولات للتلاعب أو الإضرار بمصالح المواطنين.,2026-05-30T08:33:03.737722+00:00,
almasry,tier1,https://www.almasryalyoum.com/news/details/4281235,القائمة السوداء! | المصري اليوم,محمد أمين,2026-05-30 01:23:00+00:00,مرة أخرى، أتقدم بالتحية والتقدير للأمم المتحدة على شجاعتها وإدراج إسرائيل فى القائمة السوداء بتهمة ارتكاب عنف جنسى ضد الفلسطينيين، فى ظل رئاسة الأمين العام البرتغالى...,المصري اليوم,ar,373,مرة أخرى، أتقدم بالتحية والتقدير للأمم المتحدة على شجاعتها وإدراج إسرائيل فى القائمة السوداء بتهمة ارتكاب عنف جنسى ضد الفلسطينيين، فى ظل رئاسة الأمين العام البرتغالى «جوتيريش».. أعلنت الأمم المتحدة إدراج إسرائيل على «القائمة السوداء» للجهات المتهمة بارتكاب انتهاكات تتعلق بالعنف الجنسى فى الأراضى الفلسطينية المحتلة، إلى جانب عدد من المؤسسات الإسرائيلية الأخرى التى وُضعت تحت المراقبة تمهيدًا لاحتمال إضافتها لاحقًا!. وضمّت القائمة مصلحة السجون الإسرائيلية، بينما تخضع جهات أمنية إسرائيلية أخرى لمتابعة أممية على خلفية مزاعم بانتهاكات ضد فلسطينيين داخل مراكز الاحتجاز.. وهى شجاعة تُظهر أن إسرائيل لم تعد البعبع الذى كان يخيف الأمناء العامين فى وقت سابق.. وقال مندوب إسرائيل الدائم فى الأمم المتحدة إن هذه الخطوة تضعها فى خانة واحدة مع تنظيمات إرهابية مثل داعش، وقال إن تل أبيب قدمت وثائق وردودًا مفصلة تنفى الاتهامات الموجهة إليها!. وللعلم، جوتيريش (من مواليد ٣٠ أبريل ١٩٤٩)، وهو سياسى ودبلوماسى برتغالى وعضو فى الحزب الاشتراكى البرتغالى. يشغل منذ عام ٢٠١٧ منصب الأمين العام للأمم المتحدة، وهو الشخص التاسع الذى يحمل هذا اللقب. شغل منصب رئيس وزراء البرتغال من عام ١٩٩٥ إلى عام ٢٠٠٢. شغل جوتيريش منصب الأمين العام للحزب الاشتراكى من عام ١٩٩٢ إلى عام ٢٠٠٢، وانتُخب رئيسا للوزراء فى عام ١٩٩٥ وأعلن استقالته فى عام ٢٠٠٢، بعد هزيمة حزبه فى الانتخابات المحلية البرتغالية عام ٢٠٠١. وبعد ست سنوات من الحكم دون أغلبية مطلقة وفى ظل اقتصاد ضعيف، كان أداء الحزب الاشتراكى أسوأ من المتوقع بسبب الخسائر فى لشبونة وبورتو!. أشارت استطلاعات الرأى إلى تقدمه القوى. تولى رودريجيز قيادة الحزب الاشتراكى فى يناير ٢٠٠٢، لكن جوتيريش ظل رئيسًا للوزراء حتى خسارة الانتخابات العامة أمام الحزب الديمقراطى الاشتراكى.. على الرغم من هذه الهزيمة، فقد صنفت استطلاعات الرأى العام البرتغالى فى عامى ٢٠١٢ و٢٠١٤ جوتيريش كأفضل رئيس وزراء خلال الثلاثين عامًا الماضية!. يذكر أن جوتيريش قد أشار فى تقريره السنوى الصادر العام الماضى إلى احتمال إدراج إسرائيل رسميًا فى تقرير عام ٢٠٢٦، ما لم تتخذ إجراءات عملية للتحقيق فى مزاعم العنف الجنسى المرتبطة بقواتها. ودعا جوتيريش السلطات الإسرائيلية إلى استكمال التحقيقات القضائية بشأن الانتهاكات المزعومة، خصوصًا داخل السجون ومراكز الاحتجاز، والسماح لهيئات الأمم المتحدة بإجراء تحقيقات مستقلة تتعلق بالانتهاكات المنسوبة للقوات الإسرائيلية أو بحركة حماس!. باختصار، هذه إدارة شجاعة وعادلة للأمم المتحدة فى ظل قيادة جوتيريش تجعلنى أصف قيادته بأنها قيادة شجاعة، وتجعلنى مرة أخرى أوجه له التحية على مجمل مواقفه من الحرب وحتى الآن!.,2026-05-30T08:33:04.212392+00:00,
almasry,tier1,https://www.almasryalyoum.com/news/details/4280918,لجنة مبيدات الآفات الزراعية تصدر 318 موافقة للاستيراد و274 إفراجًا جمركيًا خلال مايو | المصري اليوم,متولي سالم,2026-05-29 11:21:00+00:00,أكدت الدكتورة هالة أبويوسف، رئيس لجنة مبيدات الآفات الزراعية، أن اللجنة أصدرت 318 موافقة فنية للاستيراد، و274 إفراجًا جمركيًا، إلى جانب إصدار 104 شهادات تسجيل، و242 بطاقة...,المصري اليوم,ar,355,إجتماع لجنة المبيدات برئاسة د هالة أبو يوسف رئيس اللجنة إجتماع لجنة المبيدات برئاسة د هالة أبو يوسف رئيس اللجنة أكدت الدكتورة هالة أبويوسف، رئيس لجنة مبيدات الآفات الزراعية، أن اللجنة أصدرت 318 موافقة فنية للاستيراد، و274 إفراجًا جمركيًا، إلى جانب إصدار 104 شهادات تسجيل، و242 بطاقة استدلالية، و4 إفادات، و224 شهادة اجتياز للتقييم الحيوى، و34 تصريح تداول للمبيدات المجهزة محليًا، و30 شهادة تأهيل لمديرى المصانع، و4 تصاريح لتشغيل مصانع، و12 بطاقة OFF-label. وقالت «أبويوسف» إن ذلك يأتى فى إطار إحكام الرقابة على منظومة تسجيل وتداول المبيدات، وضمان مطابقتها للمواصفات القياسية المعتمدة، بما يحافظ على سلامة المنظومة الزراعية ويعزز الثقة فى المنتجات المتداولة بالسوق المحلية، أو لأغراض التوسع فى منظومة الصادرات الزراعية. وأضافت رئيس لجنة المبيدات أن هذه الخطوات تستهدف رفع كفاءة العاملين بهذا القطاع الحيوى، الذى يتعامل بشكل مباشر مع شريحة واسعة من المزارعين، ويؤدى دورًا محوريًا فى حماية المحاصيل الزراعية وتحسين جودة الإنتاج، بما ينعكس إيجابًا على تنافسية الصادرات الزراعية المصرية فى الأسواق الخارجية. وأوضحت «أبويوسف» أن اللجنة أنجزت نحو 1345 إجراءً فنيًا وإداريًا خلال شهر مايو 2026، بهدف دعم قطاع صناعة المبيدات، والارتقاء بكفاءة العاملين به، وتوطين الصناعة محليًا لتقليل الفجوة الاستيرادية وتعزيز الاعتماد على المنتج الوطنى. وأكدت رئيس لجنة المبيدات إن هذه الجهود تأتى فى إطار استراتيجية متكاملة لدعم القطاع الزراعى باعتباره إحدى الركائز الأساسية للاقتصاد الوطنى، مع التركيز على توطين صناعة المبيدات ورفع كفاءة منظومة تداولها واستخدامها. وأشارت «أبويوسف» إلى أن هذه الجهود لخبراء لجنة المبيدات تضمن تحقيق إنتاج زراعى آمن ومستدام، يدعم خطط الدولة فى زيادة الإنتاجية وتحقيق الأمن الغذائى وتعزيز الصادرات الزراعية، لافتة إلى استمرار العمل بوتيرة مكثفة لدعم القطاع الزراعى وتعزيز منظومة تداول واستخدام المبيدات وفقًا لأعلى معايير الجودة والأمان، بما يسهم فى حماية الإنتاج الزراعى وتحقيق الأمن الغذائى. ويأتى ذلك بينما أوضح تقرير رسمى أصدرته لجنة المبيدات أن جهود اللجنة أسفرت عن منح 26 شهادة تأهيل لمطبقى المبيدات، ضمن البرنامج التدريبى الذى أطلقته لجنة مبيدات الآفات الزراعية لتأهيل الكوادر الفنية اللازمة للتعامل الآمن مع عمليات رش المحاصيل الزراعية. وشدد التقرير على ضرورة ضمان الاستخدام الرشيد للمبيدات وفق التوصيات الفنية المعتمدة، بما يحقق مكافحة فعالة للآفات فى التوقيتات المناسبة، ويحافظ، فى الوقت ذاته، على صحة الإنسان والبيئة، مشيرا إلى أن اللجنة أصدرت 73 شهادة تدريب للمشتغلين بالمبيدات.,2026-05-30T08:33:04.830219+00:00,
almasry,tier1,https://www.almasryalyoum.com/news/details/4281153,سعر الذهب اليوم وعيار 21 الآن بمستهل تعاملات السبت 30 مايو 2026 | المصري اليوم,منار عصام,2026-05-29 21:25:00+00:00,واصلت أسعار الذهب في بداية تعاملات آخر أيام عيد الأضحى المبارك السبت 30 مايو 2026، استقرارها عند آخر تراجع، أمس، وفقًا لآخر تحديث صادر عن شعبة الذهب والمجوهرات باتحاد الغرف...,المصري اليوم,ar,290,"قفزات متواصلة فى سعر الذهب - صورة أرشيفية قفزات متواصلة فى سعر الذهب - صورة أرشيفية واصلت أسعار الذهب في بداية تعاملات آخر أيام عيد الأضحى المبارك السبت 30 مايو 2026، استقرارها عند آخر تراجع، أمس، وفقًا لآخر تحديث صادر عن شعبة الذهب والمجوهرات باتحاد الغرف التجارية. قفزة فى سعر الذهب خلال أسبوع - صورة أرشيفية أسعار الذهب اليوم في مصر (بدون مصنعية) جاءت الأسعار المعلنة وفقًا لشعبة الذهب كالتالي: عيار 24: سجل نحو 7760 جنيهًا للجرام. عيار 21 : سجل نحو 6790 جنيهًا للجرام، وهو الأكثر تداولًا في السوق المصرية. عيار 18: استقر عند 5820 جنيهًا للجرام. الجنيه الذهب (وزن 8 جرامات من عيار 21): سجل نحو 54320 جنيه. سعر الذهب اليوم الأحد 11-12-2026 فى السعودية وزيادة عالمية 0.5% - صورة أرشيفية سعر الذهب عالميًا وتأثيراته شهدت الأسواق العالمية تراجعًا في سعر الأوقية، وسجلت أونصة الذهب عالميًا نحو 4540 دولارات. نصائح للشراء وسعر المصنعية أكدت الشعبة أن الأسعار المعلنة هي أسعار الجرام الخام (سعر الشاشة)، ولا تشمل المصنعية والدمغة، والتي تتفاوت حسب المحافظة والمنطقة. آخرون سعر سبيكة ذهب btc اليوم الاثنين 29 ديسمبر 2025 - صورة أرشيفية سعر المصنعية في مصر: يتراوح عادةً بين 50 و200 جنيه للجرام، ويختلف حسب التصميم والمحل. وتتميز سبائك الذهب بمصنعية أقل بكثير مقارنة بالمشغولات. يُنصح دائمًا بمقارنة الأسعار بين محلات الصاغة قبل الشراء، والاستفسار بوضوح عن قيمة المصنعية والدمغة المفروضة على القطعة. أسعار السبائك اليوم سعر الذهب اليوم - صورة أرشيفية وفقًا لبيانات شعبة الذهب والمجوهرات، سجلت أسعار السبائك (بدون مصنعية) في الأسواق المصرية اليوم السبت: السبيكة السعر (جنيه) سبيكة 1 جرام 7,760 سبيكة 2.5 جرام 19,400 سبيكة 5 جرامات 38,800 سبيكة 10 جرامات 77,600 سبيكة 20 جرامًا 155,200 سبيكة 50 جرامًا 388,000 من المتوقع أن تشهد الأسعار المحلية حالة من الاستقرار النسبي خلال الفترة المقبلة، مع استمرار متابعة تحركات السعر العالمي للأوقية.",2026-05-30T08:33:04.745936+00:00,
