site,tier,url,title,author,published_at,description,site_name,language,word_count,text,extracted_at,error
almasry,tier1,https://www.almasryalyoum.com/news/details/4280253,تخطى ال 100 ألف جنيه.. ارتفاع أسعار الأضاحى يربك الموسم ويغيّر عادات الشراء | المصري اليوم,هدير حنتيش,2026-05-28 04:49:00+00:00,قبل العيد بأيام قليلة، اعتاد أحمد جابر، موظف، الذهاب إلى سوق المواشى لاختيار الأضحية وهو الأمر الذى اعتاد عليه منذ نحو 20 عامًا، كان يشترك معه فى الشراء والذبح شقيقاه، إلا أنه...,المصري اليوم,ar,450,قبل العيد بأيام قليلة، اعتاد أحمد جابر، موظف، الذهاب إلى سوق المواشى لاختيار الأضحية وهو الأمر الذى اعتاد عليه منذ نحو 20 عامًا، كان يشترك معه فى الشراء والذبح شقيقاه، إلا أنه هذا العام فوجئ بارتفاع كبير فى الأسعار ما دفعه إلى البحث عن شريك فى ثمن الأضحية منعًا لقطع عادة حرص عليها منذ سنوات طويلة. مع ارتفاع أسعار اللحوم والمواشى لم تعد «الأضحية المشتركة» مجرد خيار اقتصادى، بل أصبحت طوق نجاة للكثير من الأسر المصرية بحسب وصف محمد عاطف، طبيب بوزارة الصحة، والتى تحاول الحفاظ على طقوس العيد وسط ضغوط معيشية متزايدة. داخل ممرات أسواق الماشية، وقف «عاطف» يتأمل الأسعار بقلب مثقل، وقال: «فى السنوات الماضية، كنت أشترك فى الأضحية مع ثلاثة من جيرانى، ولكن مع ارتفاع الأسعار بشكل مبالغ فيه، أصبحت الأرقام تفوق قدرتى بمراحل لم أرد أن أقطع هذه العادة، خصوصًا بعد تخطى سعر العجل 100 ألف جنيه، فاتفقت مع 5 من جيرانى، وجمعنا ما نملك وقررنا شراء عجل». مصطفى حسين و4 من أشقائه قرروا عدم الاستسلام للأسعار المرتفعة، واجتمعوا على فكرة ذكية وهى «الاشتراك فى شراء عجل»، وجد كل منهم أن شراء اللحم من الجزار، أو الانفراد ب«أضحية» مستقلة، أصبح عبئا يفوق طاقة الميزانية الفردية. من جهتها، قالت الدكتورة هدى الملاح، مديرة المركز الدولى للاستشارات الاقتصادية ودراسات الجدوى، إن التغيرات الاقتصادية الأخيرة فرضت واقعًا جديدًا على الأسر المصرية خلال موسم عيد الأضحى، إذ تحولت فكرة «الاشتراك فى الأضحية» من حل محدود الانتشار إلى ظاهرة واسعة فرضها ارتفاع الأسعار وتراجع القدرة الشرائية لدى قطاعات كبيرة من المواطنين. وأضافت الملاح أنه خلال السنوات الماضية، كانت كثير من الأسر تفضل شراء أضحية كاملة باعتبارها جزءًا من طقوس العيد والعادات الاجتماعية المتوارثة، إلا أن القفزات المتتالية فى أسعار الماشية والأعلاف دفعت المواطنين لإعادة حساباتهم الاقتصادية، خصوصًا مع ارتفاع تكاليف المعيشة بصورة عامة. وأشارت إلى أن المواطنين اتجهوا إلى نظام المشاركة الجماعية، إذ يتم تقسيم العجل إلى سبعة أسهم شرعية، ليتحمل كل فرد جزءا من التكلفة بدلًا من دفع قيمة الأضحية بالكامل، وهو ما خفف الضغط المالى وسمح باستمرار أداء الشعيرة رغم الظروف الاقتصادية. وبحساب التكلفة النهائية للأضحية، أوضحت الملاح أن أسعار بعض العجول أصبحت تتجاوز حاجز ال80 وال 100 ألف جنيه وفقًا للوزن والنوع، بينما تراوح سعر الخروف (قائم - صاحى) بين 8 آلاف و18 ألف جنيه، وهو ما جعل فكرة شراء الأضحية بشكل منفرد تمثل عبئا ماليا كبيرا على الكثير من الأسر. وأكد شلبى جابر، سكرتير عام شعبة القصابين بالغرفة التجارية بالقاهرة، أن الغلاء يجبر 6 أو 7 أشخاص على الاشتراك فى أضحية واحدة، وحتى ربع العجل أصبح يشترك فيه شخصان. وأضاف، ل «المصرى اليوم»: «الإقبال على شراء الأضاحى قلّ هذا العام بسبب اشتراك عدد من الأشخاص فى أضحية واحدة، وبسبب ارتفاع الأسعار حيث كان يسجل العام الماضى كيلو اللحم قائم 185 جنيها، وأصبح اليوم 220 جنيها، قائلا: «اللى بيضحى بقى بيروح تنزانيا لأن سعر الخروف بيجيب بقرة هناك».,2026-05-28T10:10:13.254857+00:00,
almasry,tier1,https://www.almasryalyoum.com/news/details/4280268,«الأعمال المصري الأمريكى»: «القاهرة» منتج سياحي متنوع | المصري اليوم,إبراهيم الطيب,2026-05-28 05:19:00+00:00,أكد عمرو بدر عضو مجلس الأعمال المصرى الأمريكى، أن الوصول إلى مستهدف 30 مليون سائح الذى تتبناه الدولة المصرية ليس حلمًا بعيد المنال، وإنما هدف قابل للتحقق إذا استمرت جهود...,المصري اليوم,ar,685,وزير السياحة يكرم عمرو بدر على هامش فعاليات القمة العالمية للسياحة والسفر وزير السياحة يكرم عمرو بدر على هامش فعاليات القمة العالمية للسياحة والسفر أكد عمرو بدر عضو مجلس الأعمال المصرى الأمريكى، أن الوصول إلى مستهدف 30 مليون سائح الذى تتبناه الدولة المصرية ليس حلمًا بعيد المنال، وإنما هدف قابل للتحقق إذا استمرت جهود التأهيل والتطوير بوتيرة متسارعة. وزير السياحة يكرم عمرو بدر على هامش فعاليات القمة العالمية للسياحة والسفر وقال فى تصريحات خاصة ل«المصرى اليوم»؛ خلال مشاركته فى الفعالية الدولية للمجلس العالمى للسياحة والسفر (WTTC) التى استضافتها مصر، إن الفارق كبير بين الحلم والهدف، موضحًا أن وضع رقم 30 مليون سائح كمستهدف رسمى يعنى ضرورة تسخير كل الإمكانات الحكومية والخاصة لتحقيقه، من خلال تطوير البنية التحتية، وزيادة الطاقة الفندقية، وتحسين وسائل النقل ورفع كفاءة المقاصد السياحية. وأضاف المستثمر السياحى، أن الوصول إلى هذا الرقم يرتبط أولًا بما وصفه ب«التأهيل البيئى والمناخي»، ويشمل ذلك القدرة الاستيعابية للمناطق السياحية والأثرية، وعدد الغرف الفندقية، وكفاءة النقل، فضلًا عن جاهزية الدولة والقطاع الخاص لاستقبال هذه الزيادة. وشدد على أن العنصر البشرى لا يقل أهمية عن البنية الأساسية، لافتًا إلى ضرورة الاستثمار المستمر فى تدريب العاملين وتأهيلهم بما يتناسب مع تطور صناعة السياحة عالميًا. وأكد بدر، أن المنتج السياحى المصرى يمتلك مقومات قوية ومتعددة، ما يجعل الوصول إلى المستهدف ممكنًا بل وقابلًا للتحقق قبل الجدول الزمنى المحدد، رغم التحديات الإقليمية والتوترات الجيوسياسية. لكنه أشار إلى أن الأهم من عدد السائحين هو دراسة اقتصاديات هذا الرقم، قائلًا إن السؤال الأهم ليس فقط: هل نريد 30 مليون سائح؟ بل ما حجم العائد المستهدف؟ وهل يتناسب عدد الزائرين مع الطاقة الاستيعابية للمقاصد؟ وأوضح أن بعض المناطق الأثرية لها حدود بيئية واستيعابية دقيقة، بما يستلزم مراعاة مفاهيم السياحة المستدامة والحفاظ على ما وصفه ب«الثروة الحضارية التى تركها الأجداد». وحول ملف الصورة الذهنية لمصر، أكد بدر أن الوضع تحسن بصورة ملحوظة خلال السنوات الأخيرة، خاصة فيما يتعلق بعوامل الأمن والاستقرار، وهو ما انعكس إيجابيًا على حركة السياحة. وقال إن مصر أصبحت أقل تأثرًا بالمحتوى السلبى أو بعض الفيديوهات المتداولة عبر مواقع التواصل الاجتماعى، معتبرًا أن تأثيرها محدود مقارنة بحجم التدفقات الفعلية. لكنه شدد على أهمية تطوير ما وصفه ب«البصريات»، أى الانطباع الأول الذى يتشكل لدى السائح منذ وصوله إلى المطار أو الميناء. وأوضح أن مصر حققت تقدمًا ملحوظًا فى هذا الملف، مشيرًا إلى سرعة الإجراءات داخل المطارات المصرية مقارنة ببعض المطارات الأوروبية، التى قد تمتد فيها طوابير الجوازات لساعات. وطالب بمزيد من العمل على رفع مستوى الجاذبية البصرية للموانئ والمطارات والخدمات المحيطة بالمقاصد السياحية، إلى جانب تحسين النظافة والتشجير والاهتمام بالتفاصيل الجمالية. كما دعا إلى تطوير المناطق المحيطة بالمقاصد السياحية، مقترحًا تحويل كورنيش النيل إلى منطقة سياحية متكاملة تمنح السائح حرية الحركة والتنزه والاستمتاع بالمشهد الحضارى للقاهرة. وفيما يتعلق بمفهوم «الإتاحة» فى السياحة، أكد بدر أن مصر شهدت خلال السنوات الأخيرة طفرة واضحة فى توفير بدائل سياحية تناسب شرائح مختلفة من الزوار. وأشار إلى تنوع مستويات الإقامة الفندقية، خاصة فى المناطق المحيطة بالأهرامات، وظهور فنادق ومنشآت صغيرة ومتوسطة تقدم خدمات جيدة بأسعار متفاوتة. كما لفت إلى دور التطبيقات الرقمية مثل خدمات النقل الذكى فى تسهيل تجربة السائح، فضلًا عن تنوع خطوط الطيران القادمة إلى مصر من عواصم ومدن عالمية مختلفة. واعتبر أن الدولة تسير فى اتجاه صحيح لتعزيز إتاحة السياحة وتوسيع قاعدة المستفيدين منها. السياحة العلاجية.. فرصة كبيرة تحتاج التخصص وعن ملف السياحة العلاجية، وصف بدر القطاع بأنه أحد الملفات الواعدة لمصر، لكنه يحتاج إلى تخصص واضح وتأهيل دقيق حتى يتمكن من المنافسة. وأوضح أن الدول التى نجحت فى هذا المجال مثل الهند وتركيا وتايلاند وكوريا الجنوبية والبرازيل، لم تعتمد على الخدمات الطبية العامة فقط، وإنما بنت لنفسها تخصصات دقيقة ومزايا تنافسية واضحة. وأشار إلى أن تركيا مثلًا نجحت فى زراعة الشعر، وكوريا فى الجراحات التجميلية، بينما تمتلك دول أخرى تخصصات واضحة فى الأورام أو القلب أو برامج العلاج المتكاملة. وأكد أن مصر تمتلك مقومات مهمة فى هذا الملف، سواء من حيث الكفاءات الطبية أو المقاصد الطبيعية، لكنها تحتاج إلى إعداد مؤسسى أفضل، يشمل تطوير المستشفيات، وتأهيل الكوادر، وتيسير التأشيرات والإقامة، وخلق بيئة تشريعية وتنظيمية داعمة. وأضاف أن المبادرات الفردية السابقة فى هذا المجال حققت بداية جيدة، لكنها لم تستمر لغياب التخصص والاستدامة. واختتم بدر بالتأكيد على أن التوسع فى ملفات جديدة مثل السياحة العلاجية أمر مهم، لكنه يجب ألا يأتى على حساب الخطة الرئيسية للدولة فى التوسع السياحى وزيادة الطاقة الاستيعابية والبناء والتطوير.,2026-05-28T10:10:14.414848+00:00,
almasry,tier1,https://www.almasryalyoum.com/news/details/4280067,لوكاكو يعلن التحدي قبل مباراة مصر في كأس العالم 2026 | المصري اليوم,أحمد جمعة الطويل,2026-05-27 17:11:00+00:00,أعلن روميلو لوكاكو، مهاجم منتخب بلجيكا وفريق نابولي الإيطالي، مساء اليوم الأربعاء، التحدي قبل مباراة مصر في كأس العالم 2026 المرتقب.وقال لوكاكو في تصريحات عبر شبكة «سكاي...,المصري اليوم,ar,155,آخرون لوكاكو يعلن التحدي قبل مباراة مصر في كأس العالم 2026 آخرون لوكاكو يعلن التحدي قبل مباراة مصر في كأس العالم 2026 أعلن روميلو لوكاكو، مهاجم منتخب بلجيكا وفريق نابولي الإيطالي، مساء اليوم الأربعاء، التحدي قبل مباراة مصر في كأس العالم 2026 المرتقب. وقال لوكاكو في تصريحات عبر شبكة «سكاي سبورت» الإيطالية: «سنذهب إلى كأس العالم 2026 بشكل مختلف، بقائمة مكونة من جيل جديد، يأمل في إثبات جدراته وقوته للعالم». وأضاف: «كل فرد منا يعلم أهمية دوره في المجموعة، سنكون حاسمين في المونديال، لا يوجد أحد هنا يفضل مصلحته الشخصية، ونركز على مصلحة المنتخب». ويتواجد منتخب بلجيكا ضمن منافسات المجموعة السابعة في كأس العالم 2026 رفقة مصر ونيوزيلندا وإيران. ومن المقرر أن تستضيف دول كندا والمكسيك والولايات المتحدة الأمريكية منافسات مسابقة كأس العالم 2026 بمشاركة 48 منتخبًا للمرة الأولى في تاريخ المونديال، خلال الفترة من 11 يونيو حتى 19 يوليو. جدير بالذكر أن يلتقي منتخب مصر بنظيره البلجيكي ضمن منافسات الجولة الافتتاحية، من دور المجموعات.,2026-05-28T10:10:15.361051+00:00,
almasry,tier1,https://www.almasryalyoum.com/news/details/4280255,«النقل»: انتظام حركة الصادرات والواردات | المصري اليوم,منة هشام الديب,2026-05-28 04:50:00+00:00,أكدت وزارة النقل انتظام حركة الملاحة فى موانئ دمياط والإسكندرية والبحر الأحمر، والصادرات والواردات، فى أول أيام العيد. ووجه الفريق كامل الوزير، وزير النقل رئيس وقيادات...,المصري اليوم,ar,318,إقبال على «مونوريل» شرق النيل إقبال على «مونوريل» شرق النيل أكدت وزارة النقل انتظام حركة الملاحة فى موانئ دمياط والإسكندرية والبحر الأحمر، والصادرات والواردات، فى أول أيام العيد. ووجه الفريق كامل الوزير، وزير النقل رئيس وقيادات الهيئة العامة للنقل النهرى بضرورة استمرار الحملات التفتيشية لمتابعة إجراءات الأمن والسلامة للمراكب النيلية حرصًا على سلامة المواطنين خلال احتفالات عيد الأضحى المبارك، واستمرار التعاون مع شرطة المسطحات المائية، مع الالتزام بالحمولة المحددة، ومنع أى وحدة نيلية من التحرك بالمياه قبل توافر اشتراطات السلامة والأمان بها. وشهدت محطات المرحلة الأولى من مونوريل شرق النيل الممتدة من محطة المشير طنطاوى وحتى محطة مدينة العدالة بالعاصمة الجديدة، أمس، إقبالًا كبيرا من المواطنين من مختلف مناطق القاهرة الكبرى والمحافظات، وذلك لاستقلال قطارات المونوريل والتوجه إلى النهر الأخضر بالعاصمة الجديدة والتعرف على معالمها الحديثة، وحرص المواطنين على استخدام المونوريل للتعرف على ما تشهده العاصمة الجديدة من نهضة حضارية كبرى. وعبر الركاب عن سعادتهم باستخدام المونوريل مع أسرهم خاصة وانه وسيلة نقل حضارية وآمنة وسريعة ونظيفة وصديقة للبيئة، تسهم فى تسهيل حركة تنقلاتهم المختلفة وتقدم لهم اعلى مستويات الخدمة. وتابعت وزارة النقل أمس انتظام العمل بمرافق النقل والمواصلات المختلفة وتنفيذ الإجراءات التى اتخذتها مختلف هيئات الوزارة لتسهيل وتأمين حركة تنقل المواطنين عبر وسائل نقل آمنة وحديثة ومنضبطة ونظيفة، وذلك من خلال تقارير جميع الجهات التابعة بالوزارة، وبالتواصل مع رؤساء تلك الجهات، كما اطمأن الوزير على انتظام حركة تشغيل قطارات السكك الحديدية على مختلف خطوط الشبكة وانتظام مواعيد قيامها، ووجه بتواجد مسؤولى الهيئة بالمحطات المختلفة للإشراف على تقديم خدمات مميزة لجمهور الركاب. كما تم التأكد من انتظام حركة تشغيل الأتوبيس الترددى فى المسافة من تقاطع الطريق الدائرى مع طريق الإسكندرية الزراعى وحتى محطة الجولف، ووجه بتواجد مسؤولى شركة الأتوبيس الترددى ومسؤولى أتوبيسات نقل الركاب بالشركات التابعة للشركة القابضة للنقل البحرى والبرى ومسؤولى السوبرجيت بالمحطات المختلفة، للإشراف على تقديم أعلى مستويات الخدمة للمواطنين كما تم متابعة الحركة المرورية بالطرق التابعة للهيئة العامة للطرق والكبارى ووجه باستمرار انتشار فرق الصيانة والطوارئ فى جميع المناطق والقطاعات التابعة للهيئة العامة للطرق والكبارى.,2026-05-28T10:10:15.911753+00:00,
almasry,tier1,https://www.almasryalyoum.com/news/details/4280101,محلل سياسي: إيران لن تقبل بنقل اليورانيوم المخصب للخارج سواء إلى موسكو أو بكين | المصري اليوم,بسام رمضان,2026-05-27 18:25:00+00:00,قال المحلل السياسى أحمد محارم، إن المقترحات الروسية والصينية بشأن نقل اليورانيوم المخصب من إيران إلى الخارج، سواء إلى موسكو أو بكين، لن تلقى قبولًا لدى الجانب الإيرانى،...,المصري اليوم,ar,229,آخرون محلل سياسي: إيران لن تقبل بنقل اليورانيوم المخصب للخارج سواء إلى موسكو أو بكين - صورة أرشيفية آخرون محلل سياسي: إيران لن تقبل بنقل اليورانيوم المخصب للخارج سواء إلى موسكو أو بكين - صورة أرشيفية قال المحلل السياسى أحمد محارم، إن المقترحات الروسية والصينية بشأن نقل اليورانيوم المخصب من إيران إلى الخارج، سواء إلى موسكو أو بكين، لن تلقى قبولًا لدى الجانب الإيرانى، مؤكدًا أن طهران تعتبر هذا الملف استثمارًا استراتيجيًا امتد لأكثر من ثلاثين عامًا، دفع فيه الشعب الإيرانى ثمنًا باهظًا من العلماء والموارد، وبالتالى لن تسمح لأحد بفرض شروط تتعلق بمصير هذا المخزون النووى. وأضاف خلال حديثه بقناة «إكسترا نيوز»، أن هذه الطروحات من روسيا والصين تُقرأ كمحاولات لضبط الموقف أكثر منها حلول عملية، بينما إيران تمسك بزمام الأمور فى ظل أزمة اقتصادية عالمية خانقة بسبب توقف تدفق النفط عبر مضيق هرمز. وأوضح أن إدارة الرئيس الأمريكى دونالد ترامب تواجه ضغوطًا داخلية كبيرة، وهو ما ظهر فى المؤتمر الصحفى الأخير الذى انقسم فيه فريقه بين رسائل موجهة للداخل الأمريكى وانتقادات حادة للرئيس السابق جو بايدن. وأشار محارم، إلى أن تبادل الاتهامات بخرق وقف إطلاق النار بين واشنطن وطهران يعمّق أزمة الثقة، إذ يرى الإيرانيون أن الولايات المتحدة شنت هجمات رغم الهدنة، فيما تتهم واشنطن إيران بزرع الألغام. واعتبر أن هذه الممارسات تكشف أن انعدام الثقة ما زال هو العائق الأكبر أمام أى تقدم تفاوضى، وأن كل طرف يسعى لإثبات أن زمام المبادرة ما زال فى يده.,2026-05-28T10:10:16.044404+00:00,
