site,tier,url,title,author,published_at,description,site_name,language,word_count,text,extracted_at,error
almasry,tier1,https://www.almasryalyoum.com/news/details/4291917,«الرقابة المالية» و«البنك المركزى الروسي» يبحثان التعاون فى قطاع التأمين | المصري اليوم,زين دياب,2026-06-13 11:12:00+00:00,استقبل الدكتور إسلام عزام، رئيس الهيئة العامة للرقابة المالية، وفدًا روسيًا برئاسة أليكسى جزنوف، نائب محافظ البنك المركزى الروسى، بحضور الدكتور أحمد عبد العزيز، نائب رئيس...,المصري اليوم,ar,201,«الرقابة المالية» و«البنك المركزى الروسي» يبحثان التعاون فى قطاع التأمين «الرقابة المالية» و«البنك المركزى الروسي» يبحثان التعاون فى قطاع التأمين استقبل الدكتور إسلام عزام، رئيس الهيئة العامة للرقابة المالية، وفدًا روسيًا برئاسة أليكسى جزنوف، نائب محافظ البنك المركزى الروسى، بحضور الدكتور أحمد عبد العزيز، نائب رئيس الهيئة، ومحمود جبريل، مساعد رئيس الهيئة، وعبير صالح، مستشارة رئيس الهيئة. تناول اللقاء بحث التعاون فى قطاع التأمين والملفات ذات الاهتمام المشترك، حيث تتقاطع اختصاصات البنك الروسى والهيئة العامة للرقابة المالية المصرية فى عدد من الأنشطة كالتأمين والتمويل ونشر الثقافة المالية. استعرض الجانبان التطورات التى تشهدها الأسواق المالية غير المصرفية فى كل من مصر وروسيا، والفرص المتاحة لتوسيع مجالات التنسيق وتبادل الخبرات على ضوء عضويتهما فى تجمع «بريكس» والتفاهمات المشتركة بين دول المجموعة. وأكد الدكتور إسلام عزام، حرص الهيئة على التعاون مع مختلف المؤسسات الرقابية والمالية الدولية، بما يضمن مواكبة التطورات العالمية، ويدعم أداء الأنشطة المالية غير المصرفية فى مصر ويدفعها نحو مزيد من الابتكار والنمو المستدام. ومن جانبه، ذكر أليكسى جزنوف أن العلاقات المصرية الروسية تشهد تطورًا مستمرًا على مختلف المستويات، مدعومةً بالإرادة المشتركة للقيادة السياسية فى البلدين، مما يعزز فرص التعاون الإيجابى فى الأنشطة الاقتصادية بين القاهرة وموسكو. وفى نهاية اللقاء؛ توافق الجانبان على استمرار التواصل حول الملفات المشتركة ودراستها، وتبادلا الهدايا التذكارية.,2026-06-14T09:42:32.332258+00:00,
almasry,tier1,https://www.almasryalyoum.com/news/details/4291874,انخفاض كبير للكيلو.. أسعار الفراخ اليوم السبت 13 يونيو 2026 فى بورصة الدواجن (والشعبة توجه تحذير) | المصري اليوم,حنان الوالي,2026-06-13 10:13:00+00:00,انخفضت أسعار الفراخ البيضاء اليوم الأربعاء 10 يونيو 2026، فى بورصة الدواجن والمزرعة، حيث تراجع سعر كيلو الفراخ البيضاء بقيمة 5 جنيهات فى المزرعة، فيما استقرت أسعار البيض، وخلال...,المصري اليوم,ar,374,أحمد علي عبدالغني انخفاض كبير للكيلو.. أسعار الفراخ اليوم السبت 13 يونيو 2026 فى بورصة الدواجن (والشعبة توجه تحذير) أحمد علي عبدالغني انخفاض كبير للكيلو.. أسعار الفراخ اليوم السبت 13 يونيو 2026 فى بورصة الدواجن (والشعبة توجه تحذير) انخفضت أسعار الفراخ البيضاء اليوم الأربعاء 10 يونيو 2026، فى بورصة الدواجن والمزرعة، حيث تراجع سعر كيلو الفراخ البيضاء بقيمة 5 جنيهات فى المزرعة، فيما استقرت أسعار البيض، وخلال السطور التالية نرصد تحديثات أسعار الفراخ اليوم والبيض. أسعار الفراخ البيضاء اليوم الأربعاء 10 يونيو 2026 أحمد علي عبدالغني انخفاض كبير للكيلو.. أسعار الفراخ اليوم السبت 13 يونيو 2026 فى بورصة الدواجن (والشعبة توجه تحذير) وسجلت أسعار الفراخ البيضاء ، اليوم الأربعاء 10 يونيو 2026، نحو 61 جنيها فى المزرعة، ليصل سعر الفراخ البيضاء اليوم للمستهلك إلى 71 جنيهًا للكيلو. أسعار الفراخ الساسو اليوم كما سجلت أسعار الفراخ الساسو، اليوم الأربعاء 10 يونيو 2026، نحو 100 جنيها فى المزرعة وبورصة الدواجن، بينما يسجل سعر الفراخ الساسو فى المحال 110 جنيها. أسعار الديك الرومي أما سعر كيلو الرومى سجل 190 جنيها، بينما يصل سعر «الديك» وزن 7 كيلو 1330 جنيها، بينما يصل سعر الديك الرومى وزن 10 كيلو 1900 جنيه، ويسجل كيلو الرومى الخالى من العظم 400 جنيه. سعر البانيه اليوم انخفاض كبير للكيلو.. أسعار الفراخ اليوم السبت 13 يونيو 2026 فى بورصة الدواجن (والشعبة توجه تحذير) فيما سجل سعر كيلو البانيه من «200 - 210 جنيهات للكيلو». أسعار الكتكوت الأبيض اليوم ووصلت أسعار الكتكوت الأبيض فى الشركات ل26 جنيها حسب التحديثات. أسعار البيض اليوم فى المزرعة سجلت أسعار البيض الأبيض، اليوم الأربعاء 10 يونيو 2026، نحو 75 جنيها للكرتونة، بينما سجل البيض الأحمر 85 جنيها للكرتونة، وسعر البيض البلدى 90 جنيهات للكرتونة. شعبة الدواجن تحدد أسباب تراجع الأسعار انخفاض كبير للكيلو.. أسعار الفراخ اليوم السبت 13 يونيو 2026 فى بورصة الدواجن (والشعبة توجه تحذير) قال الدكتور عبدالعزيز السيد، رئيس شعبة الدواجن باتحاد الغرف التجارية بالقاهرة، إن انخفاض أسعار الدواجن والبيض خلال الفترة الحالية أمر غير منطقى واستمرار الانخفاض سيؤدى لخروج العاملين بالمنظومة، لافتا إلى أن هذا الإنخفاض بسبب الإنتاج المتزايد من الدواجن والبيض. وأضاف السيد، فى تصريحات خاصة ل«المصرى اليوم»، أن أقل تكلفة يسجلها سعر كيلو الفراخ هو 56 جنيه، وقد حقق سعر كيلو الفراخ البيضاء هذه القيمة قبل رمضان، مشيرا إلى أن تراجع الفراخ مرة أخرى لهذه القيمة أمر خطر لأنه يهدد بخروج المربيين من المنظومة.,2026-06-14T09:42:32.931697+00:00,
almasry,tier1,https://www.almasryalyoum.com/news/details/4292114,سعر كيلو الفراخ البيضاء بعد الانخفاض الكبير.. أسعار الدواجن اليوم السبت 13-6-2026 بالأسواق والبورصة | المصري اليوم,بلال أحمد,2026-06-13 16:20:00+00:00,شهد سعر كيلو الفراخ البيضاء اليوم السبت الموافق 13 يونيو 2026، استقرارًا داخل أسواق ومحلات بيع الدواجن وبورصة الدواجن الآن، وذلك عقب الانخفاض الأخير الذى شهدته أسعار الدواجن...,المصري اليوم,ar,212,سعر كيلو الفراخ البيضاء اليوم السبت الموافق 13 يونيو 2026، استقرارًا داخل أسواق ومحلات بيع الدواجن وبورصة الدواجن الآن، وذلك عقب الانخفاض الأخير الذى شهدته أسعار الدواجن بنحو 5 جنيهات. سعر كيلو الفراخ البيضاء اليوم السبت فى مصر ونستعرض خلال التقرير التالى، أسعار الدواجن اليوم السبت الموافق 13 يونيو 2026 فى الأسواق والبورصة، بالإضافة إلى سعر كيلو الفراخ البيضاء الآن بعد الارتفاع، وجاءت الأسعار على النحو الآتى: سعر كيلو الفراخ البيضاء اليوم واستقر سعر كيلو الفراخ البيضاء، اليوم السبت الموافق 13 يونيو 2026 داخل المزارع عند مستوى 61 جنيهًا، فى حين بلغ متوسط سعر بيعها للمستهلك فى الأسواق المحلية نحو 71 جنيهًا للكيلو. سعر كيلو الفراخ الساسو اليوم وسجل سعر كيلو الفراخ الساسو، اليوم السبت الموافق 13 يونيو 2026 استقرارًا داخل المزارع عند مستوى 80 جنيهًا، فى حين بلغ متوسط سعر بيعها للمستهلك فى الأسواق المحلية نحو 90 جنيهًا للكيلو. سعر كيلو الفراخ الأمهات اليوم وحقق سعر كيلو الفراخ الأمهات، اليوم السبت الموافق 13 يونيو 2026 استقرارًا داخل المزارع عند مستوى 54 جنيهًا، فى حين بلغ متوسط سعر بيعها للمستهلك فى الأسواق المحلية نحو 64 جنيهًا للكيلو. سعر كيلو الفراخ البلدى اليوم ووصل كيلو الفراخ البلدى، اليوم السبت الموافق 13 يونيو 2026 داخل المزارع إلى مستوى 84 جنيهًا، فى حين بلغ متوسط سعر بيعها للمستهلك فى الأسواق المحلية نحو 94 جنيها للكيلو.,2026-06-14T09:42:33.018363+00:00,
almasry,tier1,https://www.almasryalyoum.com/news/details/4292141,قطاع الدواجن فى أزمة حقيقية.. الشعبة: الفراخ والبيض يباعان بأقل من التكلفة | المصري اليوم,خالد مصطفى,2026-06-13 16:54:00+00:00,قال سامح السيد، رئيس شعبة الدواجن بغرفة الجيزة التجارية، إن قطاع الدواجن فى مصر يواجه أزمة حقيقية بسبب غياب بورصة رسمية تحدد الأسعار بشكل عادل، مشيرًا إلى أن هذا الوضع أدى إلى...,المصري اليوم,ar,156,قال سامح السيد، رئيس شعبة الدواجن بغرفة الجيزة التجارية، إن قطاع الدواجن فى مصر يواجه أزمة حقيقية بسبب غياب بورصة رسمية تحدد الأسعار بشكل عادل، مشيرًا إلى أن هذا الوضع أدى إلى خسائر كبيرة للمنتجين وصلت إلى مستويات غير مسبوقة. وأضاف «السيد»، فى تصريحات ببرنامج «الحياة اليوم» على قناة «الحياة»، مساء السبت، أن غياب البورصة جعل الأسعار تخضع للعشوائية والمضاربات، وهو ما انعكس سلبًا على المنتجين والمستهلكين معًا، إذ يباع البيض والدواجن بأسعار أقل من تكلفة الإنتاج، ما يهدد استمرارية المزارع. وأضاف أن البورصة التى كانت قائمة فى بنها توقفت منذ أكثر من 13 عامًا، مطالبًا بإعادة تشغيلها تحت إشراف الدولة ومشاركة الخبراء لضمان تحديد سعر عادل وهامش ربح منطقى، بما يحقق التوازن بين العرض والطلب ويحمى صحة المواطن. ولفت إلى أن بعض الممارسات غير القانونية، مثل الذبح فى أماكن غير مؤهلة، تمثل خطرًا على الصحة العامة، مؤكدًا أن القيادة السياسية تولى اهتمامًا كبيرًا بهذا الملف وتسعى إلى إيجاد حلول جذرية تضمن استقرار السوق وحماية المستهلك.,2026-06-14T09:42:33.382548+00:00,
almasry,tier1,https://www.almasryalyoum.com/news/details/4292491,بعد الهبوط الكبير فى سعر الفراخ البيضاء.. أسعار الدواجن اليوم الأحد 14-6-2026 للمستهلك | المصري اليوم,آية يوسف,2026-06-14 07:22:00+00:00,حافظ سعر الفراخ البيضاء اليوم الأحد 14 يونيو 2026 على آخر مستوياته، بعد أن انخفض سعر كيلو الفراخ بنحو 5 جنيهات، أمس داخل بورصة الدواجن والمحال فى محافظة القاهرة.كم سجل سعر الفراخ...,المصري اليوم,ar,296,بعد الهبوط الكبير فى سعر الفراخ البيضاء.. أسعار الدواجن اليوم الأحد 14-6-2026 للمستهلك | المصري اليوم خدمات بعد الهبوط الكبير فى سعر الفراخ البيضاء.. أسعار الدواجن اليوم الأحد 14-6-2026 للمستهلك سعر كيلو الفراخ البيضاء اليوم فى المزارع الأحد 14-06-2026 10:22 كتب: آية يوسف أحمد علي عبدالغني بعد الهبوط الكبير فى سعر الفراخ البيضاء.. أسعار الدواجن اليوم الأحد 14-6-2026 للمستهلك تصوير : أحمد علي عبدالغني أحمد علي عبدالغني بعد الهبوط الكبير فى سعر الفراخ البيضاء.. أسعار الدواجن اليوم الأحد 14-6-2026 للمستهلك حافظ سعر الفراخ البيضاء اليوم الأحد 14 يونيو 2026 على آخر مستوياته، بعد أن انخفض سعر كيلو الفراخ بنحو 5 جنيهات، أمس داخل بورصة الدواجن والمحال فى محافظة القاهرة. كم سجل سعر الفراخ البيضاء اليوم الأحد للمستهلك فى المزرعة والأسواق؟ استقرت أسعار الفراخ البيضاء اليوم الأحد، داخل المحال والبورصة، ليسجل سعر الكيلو الأسعار التالية: سعر كيلو الفراخ البيضاء داخل المزرعة و البورصة سعر كيلو الفراخ البيضاء بالأسواق والمحال تباع ب 61 جنيهًا. تباع ب 71 جنيها. للمعرفة: سعر الفراخ البيضاء للمستهلك اليوم الأحد 14 يونيو 2026 فى الأسواق والمزارع.. بورصة الدواجن الآن كم سجل سعر الفراخ الساسو اليوم الأحد؟ استقرت أسعار الفراخ الساسو اليوم الأحد 14 يونيو 2026 داخل المحال والبورصة، ليسجل سعر كيلو الفراخ التالى: سعر كيلو الفراخ الساسو داخل المزرعة والبورصة سعر كيلو الفراخ الساسو بالأسواق والمحال تباع ب78 جنيهًا. تباع ب88 جنيها. سعر الفراخ الأمهات اليوم الأحد فى المزرعة والأسواق استقرت أسعار الفراخ الأمهات اليوم الأحد، داخل المحال والبورصة، ليسجل سعر كيلو الفراخ التالى: سعر كيلو الفراخ الأمهات داخل المزرعة والبورصة سعر كيلو الفراخ الأمهات بالأسواق والمحال تباع ب55 جنيهًا. تباع ب65 جنيهًا. سعر الفراخ البلدى اليوم الأحد فى المزرعة والأسواق استقرت أسعار الفراخ البلدى، اليوم، داخل المحال والبورصة، ليسجل سعر كيلو الفراخ التالى: سعر كيلو الفراخ البلدي داخل المزرعة والبورصة سعر كيلو الفراخ البلدي بالأسواق والمحال تباع ب82 جنيها. تباع ب92 جنيها.,2026-06-14T09:42:33.967371+00:00,
almasry,tier1,https://www.almasryalyoum.com/news/details/4292319,أسعار الفراخ البيضاء والساسو وطبق البيض الأبيض والأحمر الأحد 14 يونيو 2026 | المصري اليوم,منار عصام,2026-06-13 21:13:00+00:00,سعر الفراخ البيضاء والساسو.. شهدت أسعار الفراخ البيضاء اليوم الاحد 14 يونيو 2026، استقرار خلال تعاملات بورصة الدواجن والأسواق، فيما ثبت سعر كيلو الفراخ الساسو بالمزرعة، وكذا...,المصري اليوم,ar,156,أسعار الفراخ اليوم في أسواق الإسكندرية - صورة أرشيفية أسعار الفراخ اليوم في أسواق الإسكندرية - صورة أرشيفية سعر الفراخ البيضاء والساسو .. شهدت أسعار الفراخ البيضاء اليوم الاحد 14 يونيو 2026، استقرار خلال تعاملات بورصة الدواجن والأسواق ، فيما ثبت سعر كيلو الفراخ الساسو بالمزرعة، وكذا استقر سعر البيض الأحمر اليوم ووفقًا لآخر تحديث لبورصة الدواجن. وجاءت أسعار الفراخ والبيض وفقًا لبورصة الدواجن على النحو التالي: أسعار الفراخ اليوم في أسواق الإسكندرية - صورة أرشيفية أخبار متعلقة سجلت أسعار الفراخ البيضاء 60: 61 جنيهًا/ كيلو، لتباع فى الأسواق 70 : 71 جنيهًا تراوحت أسعار الدواجن الحمراء الساسو بين 96 و 95 جنيهًا للكيلو فى البورصة، لتباع بالأسواق ما بين 104و 105جنيهًا للكيلو أسعار الفراخ اليوم في أسواق الإسكندرية - صورة أرشيفية سعر كيلو البانيه تراوح بين 230 و 250 جنيهًا باختلاف الأسواق. أسعار البيض اليوم الأحد 14 يونيو 2026 أحمد علي عبدالغني أسعار الفراخ في الأسواق - صورة أرشيفية العرض والطلب. تكاليف الإنتاج. العوامل البيئية.,2026-06-14T09:42:34.070197+00:00,
almasry,tier1,https://www.almasryalyoum.com/news/details/4292343,بكام الفراخ البيضاء؟.. أسعار الدواجن والبيض في أسواق الشرقية اليوم الأحد 14-6-2026 | المصري اليوم,وليد صالح,2026-06-13 22:05:00+00:00,استقرت أسعار الفراخ البيضاء والحمراء،اليوم الأحد 14 يونيو 2026، خلال تعاملات الأسواق في الشرقية، وذلك بعد أن تذبذبت أسعار الدواجن والبيض بأنواعها بين الإرتفاع والانخفاض خلال...,المصري اليوم,ar,359,بكام الفراخ البيضاء؟.. أسعار الدواجن والبيض في أسواق وبورصة الشرقية الأحد 14-6-2026 بكام الفراخ البيضاء؟.. أسعار الدواجن والبيض في أسواق وبورصة الشرقية الأحد 14-6-2026 استقرت أسعار الفراخ البيضاء والحمراء ،اليوم الأحد 14 يونيو 2026، خلال تعاملات الأسواق في الشرقية ، وذلك بعد أن تذبذبت أسعار الدواجن والبيض بأنواعها بين الإرتفاع والانخفاض خلال الأيام الماضية. بكام الفراخ البيضاء؟.. أسعار الدواجن والبيض في أسواق وبورصة الشرقية الأحد 14-6-2026 واستقرت أسعار البيض الأحمر والأبيض اليوم ، وفقاً لتعاملات البورصة والأسواق في الشرقية،خلال ختام الأيام الماضية أمام منتجي الدواجن والبيض. بكام الفراخ البيضاء؟.. أسعار الدواجن والبيض في أسواق وبورصة الشرقية الأحد 14-6-2026 سعر الفراخ البيضاء في الشرقية اليوم الأحد 14 يونيو 2026 بكام الفراخ البيضاء؟.. أسعار الدواجن والبيض في أسواق وبورصة الشرقية الأحد 14-6-2026 سعر الفراخ البيضاء في المزارع 60 جنيهًا للكيلو، وتتراوح في الأسواق ما بين 65 إلى 70 جنيهات. سجل سعر كيلو الفراخ الأبيض البياض 45 جنيهًا، وتتراوح فيه الأسواق ما بين 50 إلى 55 جنيهًا. سعر الفراخ الحمراء في الشرقية اليوم الأحد 14 يونيو 2026 آخرون أسعار الفراخ والبيض اليوم سجل سعر كيلو الفراخ الأحمر البياض 70 جنيهًا، وتتراوح في الأسواق ما بين 75 إلى 80 جنيهًا. سجل سعر كيلو الفراخ الساسو الأحمر 95 جنيها، وتتراوح في الأسواق ما بين 100 إلى 105 جنيهات. سجل سعر كيلو الفراخ الساسو الرزي في المزارع 100 جنيه، وتتراوح في الأسواق ما بين 105 إلى 110 جنيهات. سعر الفراخ الأمهات البيضاء بالشرقية الأحد 14 يونيو 2026 آخرون بكام الفراخ البيضاء؟.. أسعار الدواجن والبيض في أسواق وبورصة الشرقية الأحد 14-6-2026 سجل سعر كيلو الفراخ الأمهات البيضاء في المزارع 55 جنيهًا، وتتراوح في الأسواق ما بين 60 و 65 جنيهًا. سعر الكتكوت في الشرقية اليوم اليوم الأحد 14 يونيو 2026 آخرون أسعار الفراخ والبيض والكتاكيت - صورة أرشيفية تراوح سعر الكتكوت الأهالي ما بين 10 و 12 جنيهًا. تراوح سعر الكتكوت الشركات ما بين 15 و 20 جنيهًا. سعر البيض في الشرقية اليوم اليوم الأحد 14 يونيو 2026 آخرون أسعار الفراخ والبيض اليوم سعر كرتونة البيض الأحمر 80 جملة وللمستهلك تتراوح ما بين 85 إلى 90 جنيهاً. سعر كرتونة البيض الأبيض 70 جنيهًا جملة وللمستهلك تتراوح ما بين 75 إلى 80 جنيهًا. سعر كرتونة البيض البلدي 90 جنيهًا جملة وللمستهلك تتراوح بين 95 إلى 100 جنيه.,2026-06-14T09:42:34.513767+00:00,
