site,tier,url,title,author,published_at,description,site_name,language,word_count,text,extracted_at,error
youm7,tier1,https://www.youm7.com/story/2026/5/27/%D8%B3%D9%81%D9%8A%D8%B1-%D8%AA%D8%B1%D9%83%D9%8A%D8%A7-%D9%8A%D8%AD%D8%AA%D9%81%D9%84-%D8%A8%D8%B9%D9%8A%D8%AF-%D8%A7%D9%84%D8%A3%D8%B6%D8%AD%D9%89-%D9%85%D8%B9-%D8%B9%D8%A7%D8%A6%D9%84%D8%A7%D8%AA-%D8%AA%D8%B1%D9%83%D9%8A%D8%A9-%D9%88%D9%81%D9%84%D8%B3%D8%B7%D9%8A%D9%86%D9%8A%D8%A9-%D9%88%D9%85%D8%B5%D8%B1%D9%8A%D8%A9/7430720,سفير تركيا يحتفل بعيد الأضحى مع عائلات تركية وفلسطينية ومصرية - اليوم السابع,كتبت رباب فتحى,2026-05-27 18:55:00+00:00,نظّمت سفارة تركيا في القاهرة، في اليوم الأول من عيد الأضحى، فعالية خاصة بالعيد جمعت المواطنين الأتراك المقيمين في مصر، وعائلات فلسطينية من غزة، والعائلات المصرية.,اليوم السابع,ar,375,نظّمت سفارة تركيا في القاهرة ، في اليوم الأول من عيد الأضحى، فعالية خاصة بالعيد جمعت المواطنين الأتراك المقيمين في مصر، وعائلات فلسطينية من غزة، والعائلات المصرية. 150 عائلة فلسطينية و50 ومصرية وشارك في الفعالية 150 عائلة فلسطينية، و50 عائلة مصرية، وعدد كبير من العائلات التركية، كما دُعي إليها عدد كبير من ممثلي وسائل الإعلام. الاحتفال وخلال الفعالية، قُدّمت للضيوف وجبة القاوِرما وهي عبارة عن لحم الأضحية المطهو على الطريقة التركية الخاصة بعيد الأضحى في تركيا. كذلك، تم تقديم هدايا أخرى للضيوف أثناء تبادل التهاني بالعيد. وقد نُظّمت فعالية العيد من قبل سفارة تركيا في القاهرة بدعم من وقف الديانة التركي وبالتعاون مع السفارة الفلسطينية. كما شارك في الدعوة عدد من الفنانين المصريين. عيد الاضحى من أهم الواجبات الدينية وفي كلمة ألقاها خلال فعالية عيد الأضحى، أعرب السفير صالح موطلو شن عن بالغ سعادته وحمده لله على هذا الجمع مجددًا مع العائلات الفلسطينية والمصرية في هذا العيد أيضًا. وأوضح أن مناسبة عيد الأضحى تُعد من أهم الواجبات في ديننا، حيث تتجسّد فيها معاني التكافل والتضامن والمشاركة وتتحول إلى واقع عملي. وأضاف أن هذا اليوم هو اليوم الذي يشارك فيه أصحاب الإمكانات أو المقتدرين أضحياتهم التي يذبحونها ويشاركونها بحسب إمكاناتهم مع الآخرين الذين لا يستطيعون ذبح الأضاحي، ومع جيرانهم وأقاربهم والمحتاجين، دون تمييز في اللون أو الجنس أو اللغة أو الدين. وأعرب عن سعادتهم بلقاء ممثلي وأفراد الشعب الفلسطيني الشقيق والشعب المصري الشقيق هنا، ومشاركتهم هذا العطاء والتضامن وأداء هذه الشعيرة. الاحتفالية تركيا تحتفل بأسبوع الأسرة ولفت السفير شن الانتباه إلى أن هذا الأسبوع يُعد أسبوعا هاما جدا حيث يتم الاحتفال به في تركيا باعتباره أسبوع الأسرة، مشيرًا إلى أنهم يشعرون بسعادة خاصة لاستضافة العائلات الفلسطينية المتضررة والمظلومة والتضامن معها بوصفها عائلات أيضًا. وأضاف أن رئيس جمهورية تركيا رجب طيب أردوغان، والرئيس عبد الفتاح السيسي، يبذلان كل الجهود الممكنة لتعزيز الأسرة ودعمها اجتماعيًا، ويطبّقان برامج اجتماعية واقتصادية متعددة في هذا المسار. عقد الأسرة كما أوضح السفير شن أن تركيا أعلنت، بقيادة الرئيس أردوغان، بدءًا من عام 2026 «عقد الأسرة»، وأن الدولة التركية ستتخذ، خلال هذا الأسبوع وخلال هذا العقد، جميع التدابير اللازمة لتعزيز وحدة الأسرة وتماسكها، وتلبية الاحتياجات الاجتماعية والاقتصادية للأمهات والآباء والأزواج والأطفال والمتزوجون حديثا بشكل كامل، وحمايتهم من الأفكار والتيارات المضللة، مهنئا الجميع بمناسبة أسبوع الأسرة متمنيا أن يكون أسبوع الأسرة مصدر بهجة وخير للجميع، وبلغ إجمالي عدد المشاركين في الفعالية نحو 500 شخص.,2026-05-28T10:11:57.185313+00:00,
almasry,tier1,https://www.almasryalyoum.com/news/details/4280286,بعد ارتفاع سعر الفراخ البيضاء.. أسعار الدواجن اليوم الخميس 28-5-2026 للمستهلك | المصري اليوم,آية يوسف,2026-05-28 07:42:00+00:00,استقر سعر الفراخ البيضاء اليوم الخميس 28 مايو 2026، بعد أن ارتفع سعر كيلو الفراخ بنحو 3 جنيهات، داخل بورصة الدواجن والمحال فى محافظة القاهرة.كم سجل سعر الفراخ البيضاء اليوم...,المصري اليوم,ar,285,بعد ارتفاع سعر الفراخ البيضاء.. أسعار الدواجن اليوم الخميس 28-5-2026 للمستهلك | المصري اليوم خدمات بعد ارتفاع سعر الفراخ البيضاء.. أسعار الدواجن اليوم الخميس 28-5-2026 للمستهلك سعر كيلو الفراخ البيضاء اليوم فى المزارع الخميس 28-05-2026 10:42 كتب: آية يوسف أحمد علي عبدالغني بعد ارتفاع سعر الفراخ البيضاء.. أسعار الدواجن اليوم الخميس 28-5-2026 للمستهلك تصوير : أحمد علي عبدالغني أحمد علي عبدالغني بعد ارتفاع سعر الفراخ البيضاء.. أسعار الدواجن اليوم الخميس 28-5-2026 للمستهلك استقر سعر الفراخ البيضاء اليوم الخميس 28 مايو 2026، بعد أن ارتفع سعر كيلو الفراخ بنحو 3 جنيهات، داخل بورصة الدواجن والمحال فى محافظة القاهرة. كم سجل سعر الفراخ البيضاء اليوم الخميس للمستهلك فى المزرعة والأسواق؟ استقرت أسعار الفراخ البيضاء اليوم الخميس، داخل المحال والبورصة، ليسجل سعر الكيلو الأسعار التالية: سعر كيلو الفراخ البيضاء داخل المزرعة و البورصة سعر كيلو الفراخ البيضاء بالأسواق والمحال تباع ب 71 جنيهًا. تباع ب 81 جنيها. للمعرفة: سعر الفراخ البيضاء للمستهلك اليوم الخميس 28 مايو 2026 في الأسواق والمزارع.. بورصة الدواجن الآن كم سجل سعر الفراخ الساسو اليوم الخميس؟ استقرت أسعار الفراخ الساسو اليوم الخميس 28 مايو 2026 داخل المحال والبورصة، ليسجل سعر كيلو الفراخ التالى: سعر كيلو الفراخ الساسو داخل المزرعة والبورصة سعر كيلو الفراخ الساسو بالأسواق والمحال تباع ب81 جنيهًا. تباع ب91 جنيها. سعر الفراخ الأمهات اليوم الخميس فى المزرعة والأسواق استقرت أسعار الفراخ الأمهات اليوم الخميس، داخل المحال والبورصة، ليسجل سعر كيلو الفراخ التالى: سعر كيلو الفراخ الأمهات داخل المزرعة والبورصة سعر كيلو الفراخ الأمهات بالأسواق والمحال تباع ب64 جنيهًا. تباع ب74 جنيهًا. سعر الفراخ البلدى اليوم الخميس فى المزرعة والأسواق استقرت أسعار الفراخ البلدى، اليوم الخميس، داخل المحال والبورصة، ليسجل سعر كيلو الفراخ التالى: سعر كيلو الفراخ البلدي داخل المزرعة والبورصة سعر كيلو الفراخ البلدي بالأسواق والمحال تباع ب90 جنيها. تباع ب100 جنيه.,2026-05-28T10:11:57.445549+00:00,
almasry,tier1,https://www.almasryalyoum.com/news/details/4280229,سعر الفراخ البيضاء للمستهلك اليوم الخميس 28 مايو 2026 في الأسواق والمزارع.. بورصة الدواجن الآن | المصري اليوم,محمود أحمد الشاهد,2026-05-28 03:23:00+00:00,حافظت أسعار الدواجن في المزارع على استقرارها عند مستويات ما قبل إجازة العيد، حيث استقر سعر كيلو الفراخ البيضاء عند 71 جنيهًا وكانت أسواق القاهرة قد سجلت في وقت سابق ارتفاعا...,المصري اليوم,ar,138,سعر الفراخ البيضاء للمستهلك سعر الفراخ البيضاء للمستهلك حافظت أسعار الدواجن في المزارع على استقرارها عند مستويات ما قبل إجازة العيد، حيث استقر سعر كيلو الفراخ البيضاء عند 71 جنيهًا وكانت أسواق القاهرة قد سجلت في وقت سابق ارتفاعا طفيفا بقيمة 3 جنيهات في سعر الكيلو للمستهلك النهائي. سعر الفراخ البيضاء اليوم للمستهلك تراوحت أسعار بيع الفراخ البيضاء للمستهلك حول 81 جنيهًا للكيلو في الأسواق المحلية، بينما ثبت سعر الكيلو من أرض المزرعة عند مستوى 71 جنيهًا . أسعار الدواجن اليوم الخميس 28 مايو 2026 أسعار الفراخ البلدى اليوم سجل سعر الكيلو داخل المزارع نحو 90 جنيهًا، فيما يصل إلى المستهلك في الأسواق ومحال البيع بمتوسط يقارب 100 جنيه للكيلو. سعر الفراخ الساسو اليوم بلغ سعر الكيلو داخل المزارع نحو 81 جنيها، فيما وصل متوسط سعر البيع للمستهلك داخل الأسواق الشعبية ومحال التجزئة إلى حوالي 91 جنيهًا للكيلو.,2026-05-28T10:11:57.867712+00:00,
almasry,tier1,https://www.almasryalyoum.com/news/details/4280046,تطورات جديدة في اتفاقية السلام بين أمريكا وإيران تخفض سعر النفط لأدنى مستوى في شهر | المصري اليوم,زين دياب,2026-05-27 15:35:00+00:00,واصل النفط خسائره اليوم الأربعاء، متراجعاً بأكثر من 5% بعد أن ذكر التلفزيون الإيراني الرسمي أنه اطلع على مسودة إطار عمل أولي غير رسمي لاتفاق مع الولايات المتحدة الأمريكية...,المصري اليوم,ar,382,تطورات جديدة في اتفاقية السلام بين أمريكا وإيران تخفض سعر النفط لأدنى مستوى في شهر تطورات جديدة في اتفاقية السلام بين أمريكا وإيران تخفض سعر النفط لأدنى مستوى في شهر واصل النفط خسائره اليوم الأربعاء، متراجعاً بأكثر من 5% بعد أن ذكر التلفزيون الإيراني الرسمي أنه اطلع على مسودة إطار عمل أولي غير رسمي لاتفاق مع الولايات المتحدة الأمريكية لإنهاء نزاعهما وإعادة فتح مضيق هرمز. ووفق رويترز، فإنه بعد إعلان التقرير من قبل التليفزيون الإيراني، بالإضافة إلى زيادة حركة ناقلات النفط عبر المضيق، تراجع تأثير تصريحات إيران السابقة بأن الولايات المتحدة انتهكت وقف إطلاق النار، وكذلك إبلاغ ناقلة نفط أمس الثلاثاء عن وقوع انفجار قبالة سواحل عمان. سعر النفط يسجل أدنى مستوى في شهر وانخفضت العقود الآجلة لخام برنت بمقدار 3.66 دولار، أو 3.7%، لتصل إلى 95.92 دولارًا للبرميل، بينما خسر الخام الأمريكي، غرب تكساس الوسيط 5.19 دولار، أو 5.59%، ليصل إلى 88.70 دولارًا. ومحت الخسائر مكاسب خام برنت التي حققها، أمس الثلاثاء، وبلغ سعر خام برنت وخام غرب تكساس الوسيط أدنى مستوياتهما خلال جلسة التداول يوم الأربعاء، حيث سجلا 94.16 دولارًا و87.77 دولارًا للبرميل على التوالي، وهو أدنى مستوى لهما منذ أكثر من شهر. تقدم نحو إنهاء أزمة الإمدادات وهناك تقدماً ملموساً نحو إنهاء أزمة الإمدادات، مع ازدياد عدد السفن العابرة لمضيق هرمز، وهذا التقدم يقود المشهد. أعلن التلفزيون الإيراني الرسمي أن الولايات المتحدة ستسحب قواتها العسكرية من محيط إيران وسترفع الحصار البحري المفروض عليها، مضيفاً أن إدارة حركة السفن عبر مضيق هرمز ستتولاها إيران بالتعاون مع سلطنة عمان. حتى الآن لا يوجد ما يشير إلى أن هذا الأمر يختلف عما كان يتم سماعه من قبل، لكن هناك تفاعل من الأسواق مع تطورات الأحداث، وقد أشار الإيرانيون إلى أن التوصل إلى اتفاق ليس وشيكاً.وارتفعت العقود الآجلة لخام برنت لشهر يوليو بنسبة 3.6% في الجلسة السابقة بعد أن شنت الولايات المتحدة ضربات جديدة في إيران، مما أضر بالآمال التي ارتفعت خلال عطلة نهاية الأسبوع بأن واشنطن وطهران ستتوصلان إلى اتفاق سلام. وصعّدت إسرائيل قصفها في لبنان أمس الثلاثاء، مما زاد من توتر جهود السلام بعد وقف إطلاق النار في أبريل في النزاع الذي استمر 3 أشهر، بينما أشار كلا الجانبين إلى أنهما أحرزا تقدماً في المحادثات نحو إعادة فتح المضيق. الحرب تخفض تدفقات 14 مليون برميل يوميًا ووفقاً لوكالة الطاقة الدولية، أدى إغلاق إيران الفعلي لمضيق هرمز إلى توقف إمدادات النفط في الشرق الأوسط عن العمل بأكثر من 14 مليون برميل يومياً.,2026-05-28T10:11:59.288686+00:00,
almasry,tier1,https://www.almasryalyoum.com/news/details/4280260,«XPeng».. وحكايات أغرب من الخيال! | المصري اليوم,خالد أباظة,2026-05-28 05:03:00+00:00,سيارة ب «تطير».. وإنسان ألى صعب تفرقه عن أى بشر.. وعقد ب« 700 مليون يورو».. ومستهلك مصرى يناقش الإدارة الصينية العليا فى خصائص ومواصفات السيارة.. وأخيراً إحتفال بصدارة المبيعات...,المصري اليوم,ar,863,سيارة ب «تطير».. وإنسان ألى صعب تفرقه عن أى بشر.. وعقد ب« 700 مليون يورو».. ومستهلك مصرى يناقش الإدارة الصينية العليا فى خصائص ومواصفات السيارة.. وأخيراً إحتفال بصدارة المبيعات فى السوق المصرية ! بالتأكيد كل هذه الجمل و«الألغاز» تبدو كأنها «لوغاريتم» أو بالإنجليزية Puzzle يجب ترتيبه بالشكل السليم لنصل لمعنى مفهوم أو جملة مفيدة.. تعالوا أشرح لكم هذه الكلمات الغريبة والجمل المبهمة.. لأن وراء كل واحدة قصة حقيقية.. مثيرة جداً وغريبة للغاية! هو توكيل سيارات صينى اسمه «XPeng» تأسس فى 15 أغسطس من عام 2014.. أى أن عمره 12 عاماً فقط فى عالم السيارات على الصعيد الدولى.. ومقرها الرئيسى فى مدينة «جوانزو» الصينية.. وتخصصت من اليوم الأول فى إنتاج السيارات الكهربائية فقط.. ولم تعرف فى تاريخها محركات البنزين العادية أبداً.. مؤسس الشركة - هو شياوبونج - قرر من اليوم الأول أنه سيعمل على إنتاج أكثر سيارة «ذكية» فى العالم.. بعيداً عن قصص الشكل الجميل والأداء القوى و الراحة داخل السيارة.. والكماليات وخلافه.. التى شعر أن الجميع فى الصين يركزون عليها.. ولكنه كان «رجل مختلف» ورفع شعار «الذكاء» داخل سيارتي! وبالفعل.. بدأ فى وضع تكنولوجيا غريبة وعجيبة داخل السيارات مع الوقت.. نظام «الليدار» الذى لم يكن معروفاً.. وهو يعتمد على نبضات الليزر لإعادة تكوين مساحة ثلاثية الأبعاد وذلك من خلال قياس المسافة بين «النظام والأجسام» بناء على الوقت الذى يستغرقه ضوء الليزر للإرتداد.. ولمزيدأ من السهولة فى الشرح.. هذا النظام يرصد بشکل فائق الدقة الأجسام الصغيرة على الطريق والتى تظهر فجأة أمام السيارة حتى وهى مسرعة.. مثل حيوان أليف صغير الحجم.. قطة مثلاً.. طفل صغير يمشى أو حتى يحبو.. مروراً بدراجة نارية أو عجلة.. وهذا الاختراع - الليدار - يستطيع رصد هذه الأجسام فى ضوء النهار وفى الظلام أيضاً.. و يتمكن من إرسال تحذيرات فورية فى سرعة خيالية لكمبيوتر السيارة.. وهو يتولى اتخاذ قرار فورى وسريع بالتعامل مع هذا الجسم الغريب سواء بتفاديه لو أمكن.. أو بإيقاف السيارة فوراً قبل الاصطدام بهذا الجسم .. كل هذه العمليات والإجراءات تحدث والمفترض أن سائق السيارة لم يلاحظ الجسم أصلاً ولم يتدخل بنفسه لإيقاف السيارة ومنع حادث أو كارثة!.. وعلى هذا النحو.. وغيره.. خرجت سيارة «XPeng» للنور.. وللعالم أجمع لتكون «الأذكى» بين الجميع.. بخصائص ومميزات وأفكار ليست موجودة عند أحد.. ومع الوقت بدأت الشركات الأخرى تعتمد بعض هذه الاختراعات وتطبق بعضها فى سياراتها! ومنذ عامين.. فوجئت الإدارة المالكة لتوكيل «XPeng» فى الصين بطلب غريب من إدارة مجموعة فولكس ڤاجن العالمية الشهيرة طبعاً.. نريد الاجتماع بكم لأمر هام وسرى جداً.. سنحضر إلى جوانزو فى وفد رفيع المستوى ونجرى اجتماعاً داخل الغرف المغلقة.. وحتى لا أطيل عليكم.. فإن نتائج الاجتماع الذى تكرر عدة مرات.. وكانت النتيجة تحويل نقدى بقيمة 700 مليون يورو من ألمانيا للصين.. لشراء 5٪ من أسهم «XPeng» فى البورصة العالمية حتى تحصل سيارات فولكس ڤاجن على بعض «الذكاء» الموجود فى سيارات «XPeng» لأن الألمان فشلوا تماماً فى مواكبة ومنافسة التكنولوجيا التى تطبقها «XPeng» فى سياراتها.. فكان الحل دفع هذا المبلغ الضخم وشراء «سر الصنعة» أو جزء بسيط منه! وخلال العامين أو الثلاثة الماضيين.. شرعت هذه الشركة الصينية - الذكية جداً - فى إنتاج سيارات طائرة فى الجو.. هى سيارات عادية بأربع عجلات تسير داخل المدن المزدحمة.. ولكنها مزودة بأجنحة مثل الطائرات الهليكوبتر.. والتى يمكن إدارتها على الطرق السريعة.. فتطير السيارة وتقطع المسافة بسرعة كبيرة مقارنة بالسير على العجلات العادية.. ثم تهبط إلى الأرض عندما تقترب من المناطق المزدحمة.. وهكذا.. وهذه السيارات سوف تظهر للنور العام القادم.. تخيلوا.. وقد نراها فى مصر مع نهاية 2027! أيضاً نجحت «XPeng» العام الماضى فى إنتاج نموذج لفتاة صينية رائعة الجمال.. بملامح جذابة وشعر طويل وملابس أنيقة.. ودخلت الفتاة الجميلة أمام الصحافة الصينية فى استعراض ظنه الصحفيون أنه خاص بملابس أو ماكياج أو خلافه.. تقدمه فتاة صينية رائعة الجمال يحلم الشباب بالارتباط بها.. وبعد فترة تقدم أحد المسؤولين فى شركة «XPeng» للمسرح واقترب من الفتاة أمام الجميع.. وقام فجأة بقص الجزء الأسفل من قدمها بمقص فى يده.. وسط ذهول الحاضرين.. وإذا بالفتاة الجميلة ليست إلا روبوت جديد ومبتكر من شركة «XPeng» بتقنيات صينية ظهرت أمام الجميع.. فى أغرب اختراع جديد للشركة الصينية الذكية! وفى مصر.. لم تكن حكاية «XPeng» أقل إثارة وغرابة.. فقد نجحت شركة «راية أوتو» التابعة لمجموعة «راية القابضة» فى اقتناص هذا التوكيل الجديد وقدمت باكورة الإنتاج سيارة كهربائية سيدان.. وسط توقعات بفشل الشركة والتوكيل لأن القائمين عليه مجموعة من الشباب صغير السن بدون أى خبرات تساعدهم على «اللعب مع الكبار» بل و «الحيتان» داخل سوقنا.. ومع مرور الأسابيع والشهور.. كانت المفاجأة الكبرى.. هذه الشركة الوليدة تنجح الشهر الماضى فقط فى الحصول على المركز الثالث من مبيعات السيارات الكهربائية.. والمركز الأول فى فئة السيارات الفاخرة.. فى إنجاز ما كان أحد يتوقعه أو يتخيله.. تماماً مثل مفاجأة الفتاة الجميلة بالأقدام الحديدية! الأسبوع الماضى قدم التوكيل سيارة جديدة للسوق المحلية.. طراز «XPeng P7+» بسعر رائع ومواصفات «ذكية».. طبعاً لأن هذا تخصصهم.. ولكن الغريب أننا أثناء الحفل فوجئنا بفيلم فيديو يعرض سفر عميل لسيارات إكسبينج.. مصرى الجنسية.. يتجول داخل مصنع الشركة فى الصين.. وفى مشهد آخر يظهر داخل اجتماع مغلق مع القيادة العليا للتوكيل فى جوانزو.. ويقدم لهم تجربته مع السيارة.. ومعها بعض الملاحظات.. والأغرب أن الإدارة تقرر تعديل جزء أو أكثر على خط الإنتاج وفقاً لملاحظات العميل المصرى الوافد إليهم.. وبعد انتهاء الفيديو يظهر لنا الرجل بنفسه.. ويحكى قصته فى الصين.. داخل المصنع ومع «الرؤساء».. فى حكاية لم نعتادها أبداً من أى وكيل مصرى أن يرسل «زبائنه» للشركة الأم فى جولة ليست للترفيه.. ولكن للعمل والاقتراح وإضافة مطالب وتعديل خطوط إنتاج!.. هل تصدقون هذه الحكايات الغريبة والمثيرة.. هى -والله- حقيقية جداً!,2026-05-28T10:11:59.001394+00:00,
