site,tier,url,title,author,published_at,description,site_name,language,word_count,text,extracted_at,error
google_news,general,https://gate.ahram.org.eg/News/5663514.aspx,مستقبل وطن: العلمين الجديدة رمز لقدرة مصر على صناعة المستقبل ورسالة ثقة للعالم في قوة الاقتصاد المصري - بوابة الأهرام,,2026-05-29 15:23:00+00:00,مستقبل وطن: العلمين الجديدة رمز لقدرة مصر على صناعة المستقبل ورسالة ثقة للعالم في قوة الاقتصاد المصري&nbsp;&nbsp;بوابة الأهرام,بوابة الأهرام,ar,,,2026-05-30T08:33:23.351751+00:00,"Extraction failed: Failed to fetch: HTTPSConnectionPool(host='gate.ahram.org.eg', port=443): Max retries exceeded with url: /News/5663514.aspx (Caused by ReadTimeoutError(""HTTPSConnectionPool(host='gate.ahram.org.eg', port=443): Read timed out. (read timeout=12)""))"
google_news,general,https://www.copts-united.com/Article.php?I=6290&A=865701,الأقباط متحدون |استقرار سعر الدولار أمام الجنيه المصري اليوم السبت 30 مايو 2026,Copts United,2026-05-30 07:25:27+00:00,الأقباط متحدون |استقرار سعر الدولار أمام الجنيه المصري اليوم السبت 30 مايو 2026,,en,264,"الأقباط متحدون - استقرار سعر الدولار أمام الجنيه المصري اليوم السبت 30 مايو 2026 اخر الاخبار: وزارة التموين: طرح كميات كبيرة من الطماطم بالمجمعات الاستهلاكية بسعر 20 جنيهًا للكيلو لتخفيف الأعباء عن المواطنين English البحث المتقدم استقرار سعر الدولار أمام الجنيه المصري اليوم السبت 30 مايو 2026 اقتصاد محرر الأقباط متحدون السبت ٣٠ مايو ٢٠٢٦ ص +02:00 CEST محرر الأقباط متحدون استقرت أسعار الدولار اليوم السبت 30-5-2026 أمام الجنيه المصري في مختلف البنوك العاملة بالسوق المحلية. وسجل متوسط سعر الصرف بالبنك المركزي المصري 52.21 جنيه للشراء و52.35 جنيه للبيع، بينما سجل بالبنك الأهلي المصري 52.23 جنيه للشراء و52.33 جنيه للبيع. كما سجل الدولار البنك التجاري الدولي نحو 52.18 جنيه للشراء و52.28 جنيه للبيع، وفي بنك الإسكندرية بلغ 52.13 جنيه للشراء و52.23 جنيه للبيع. وسجل سعر الدولار في البنوك كالتالي: الدولار البنك المركزي المصري 52.21 جنيه للشراء. 52.35 جنيه للبيع. الدولار البنك الأهلي المصري 52.23 جنيه للشراء. 52.33 جنيه للبيع. الدولار بنك مصر 52.23 جنيه للشراء. 52.33 جنيه للبيع. الدولار بنك الإسكندرية 52.13 جنيه للشراء. 52.23 جنيه للبيع. الدولار البنك التجاري الدولي ""cib"" 52.18 جنيه للشراء. 52.28 جنيه للبيع. الدولار مصرف أبو ظبي الإسلامي 52.29 جنيه للشراء. 52.39 جنيه للبيع. الدولار بنك البركة 52.2 جنيه للشراء. 52.3 جنيه للبيع. الدولار بنك قناة السويس 52.23 جنيه للشراء. 52.33 جنيه للبيع. الكاتب محرر الأقباط متحدون الأكثر قراءة استقرار سعر الدولار أمام الجنيه المصري اليوم السبت 30 مايو 2026 استقرار سعر الذهب عيار 21 في مصر اليوم السبت 30 مايو 2026 بالفيديو.. الأنبا مقار يترأس قداس تدشين كنيسة السيدة العذراء الأثرية ببلبيس أضرار بكنيسة القديس جاورجيوس وبمدرسة الراهبات جنوب لبنان جراء قصف بالصواريخ.. والجيش الإسرائيلي يتهم حزب الله",2026-05-30T08:32:29.467060+00:00,
google_news,general,https://www.youm7.com/story/2026/5/30/%D9%83%D9%8A%D9%81-%D8%AA%D8%AE%D8%B7%D8%B7-%D8%A7%D9%84%D8%AD%D9%83%D9%88%D9%85%D8%A9-%D9%84%D8%B9%D8%A8%D9%88%D8%B1-%D8%A7%D9%84%D8%AA%D8%AD%D8%AF%D9%8A%D8%A7%D8%AA-%D8%A7%D9%84%D8%A7%D9%82%D8%AA%D8%B5%D8%A7%D8%AF%D9%8A%D8%A9-%D8%A7%D9%84%D8%B9%D8%A7%D9%84%D9%85%D9%8A%D8%A9-%D8%A7%D8%B3%D8%AA%D8%B1%D8%A7%D8%AA%D9%8A%D8%AC%D9%8A%D8%A9-%D9%85%D8%A7%D9%84%D9%8A%D8%A9-%D8%AC%D8%AF%D9%8A%D8%AF%D8%A9/7428501,كيف تخطط الحكومة لعبور التحديات الاقتصادية العالمية؟.. استراتيجية مالية جديدة تستهدف خفض الدين والعجز ودعم النمو والتشغيل.. وزيادة الاستثمارات رغم التوترات الجيوسياسية وتقلبات الأسواق العالمية - اليوم السابع,كتبت نورا فخري,2026-05-29 21:00:00+00:00,كيف تخطط الحكومة لعبور التحديات الاقتصادية العالمية؟.. استراتيجية مالية جديدة تستهدف خفض الدين والعجز ودعم النمو والتشغيل وزيادة الاستثمارات رغم التوترات الجيوسياسية وتقلبات الأسواق العالمية,اليوم السابع,ar,794,"- الحكومة تستهدف فائض أولى 5% وخفض العجز إلى 4.9% فى موازنة 2026/2027 - 78 مليار جنيه لدعم القطاعات الإنتاجية والتصديرية بموازنة 2026/2027 - خفض الدين إلى 78.1% من الناتج المحلى بحلول يونيو 2027 - الحكومة تستهدف تقليص الدين الخارجى بمعدل 1 إلى 2 مليار دولار سنويا - زيادة مخصصات الصحة والتعليم والأجور ضمن خطة الحماية الاجتماعية الجديدة - البيان المالي: التوسع فى «سندات المواطن» والصكوك لتنويع مصادر التمويل - شراكة أوسع مع القطاع الخاص ومشروعات البنية التحتية فى خطة الحكومة الاقتصادية - الحكومة تواصل التسهيلات الضريبية وتوسيع القاعدة الضريبية بالمشروعات الصغيرة كشف البيان المالي الذي عرضه وزير المالية، أحمد كجوك، أمام مجلس النواب عن ملامح رؤية اقتصادية جديدة تسعى الحكومة من خلالها إلى تحقيق معادلة معقدة تجمع بين الحفاظ على الانضباط المالي، ودفع معدلات النمو الاقتصادي، وتعزيز الحماية الاجتماعية، في ظل بيئة دولية وإقليمية تتسم بارتفاع مستويات عدم اليقين والتوترات الجيوسياسية وتشدد الأوضاع المالية العالمية. ويعكس البيان المالي للعام 2026/2027 توجها واضحا نحو استكمال مسار الإصلاح الاقتصادي والمالي الذي بدأته الدولة خلال السنوات الماضية، مع التركيز على تعزيز قدرة الاقتصاد المصري على الصمود أمام الصدمات الخارجية، وتحقيق توازن بين متطلبات الاستقرار المالي واحتياجات التنمية وتحسين مستوى معيشة المواطنين. سياسة مالية تجمع بين النمو والانضباط وفي قلب هذه الرؤية، تؤكد الحكومة أنها ستواصل خلال العام المالي الجديد اتباع سياسة مالية متوازنة تستهدف الحفاظ على الاستقرار المالي باعتباره الركيزة الأساسية لتحفيز النشاط الاقتصادي وجذب الاستثمارات، مع الاستمرار في تحقيق فائض أولي بالموازنة العامة يُقدر بنحو 5% من الناتج المحلي الإجمالي. كما تستهدف الحكومة خفض العجز الكلي بنحو 1.2 نقطة مئوية ليصل إلى 4.9% من الناتج المحلي للمرة الأولى، وهو ما يعكس محاولة واضحة للسيطرة على الضغوط المالية وتقليل الاعتماد على الاقتراض، خاصة في ظل ارتفاع تكلفة التمويل عالميا. وفي المقابل، لا تتجه الدولة إلى تبني سياسات انكماشية حادة قد تؤثر على النشاط الاقتصادي، بل تسعى إلى تحفيز النمو من خلال استمرار المبادرات الداعمة للقطاع الخاص، خاصة القطاعات الإنتاجية والتصديرية والخدمية، حيث رصدت الحكومة نحو 78 مليار جنيه لمساندة هذه القطاعات، إلى جانب التوسع في مشروعات الشراكة بين القطاعين العام والخاص في مجالات البنية التحتية. شراكة جديدة مع مجتمع الأعمال ويكشف البيان عن توجه حكومي لإعادة بناء العلاقة مع مجتمع الأعمال على أسس أكثر مرونة، عبر استمرار تطبيق حزمة التسهيلات الضريبية والجمركية، والعمل على توسيع القاعدة الضريبية من خلال رفع معدلات الامتثال الطوعي، بدلاً من زيادة الأعباء الضريبية التقليدية. كما تراهن الحكومة على التوسع في النظام الضريبي المبسط للمشروعات الصغيرة والمتوسطة، باعتباره أحد أدوات دمج الاقتصاد غير الرسمي وتحفيز النشاط الاقتصادي، بالتزامن مع التوسع في استخدام التكنولوجيا والميكنة في تقديم الخدمات الضريبية والتحصيل والسداد، بما يساهم في رفع الكفاءة وتقليل التكاليف وتعزيز الشفافية. استراتيجية جديدة لإدارة الدين ومن أبرز الملفات التي يركز عليها البيان المالي، ملف الدين العام، حيث تتبنى الحكومة استراتيجية متكاملة تستهدف خفض دين أجهزة الموازنة العامة إلى نحو 78.1% من الناتج المحلي بحلول يونيو 2027. وتعتمد هذه الاستراتيجية على عدة محاور، تشمل إطالة متوسط عمر الدين، وتقليل الاحتياجات التمويلية السنوية، وتنويع أدوات ومصادر التمويل، عبر التوسع في أدوات جديدة مثل ""سندات المواطن"" والصكوك، إلى جانب الاستفادة من الأسواق الدولية والتمويلات الميسرة. كما تستهدف الحكومة خفض الدين الخارجي بمعدل يتراوح بين مليار إلى ملياري دولار سنويًا، في محاولة لتقليل الضغوط المرتبطة بخدمة الدين وتقلبات الأسواق العالمية وأسعار الفائدة. ويشير البيان إلى أن هذه السياسات تستهدف في النهاية خفض تكلفة خدمة الدين كنسبة من الإيرادات والمصروفات العامة، بما يتيح مساحة مالية أكبر لتوجيه الإنفاق نحو القطاعات التنموية والاجتماعية. الحماية الاجتماعية في قلب الموازنة ورغم التركيز على الانضباط المالي، يؤكد البيان أن الحكومة تسعى في الوقت نفسه إلى توسيع الحيز المالي المخصص للحماية الاجتماعية وتنمية الثروة البشرية، من خلال زيادة مخصصات قطاعي الصحة والتعليم بصورة كبيرة، إلى جانب إقرار زيادات حقيقية في الأجور تتجاوز معدلات التضخم. كما تتضمن الموازنة مخصصات إضافية للتعامل مع التداعيات المحتملة للتوترات الجيوسياسية العالمية والإقليمية، بما يضمن قدرة الدولة على مواجهة أي ضغوط استثنائية قد تنعكس على الأسواق أو أسعار السلع والطاقة. الاقتصاد الرقمي والطاقة في صدارة الإصلاحات ولا يقتصر مسار الإصلاح الحكومي على الجوانب المالية فقط، بل يمتد إلى تحديث بنية الاقتصاد نفسه، حيث تؤكد الحكومة استمرارها في تنفيذ إصلاحات هيكلية واسعة تشمل التوسع في قطاع تكنولوجيا المعلومات والتحول الرقمي، باعتباره أحد القطاعات القادرة على دعم النمو وخلق فرص العمل وزيادة الإنتاجية. كما يركز البيان على مواجهة تحديات الطاقة عبر زيادة الإنتاج والتوسع في مشروعات الطاقة الجديدة والمتجددة بقيادة القطاع الخاص، مع تحديث شبكات الكهرباء لاستيعاب القدرات الجديدة وتحسين كفاءة التوزيع. وفي هذا السياق، تسعى الدولة إلى تقديم مزيد من التسهيلات لجذب استثمارات القطاع الخاص المحلي والأجنبي، إلى جانب الاستثمار في تنمية وتأهيل الموارد البشرية، ودعم الفئات الأولى بالرعاية وتعزيز الاهتمام بقضايا النوع الاجتماعي. اقتصاد أكثر صلابة أمام الأزمات ويعكس البيان المالي قناعة حكومية بأن المرحلة المقبلة لن تكون سهلة، في ظل استمرار الاضطرابات الجيوسياسية العالمية والتحديات الاقتصادية الدولية، إلا أن الحكومة تراهن على أن استمرار الإصلاحات المالية والهيكلية سيعزز من صلابة الاقتصاد المصري وقدرته على التعامل مع الصدمات والمخاطر المستقبلية، سواء المرتبطة بالتقلبات المالية العالمية أو التغيرات المناخية طويلة الأجل.",2026-05-30T08:32:29.547545+00:00,
