site,tier,url,title,author,published_at,description,site_name,language,word_count,text,extracted_at,error
google_news,general,https://www.shorouknews.com/news/view.aspx?cdate=13062026&id=9c8d53ac-40fa-4243-a956-6a415ba74227,رئيس الحكومة: إنهاء مديونية شركات البترول الأجنبية يبعث برسالة ثقة كبيرة في الاقتصاد المصري - بوابة الشروق,,2026-06-13 14:11:46+00:00,قال الدكتور مصطفى مدبولي، رئيس مجلس الوزراء، إنه تفقد اليوم السبت، مشروعين كبيرين في قطاع البترول، وهما: شركة رشيد للبترول، ومحطة إدكو للإسالة. وعلق خلال مؤت,,ar-eg,169,قال الدكتور مصطفى مدبولي، رئيس مجلس الوزراء، إنه تفقد اليوم السبت، مشروعين كبيرين في قطاع البترول، وهما: شركة رشيد للبترول، ومحطة إدكو للإسالة. وعلق خلال مؤتمر صحفي عقب جولته لتفقد عدد من المشروعات بمحافظة البحيرة، اليوم السبت، على إعلان وزارة البترول نجاح مصر في إنهاء مديونية الشركات الأجنبية، التي بلغت 6.1 مليار دولار. وأشار إلى «إيجابية الإعلان عن هذا الخبر، ورد الفعل الخارجي الذي أشاد بنجاح مصر ومدى جدية الحكومة في سداد مستحقات الشركات». وأوضح أن إنهاء مديونية الشركات الأجنبية يبعث برسالة ثقة كبيرة في الاقتصاد المصري، ويؤكد نجاح الحكومة في إنهاء تلك المديونية. ولفت إلى أن الحكومة تلقت توجيهًا مباشرًا من الرئيس السيسي، لإنهاء الملف في أقرب وقت، موضحًا أن الرئيس كان يتابع الأرقام شهريًا، للتأكد من السير طبقًا لمخطط المستهدف. وذكر أن «الأمر ينعكس على تسارع معدلات الاستكشافات الجديدة من الشركات الأجنبية، التي تتكلف مئات الملايين من الدولارات». وتحدث عن محطة إسالة إدكو، مضيفًا: «لا دولة تمتلك تلك البنية الأساسية الموجودة في المحطة، والتي تتخطى قيمتها الاستثمارية الدولارية الآن 10 مليارات دولار، وتجعل مصر المركز الإقليمي للغاز».,2026-06-14T09:40:48.832985+00:00,
google_news,general,https://www.almasryalyoum.com/news/details/4292057,مدبولى يعلن ارتفاع الاحتياطى النقدى: شركات دولية بدأت فى نقل خطوط إنتاجها إلى مصر | المصري اليوم,خالد مصطفى,2026-06-13 15:00:00+00:00,أعلن الدكتور مصطفى مدبولى، رئيس مجلس الوزراء، ارتفاع الاحتياطى النقدى المصرى خلال شهر يونيو الحالى، بقيمة 125 مليون دولار مقارنة بالشهر الماضى، مشيرًا إلى أن المؤشرات...,المصري اليوم,ar,263,آخرون الدكتور مصطفى مدبولى رئيس مجلس الوزراء آخرون الدكتور مصطفى مدبولى رئيس مجلس الوزراء أعلن الدكتور مصطفى مدبولى، رئيس مجلس الوزراء، ارتفاع الاحتياطى النقدى المصرى خلال شهر يونيو الحالى، بقيمة 125 مليون دولار مقارنة بالشهر الماضى، مشيرًا إلى أن المؤشرات الاقتصادية تواصل تحقيق نتائج إيجابية تدعم استقرار الاقتصاد الوطنى. وقال مدبولى، خلال مؤتمر صحفى عقب جولة تفقدية للمشروعات الخدمية والتنموية بمحافظة البحيرة، اليوم السبت، أن معدل التضخم على أساس سنوى سجل انخفاضًا ليصل إلى 13%، فى مؤشر يعكس تحسن الأوضاع الاقتصادية واستمرار جهود الدولة فى ضبط الأسواق. أكد أن الاقتصاد المصرى يواصل الصمود أمام التحديات العالمية المتلاحقة، مشيرًا إلى أن الدولة نجحت فى الحفاظ على استقرار مؤشرات الاقتصاد الكلى رغم الأزمات الجيوسياسية والتقلبات الدولية. وأوضح أن التوقعات الدولية التى كانت تشير إلى تأثر مصر بشدة بالأزمات العالمية لم تتحقق، بفضل قوة الدولة وقدرتها على إدارة الملفات الاقتصادية بكفاءة، مؤكدًا أن الاقتصاد المصرى أثبت مرونة كبيرة فى مواجهة الأزمات غير المسبوقة. ولفت إلى أن العالم بأكمله شهد موجات تضخمية وارتفاعًا فى الأسعار نتيجة التوترات الجيوسياسية والحروب، إلا أن مصر تمكنت من التعامل مع هذه الضغوط ضمن حدودها الطبيعية، مع استمرار العمل على تعزيز الاستقرار الاقتصادى. وأشار إلى أن الدولة نجحت فى جذب المزيد من الاستثمارات الأجنبية خلال الفترة الأخيرة، لافتًا إلى أن عدداً من الشركات العالمية أبدت ثقة كبيرة فى مناخ الاستثمار داخل مصر، وهو ما انعكس فى خطط توسع وإنشاء مصانع جديدة داخل السوق المصرية. وبين مدبولى أن هناك بالفعل شركات دولية بدأت فى نقل جزء من استثماراتها أو خطوط إنتاجها إلى مصر، فى ضوء ما تتمتع به من استقرار سياسى ونظام اقتصادى واضح، إلى جانب تحسن بيئة الأعمال والإصلاحات التى تنفذها الدولة.,2026-06-14T09:40:48.189476+00:00,
google_news,general,https://gate.ahram.org.eg/News/5672264.aspx,رئيس الوزراء: إنهاء مديونية الشركات الأجنبية يعزز الثقة في الاقتصاد المصري ويؤكد قوة قطاع الطاقة - بوابة الأهرام,,2026-06-13 14:25:00+00:00,أكد الدكتور مصطفى مدبولي، رئيس مجلس الوزراء، أن مصر نجحت في إنهاء مديونية الشركات الأجنبية، مشيرًا إلى أن ذلك يعكس الثقة في الاقتصاد المصري ويبعث برسالة إيجابية للمستثمرين في الداخل والخارج,بوابة الأهرام,ar,142,أكد الدكتور مصطفى مدبولي، رئيس مجلس الوزراء، أن مصر نجحت في إنهاء مديونية الشركات الأجنبية، مشيرًا إلى أن ذلك يعكس الثقة في الاقتصاد المصري ويبعث برسالة إيجابية للمستثمرين في الداخل والخارج. موضوعات مقترحة وأضاف أن تشجيع الشركات الدولية على توسيع جهود الاستكشاف في قطاع البترول يعكس كذلك متانة الاقتصاد المصري وجاذبيته الاستثمارية، خاصة في ضوء ما تحقق من استقرار في سداد المستحقات وتعزيز الشراكات مع كبرى الشركات العالمية. وأوضح رئيس الوزراء أن ما تملكه مصر من محطات إسالة للغاز يمنحها ميزة استثنائية ويعزز مكانتها كمركز إقليمي للطاقة في المنطقة. وأشار إلى أن نجاح الدولة في إنهاء مديونية الشركات الأجنبية جاء بتوجيهات مباشرة من الرئيس عبد الفتاح السيسي، وبما يضمن دعم مناخ الاستثمار واستمرار تدفق الاستثمارات الأجنبية في قطاع الطاقة. كما وجه الجهات التنفيذية بمحافظة البحيرة بتعميم تجربة منتزه إدكو الترفيهي في مختلف المحافظات، بهدف تعميم النماذج الناجحة في تطوير الخدمات والمرافق العامة.,2026-06-14T09:41:01.258552+00:00,
google_news,general,https://www.elwatannews.com/news/details/8301494,خبيرة مصرفية: نمو الاقتصاد من أبرز أسباب زيادة تحويلات المصريين بالخارج - الوطن,,2026-06-13 17:24:31+00:00,قالت سهر الدماطي الخبيرة المصرفية ونائب رئيس بنك مصر الأسبق إن وعي المصريين العاملين بالخارج بما يحدث في العالم وما يمر به الاقتصاد العالمي جعلهم أكثر ثقة في الاقتصاد المصري الذي حقق نموا على مدار السنوات الماضية وأصبح قادرا على مواجهة أي تحديات خارجية - الوطن,الوطن,ar,763,كتب: وليد عبد السلام 08:24 م | السبت 13 يونيو 2026 قالت سهر الدماطي، الخبيرة المصرفية، ونائب رئيس بنك مصر الأسبق، إن وعي المصريين العاملين بالخارج بما يحدث في العالم وما يمر به الاقتصاد العالمي، جعلهم أكثر ثقة في الاقتصاد المصري الذي حقق نمواً على مدار السنوات الماضية، وأصبح قادراً على مواجهة أي تحديات خارجية، وأضافت «الدماطي» في حوار ل«الوطن»، أن تحويلات المصريين العاملين في الخارج لها دور كبير في دعم الاقتصاد المصري من خلال تعزيز الاحتياطي النقدي الأجنبي، وإلى نص الحوار: ■ ما الداعم الأساسي لتحقيق تحويلات المصريين هذه الأرقام التاريخية؟ لاحظنا خلال العامين الماضيين ارتفاعاً ملحوظاً في تحويلات المصريين في الخارج التي كانت تسجل نحو 35-41 مليار دولار، وأعتقد أن نصل إلى هذا المستوى خلال العام الحالي، ويرجع ذلك إلى ما يشهده العالم من توترات جيوسياسية واقتصادية، وأيضاً الحديث عن أن النظام المالي العالمي يمر بمرحلة تغييرات واضحة، وهو ما له تأثير كبير على اقتصادات المنطقة لعدم وضوح رؤية مستقبلية لما سيحدث خلال الفترة المقبلة بمنطقة الشرق الأوسط. ومن هنا أرى أن أحد أهم الأسباب الرئيسية والمهمة وراء الارتفاع الهائل في تحويلات المصريين بالخارج، هو أن معظم المصريين العاملين في الخارج متابعون لما يحدث في العالم من توترات وعدم استقرار، وبالتالي يفضلون توجيه أموالهم إلى الاقتصاد المصري والاستفادة من النمو الذي يشهده والحوافز والمشروعات التي تقدمها الدولة المصرية لهم، على سبيل المثال يقومون بشراء العقارات في مصر التي تضمن لهم التحوط والمحافظة على أموالهم وأيضاً استثمارها في بلد مستقر في ظل الظروف التي يمر بها العالم. أيضاً من الأسباب الداعمة لوصول تحويلات المصريين إلى هذه المستويات التاريخية، هو التحسن الكلي في الاقتصاد المصري قبل اندلاع الحرب وتفاقم الأمور الجيوسياسية، فنرى أن التضخم المصري انخفض وانخفضت أسعار الفائدة، وتشجيع القطاعات الصناعية، فضلاً عن الوصول إلى التعامل بسعر صرف مرن، الأمر الذي أدى إلى زيادة الناتج القومي، ليترتب عليه تحسن التصنيف الائتماني المصري وهو ما يعكس نوعاً من الثقة للاستثمار في مصر. سهر الدماطي: نحقق إصلاحاً نقدياً ومالياً يجعلنا في غنى عن برامج صندوق النقد ■ كيف ترين تصريحات رئيس الوزراء الأخيرة حول برنامج صندوق النقد الدولي، وهل أصبحنا بالفعل لا نحتاج لبرنامج جديد مع الصندوق؟ الحديث عن برنامج صندوق النقد الدولي مع مصر، وما تم إنجازه على مدار السنوات الماضية، نجد أنه على مستوى الإصلاحات النقدية قامت الدولة بالعديد من الإصلاحات الإيجابية، مثل تحرير سعر الصرف والوصول إلى سعر صرف مرن يتحدد وفقاً للعرض والطلب، وتخفيض مستويات التضخم، ووصول الاحتياطي النقدي إلى أرقام لم نشهدها من قبل، وإضافة سيولة كبيرة للبنك المركزي المصري، والتوسع في البنوك الرقمية وهناك مجموعة من البنوك الرقمية تحت الإنشاء، والتعامل مع تشوهات أسعار الفائدة. ■ كيف تعزز تحويلات المصريين بالخارج الاحتياطي النقدي الأجنبي؟ تحويلات المصريين في الخارج هي مصدر أساسي ضمن مجموعة من المصادر الأخرى لتدفق العملة الصعبة، وبالتالي فهي داعم أساسي للاحتياطي النقدي الأجنبي بنحو 38-40 مليار دولار في السنة، بجانب السياحة بنحو 18-20 مليار دولار، والصادرات بنحو 40 مليار دولار، أيضاً الاستثمارات في أذون الخزانة، والاستثمار المباشر وغير المباشر، وعقود مقايضة العملات التي أبرمها البنك المركزي كلها مصادر للعملة الأجنبية، فضلاً عن قناة السويس على الرغم من تأثرها بالحرب، وبالتالي كلما توفرت العملة الأجنبية يعكس تحسناً في الاحتياطي النقدي الأجنبي ويرجع كل هذا إلى السياسة المالية الناجحة وسياسة إدارة السيولة في البنك المركزي. ■ كيف أثّرت حرب إيران على الاقتصاد المصري وموارد العملة الصعبة التي تعتمد عليها مصر؟ ظهر تأثير الحرب على الاقتصاد المصري، في ارتفاع أسعار المواد البترولية بشكل كبير وهذا الارتفاع ليس فقط بسعر برميل البترول، بل زادت تكاليف الشحن، والتأمين على البضائع أيضاً ارتفع بشكل كبير، وتعطل سلاسل الإمداد بشكل جزئي، مما أثر على الاقتصاد المصري، ورغم توافر العملة الصعبة في مصر فإن الحرب كان لها أثر. ■ ماذا تقدم الدولة المصرية للعاملين بالخارج لتعزيز ثقتهم في الاقتصاد المصري وزيادة تحويلاتهم؟ قامت الدولة المصرية بجهود فعّالة على مستوى الإصلاح النقدي، ولم يقتصر الأمر على هذا فقط، بل امتدت تلك الجهود إلى ابتكار قنوات استثمارية مشجعة للمصريين في الخارج، وهو ما يعزز من زيادة تحويلات المصريين بالخارج في الفترة الأخيرة؛ فهناك مبادرات أطلقتها الدولة للعاملين بالخارج، لدخول أموالهم في أصول مثل العقارات والاستثمار في السوق المصرية، الأمر الذي ساهم في توفير سيولة دولارية تساعد الدولة على الوفاء بالتزاماتها الدولية الكبرى. تحرك الدولار الفترة المقبلة الطبيعي أنه كلما توفرت العملة الصعبة، تحسّن سعر الصرف في مصر، وهو ما شهدناه خلال السنوات الماضية عندما وصل سعر الدولار إلى 46 جنيهاً نتيجة وفرة العملة، ولكن الفترة الحالية تختلف عن السنوات الماضية لما نشهده من زيادة في الأسعار العالمية، نلاحظ اليوم ارتفاعاً قوياً في سعر برميل البترول، وكذلك ارتفاع أسعار الغاز. وفيما يخص التوقعات بالنسبة لحركة الدولار في مصر، ترى المؤسسات المالية الدولية وبنوك الاستثمار أن سعر الدولار سيصل إلى 55 جنيهاً، لكن ذلك يتوقف على هل ستستمر الحرب ومتى ستنتهي، أم سنشهد امتداد هذه الحرب إلى دول أخرى؟ لكن سيتم حسم هذه الأمور قبل نهاية العام.,2026-06-14T09:40:48.286575+00:00,
google_news,general,https://www.mobtada.com/egypt/1622600/%D9%85%D8%AF%D8%A8%D9%88%D9%84%D9%8A-%D8%A7%D9%84%D8%A7%D9%82%D8%AA%D8%B5%D8%A7%D8%AF-%D8%A7%D9%84%D9%85%D8%B5%D8%B1%D9%8A-%D9%8A%D8%AB%D8%A8%D8%AA-%D9%82%D8%AF%D8%B1%D8%AA%D9%87-%D8%B9%D9%84%D9%89-%D9%85%D9%88%D8%A7%D8%AC%D9%87%D8%A9-%D8%A7%D9%84%D8%A3%D8%B2%D9%85%D8%A7%D8%AA-%D8%A7%D9%84%D8%B9%D8%A7%D9%84%D9%85%D9%8A%D8%A9,مدبولي: الاقتصاد المصري يثبت قدرته على مواجهة الأزمات العالمية,مبتدا,2026-06-13 14:45:56+00:00,أكد الدكتور مصطفى مدبولي، رئيس مجلس الوزراء، أن الاقتصاد المصري يواصل الصمود أمام التحديات العالمية المتلاحقة، مشيرًا إلى أن الدولة نجحت في الحفاظ على استقرار مؤشرات الاقتصاد الكلي رغم الأزمات الجيوسياسية والتقلبات الدولية.,,ar,199,مدبولي: الاقتصاد المصري يثبت قدرته على مواجهة الأزمات العالمية أكد الدكتور مصطفى مدبولي، رئيس مجلس الوزراء، أن الاقتصاد المصري يواصل الصمود أمام التحديات العالمية المتلاحقة، مشيرًا إلى أن الدولة نجحت في الحفاظ على استقرار مؤشرات الاقتصاد الكلي رغم الأزمات الجيوسياسية والتقلبات الدولية. وأوضح مدبولي، خلال تصريحات على هامش جولته الميدانية، أن التوقعات الدولية التي كانت تشير إلى تأثر مصر بشدة بالأزمات العالمية لم تتحقق، بفضل قوة الدولة وقدرتها على إدارة الملفات الاقتصادية بكفاءة، مؤكدًا أن الاقتصاد المصري أثبت مرونة كبيرة في مواجهة الأزمات غير المسبوقة. وأشار رئيس الوزراء إلى أن العالم بأكمله شهد موجات تضخمية وارتفاعًا في الأسعار نتيجة التوترات الجيوسياسية والحروب، إلا أن مصر تمكنت من التعامل مع هذه الضغوط ضمن حدودها الطبيعية، مع استمرار العمل على تعزيز الاستقرار الاقتصادي. وأكد مدبولي أن الدولة نجحت في جذب المزيد من الاستثمارات الأجنبية خلال الفترة الأخيرة، لافتًا إلى أن عدداً من الشركات العالمية أبدت ثقة كبيرة في مناخ الاستثمار داخل مصر، وهو ما انعكس في خطط توسع وإنشاء مصانع جديدة داخل السوق المصرية. وأضاف أن هناك بالفعل شركات دولية بدأت في نقل جزء من استثماراتها أو خطوط إنتاجها إلى مصر، في ضوء ما تتمتع به من استقرار سياسي ونظام اقتصادي واضح، إلى جانب تحسن بيئة الأعمال والإصلاحات التي تنفذها الدولة.,2026-06-14T09:40:48.741797+00:00,
