site,tier,url,title,author,published_at,description,site_name,language,word_count,text,extracted_at,error
youm7,tier1,https://www.youm7.com/story/2026/6/13/%D8%B7%D8%A7%D8%B1%D9%82-%D8%B9%D9%86%D8%A7%D9%86%D9%8A-%D9%85%D8%A4%D8%AA%D9%85%D8%B1-%D8%A8%D9%88%D8%A7%D8%A8%D8%A9-%D8%A7%D9%84%D9%85%D8%B1%D8%A3%D8%A9-%D9%85%D9%86%D8%B5%D8%A9-%D8%AF%D9%88%D9%84%D9%8A%D8%A9-%D8%A7%D8%B3%D8%AA%D8%AB%D9%86%D8%A7%D8%A6%D9%8A%D8%A9-%D9%84%D9%85%D8%B3%D8%AA%D9%82%D8%A8%D9%84-%D8%A7%D9%84%D8%A7%D9%82%D8%AA%D8%B5%D8%A7%D8%AF/7447294,"طارق عناني: مؤتمر ""بوابة المرأة"" منصة دولية استثنائية لمستقبل الاقتصاد الرقمي - اليوم السابع",كتب محمود راغب,2026-06-13 16:02:03+00:00,"شارك الدكتور طارق عناني، رئيس المنظمة النرويجية الدولية للعدالة والسلام في أوسلو، وأحد أبرز رموز الجالية المصرية فى النرويج، في فعاليات مؤتمر ""بوابة المرأة نحو الاقتصاد الرقمي""، المقام فى دبى،",اليوم السابع,ar,343,"شارك الدكتور طارق عناني، رئيس المنظمة النرويجية الدولية للعدالة والسلام في أوسلو، وأحد أبرز رموز الجالية المصرية فى النرويج، في فعاليات مؤتمر ""بوابة المرأة نحو الاقتصاد الرقمي ""، المقام فى دبى، بدعوة الشيخة وفاء بنت حميد المعلا للمبادرات المجتمعية، وبحضور نخبة من القيادات المجتمعية والإعلامية والشخصيات المؤثرة والخبراء في مجالات التنمية والاقتصاد الرقمي. ريادة تكنولوجية وتمكين مستدام للمرأة العربية ويُعد المؤتمر من أبرز الفعاليات التي تسلط الضوء على دور المرأة في بناء الاقتصاد الرقمي وصناعة المستقبل، حيث ناقش المشاركون أحدث الرؤى والتجارب المتعلقة بتمكين المرأة وتعزيز مشاركتها في مجالات الابتكار والتكنولوجيا وريادة الأعمال. وخلال فعاليات المؤتمر، قدم الدكتور طارق عناني درع السلام الدولي إلى الشيخة وفاء بنت حميد المعلا، تقديرًا لجهودها الإنسانية والمجتمعية المتميزة ودورها الرائد في دعم المبادرات الهادفة إلى تمكين المرأة وخدمة المجتمع، كما أعلن منحها لقب سفيرة النوايا الحسنة للمنظمة النرويجية الدولية للعدالة والسلام في أوسلو، تقديرًا لعطائها المستمر ورسالتها الإنسانية النبيلة. ترسيخ قيم السلام والتسامح ودعم الشخصيات المؤثرة وأكد الدكتور طارق عناني، أن هذا التكريم يأتي انطلاقًا من إيمان المنظمة بأهمية دعم الشخصيات المؤثرة التي تترك بصمات إيجابية في المجتمع وتسهم في نشر قيم السلام والتسامح والتنمية المستدامة، مشيدًا بالدور الكبير الذي تقوم به الشيخة وفاء المعلا في خدمة القضايا الإنسانية والمجتمعية. وأعرب الدكتور طارق عناني عن بالغ شكره وتقديره للأستاذة رجاء رمضان الحساني، مديرة مكتب الشيخة وفاء بنت حميد المعلا، على حسن الاستقبال وكرم الضيافة والتنظيم الراقي الذي أسهم في نجاح الحدث وظهوره بصورة مشرفة تعكس الاحترافية والتميز. ووجّه كذلك شكرًا خاصًا إلى الإعلامية الكبيرة الأستاذة رهف الطويل، تقديرًا لجهودها الإعلامية المتميزة ودورها الفاعل في إبراز رسالة المؤتمر وتغطية فعالياته باحترافية عالية، مؤكدًا أن الإعلام الهادف يمثل شريكًا أساسيًا في نشر قيم الوعي والتنمية والتقدم. صياغة الشراكات الدولية لتعزيز التحول الرقمي وأشار إلى أن مؤتمر ""بوابة المرأة نحو الاقتصاد الرقمي"" يمثل منصة مهمة لتعزيز الحوار وتبادل الخبرات وبناء الشراكات الفاعلة بين المؤسسات العربية والدولية، بما ينعكس إيجابًا على مستقبل المرأة ودورها في قيادة التحول الرقمي والتنمية المستدامة. وشدد على أن المنظمة النرويجية الدولية للعدالة والسلام ستواصل دعم المبادرات الإنسانية والتنموية حول العالم، والعمل على تعزيز ثقافة السلام والتعاون بين الشعوب، بما يخدم الإنسانية ويحقق مستقبلًا أكثر عدالة واستقرارًا.",2026-06-14T09:41:19.227705+00:00,
youm7,tier1,https://www.youm7.com/story/2026/6/13/%D8%B1%D8%A6%D9%8A%D8%B3-%D9%85%D8%AC%D9%84%D8%B3-%D8%A7%D9%84%D9%88%D8%B2%D8%B1%D8%A7%D8%A1-%D9%86%D8%B3%D8%B9%D9%89-%D9%84%D8%B2%D9%8A%D8%A7%D8%AF%D8%A9-%D8%AD%D8%B5%D9%8A%D9%84%D8%A9-%D8%A7%D9%84%D8%B9%D9%85%D9%84%D8%A9-%D8%A7%D9%84%D8%A3%D8%AC%D9%86%D8%A8%D9%8A%D8%A9-%D9%85%D9%86-%D8%A7%D9%84%D9%82%D8%B7%D8%A7%D8%B9%D8%A7%D8%AA/7447271,رئيس مجلس الوزراء: نسعى لزيادة حصيلة العملة الأجنبية من القطاعات الإنتاجية - اليوم السابع,كتب الأمير نصرى,2026-06-13 14:28:00+00:00,أكد الدكتور مصطفى مدبولي، رئيس مجلس الوزراء، حرص الحكومة على التطوير المستمر لآليات العمل الاقتصادي، بما يسهم في تعزيز موارد الدولة من العملة الأجنبية عبر القطاعات الإنتاجية الحقيقية..,اليوم السابع,ar,135,الدكتور مصطفى مدبولي، رئيس مجلس الوزراء ، حرص الحكومة على التطوير المستمر لآليات العمل الاقتصادي، بما يسهم في تعزيز موارد الدولة من العملة الأجنبية عبر القطاعات الإنتاجية الحقيقية، وفي مقدمتها التصدير والصناعة والسياحة. دعم القطاعات الاقتصادية المولدة للنقد الأجنبي وأوضح مدبولي، خلال مؤتمر صحفي اليوم، أن الدولة بدأت بالفعل في تحقيق نتائج إيجابية من عدد من القطاعات الاقتصادية، مشيرًا إلى أن حصيلة العملة الأجنبية باتت تعتمد بشكل متزايد على أنشطة حقيقية تشمل التصدير والصناعة والسياحة وغيرها من الأنشطة الاقتصادية المختلفة. وشدد رئيس الوزراء على أن الحكومة لا تزال أمامها مساحة كبيرة لمواصلة التطوير وتحقيق المزيد من الإنجازات الاقتصادية، مؤكدًا أن المرحلة المقبلة ستشهد تحسنًا أكبر في المؤشرات الاقتصادية. وأشار مدبولي إلى أن الجهود الحكومية المتواصلة ستنعكس إيجابًا على الاقتصاد الوطني، معربًا عن تفاؤله بأن تشهد السنوات المقبلة مزيدًا من التحسن والاستقرار في مختلف الملفات الاقتصادية.,2026-06-14T09:41:19.732374+00:00,
youm7,tier1,https://www.youm7.com/story/2026/6/13/%D9%85%D8%AF%D9%8A%D8%B1-%D9%85%D8%B1%D9%83%D8%B2-%D8%A7%D9%84%D8%AD%D8%B6%D8%A7%D8%B1%D8%A9-%D8%A7%D9%84%D8%A5%D8%B3%D9%84%D8%A7%D9%85%D9%8A%D8%A9-%D9%85%D8%B5%D8%B1-%D9%88%D8%A3%D9%88%D8%B2%D8%A8%D9%83%D8%B3%D8%AA%D8%A7%D9%86-%D8%AA%D8%B4%D9%87%D8%AF%D8%A7%D9%86-%D8%B7%D9%81%D8%B1%D8%A9-%D9%81%D9%8A-%D8%A7%D9%84%D8%B9%D9%84%D8%A7%D9%82%D8%A7%D8%AA/7447367,مدير مركز الحضارة الإسلامية: مصر وأوزبكستان تشهدان طفرة في العلاقات - اليوم السابع,كتبت رباب فتحى,2026-06-13 16:17:50+00:00,قال فردوس عقد الخالقون، مدير مركز الحضارة الإسلامية في طشقند إن مصر وأوزبكستان تمثلان مركزين عظيمين من مراكز الحضارة الإنسانية، تركا بصمة عميقة في تاريخ البشرية..,اليوم السابع,ar,273,قال فردوس عقد الخالقون، مدير مركز الحضارة الإسلامية في طشقند إن مصر وأوزبكستان تمثلان مركزين عظيمين من مراكز الحضارة الإنسانية، تركا بصمة عميقة في تاريخ البشرية، مشيراً إلى أن وادي النيل وما وراء النهر يعدان من أهم روافد الحضارة الإنسانية عبر التاريخ. وأضاف في كلمة ألقاها في المتحف المصري الكبير منذ قليل أن العلاقات بين القاهرة وطشقند شهدت خلال السنوات الأخيرة تطوراً كبيراً تحت قيادة فخامة الرئيسين عبد الفتاح السيسي ورئيس جمهورية أوزبكستان شوكت ميرضيائيف، حيث وصلت العلاقات بين البلدين إلى مستوى جديد بالكامل. إرادة سياسية قوية وأوضح أن الإرادة السياسية القوية والثقة المتبادلة والرؤية المستقبلية لقيادتي البلدين أسهمت في تعزيز التعاون في مجالات الاقتصاد والتعليم والعلوم والثقافة والسياحة والحفاظ على التراث الثقافي، لافتاً إلى أن هذا التعاون يشهد نمواً متواصلاً عاماً بعد عام. وأشار إلى أن الفعالية الحالية تمثل تجسيداً عملياً لهذه العلاقات المتنامية، والتي تستند إلى الشراكة الاستراتيجية والاحترام المتبادل والقيم الحضارية المشتركة. مصر واوزبكستان ورثة حضارات عظيمة وقال إن كلا البلدين وريث لحضارات عظيمة أسهمت بشكل استثنائي في تقدم الإنسانية وأثرت العلوم والثقافة العالمية بتراث لا يقدر بثمن، موضحاً أن وادي النيل كان من أقدم مراكز نشأة الدولة والثقافة المكتوبة والإنجاز المعماري في التاريخ الإنساني، بينما احتلت أرض ما وراء النهر مكانة مرموقة باعتبارها أحد أهم مراكز العلم والتنوير والفكر الإنساني. مصر كتاب ذاكرة البشرية وأضاف أن مصر تمثل “الكتاب العظيم لذاكرة البشرية”، فيما تعد أوزبكستان من الأراضي التي كتبت بعضاً من أبرز فصول التاريخ الفكري للإنسان، مؤكداً أن اللقاء اليوم لا يجمع ممثلين لدولتين فحسب، بل ورثة حضارتين عظيمتين أسهمتا في إثراء التراث الروحي والفكري المشترك للبشرية. وأكد أن قوة الدول في عالم اليوم لا تقاس فقط بقدراتها الاقتصادية أو التكنولوجية، وإنما أيضاً بإرثها الحضاري وإمكاناتها الفكرية وتأثيرها الروحي.,2026-06-14T09:41:19.978594+00:00,
youm7,tier1,https://www.youm7.com/story/2026/6/13/%D8%B3%D8%B9%D8%B1-%D8%A7%D9%84%D8%B0%D9%87%D8%A8-%D9%81%D9%89-%D9%85%D8%B5%D8%B1-%D9%8A%D8%B3%D8%AC%D9%84-%D8%A3%D8%AF%D9%86%D9%89-%D9%85%D8%B3%D8%AA%D9%88%D9%89-%D9%85%D9%86%D8%B0-%D9%8A%D9%86%D8%A7%D9%8A%D8%B1-%D9%88485/7446766,سعر الذهب فى مصر يسجل أدنى مستوى منذ يناير و485 جنيها خسائر للجرام - اليوم السابع,,2026-06-13 11:00:00+00:00,أغلق سعر الذهب العالمي هذا الأسبوع فوق 4200 دولار ما دفع عيار 21 للعود للصعود من جديد عقب هبوط ملحوظ تجاوز 400 جنيه خلال تعاملات الأسبوع الماضي.,اليوم السابع,ar,361,د سعر الذهب في مصر تراجعًا ملحوظًا خلال الأسبوع الماضي، ليسجل أدنى مستوياته منذ منتصف يناير الماضي، مواصلا خسائره للأسبوع الخامس على التوالي، في أطول موجة هبوط يشهدها السوق المحلي منذ فترة طويلة، وذلك بحسب التحليل الفني الصادر عن جولد بيليون. أسعار الذهب اليوم في مصر - سعر الذهب عيار 24: 7137 جنيها للجرام. - سعر الذهب عيار 21: 6245 جنيهًا للجرام. - سعر الذهب عيار 18: 5353 جنيهًا للجرام. - سعر الجنيه الذهب: 49960 جنيهًا. خسائر الذهب في مصر ووفقًا لتحليل جولد بيليون ، فقد خسر الذهب المحلي نحو 485 جنيهًا للجرام منذ بداية شهر يونيو، لتتراجع مكاسبه منذ بداية العام إلى نحو 415 جنيهًا للجرام فقط. وأشار التحليل الفني، إلى أن الهبوط الأخير في أسعار الذهب بالسوق المحلية جاء مدفوعًا بشكل أساسي بتراجع أسعار الذهب العالمية، في ظل استقرار سعر صرف الدولار مقابل الجنيه داخل البنوك، ما جعل تسعير الذهب المحلي يعتمد بصورة أكبر على حركة الأونصة عالميًا. وأوضح التقرير، أن الفجوة بين السعر المحلي والعالمي تقلصت خلال الفترة الأخيرة، بما يعكس كفاءة أكبر في تسعير الذهب بالسوق المصرية واستجابة مباشرة وسريعة لتحركات الأسعار العالمية، وهو ما يشير أيضًا إلى حالة من التوازن النسبي بين العرض والطلب. أسعار الذهب فقدت 20% منذ بداية الحرب الإيرانية يتسبب في عمليات خروج واستردادات في صناديق الذهب العالمية، حيث يتجه المستثمرون إلى أسواق السندات والأصول المالية الأخرى التي تقدم عائد متوقع له الارتفاع إذا لجأ البنك الفيدرالي إلى رفع أسعار الفائدة هذا العام. وصرح الرئيس ترامب، بأن واشنطن وطهران قد توقعان اتفاق سلام في نهاية هذا الأسبوع، مما قد يؤدي إلى إعادة فتح مضيق هرمز وتخفيف المخاوف بشأن إمدادات الطاقة العالمية، بينما صرح مسؤولون إيرانيون بأنه لم يتم التوصل إلى اتفاق نهائي بعد، مما يبقي حالة عدم اليقين تخيم على مستقبل المنطقة. أشار تحليل جولد بيليون إلي عودة سعر الذهب إلى الهبوط اليوم في ظل استمرار عوائد السندات الحكومية مرتفعة بالإضافة إلى استمرار المخاوف من ارتفاع معدلات التضخم بشكل قد يجبر البنك الاحتياطي الفيدرالي الأمريكي على رفع الفائدة. وخلال اليومين الماضيين صدرت بيانات التضخم الأمريكية عن أسعار المستهلكين وأسعار المنتجين، وأظهرت البيانات بقاء التضخم الأمريكي مرتفع وبعيد عن مستهدف البنك الفيدرالي للتضخم عند 2%، وهو ما تسبب في زيادة رهانات الأسواق إلى 60% أن الفيدرالي قد يلجأ لرفع الفائدة في اجتماع ديسمبر القادم.,2026-06-14T09:41:20.827027+00:00,
youm7,tier1,https://www.youm7.com/story/2026/6/14/%D8%A7%D9%84%D9%86%D8%A7%D8%A6%D8%A8-%D8%A3%D9%8A%D9%85%D9%86-%D9%85%D8%AD%D8%B3%D8%A8-30-%D9%8A%D9%88%D9%86%D9%8A%D9%88-%D8%A3%D8%B9%D8%A7%D8%AF%D8%AA-%D8%A7%D9%84%D8%AF%D9%88%D9%84%D8%A9-%D8%A5%D9%84%D9%89-%D9%85%D8%B3%D8%A7%D8%B1-%D8%A7%D9%84%D8%AA%D9%86%D9%85%D9%8A%D8%A9/7447756,النائب أيمن محسب: 30 يونيو أعادت الدولة إلى مسار التنمية بعد سنوات الاضطراب - اليوم السابع,كتبت : سمر سلامة,2026-06-14 07:48:00+00:00,أكد الدكتور أيمن محسب، وكيل لجنة الشئون الاقتصادية بمجلس النواب، أن ثورة 30 يونيو تمثل محطة مهمة لاستحضار حجم التحديات التي واجهتها الدولة المصرية قبل عام 2013..,اليوم السابع,ar,506,"أكد الدكتور أيمن محسب، وكيل لجنة الشئون الاقتصادية بمجلس النواب، أن ثورة 30 يونيو تمثل محطة مهمة لاستحضار حجم التحديات التي واجهتها الدولة المصرية قبل عام 2013، وما تحقق بعدها من إنجازات أعادت صياغة مسار الدولة على أسس أكثر استقرارًا وقدرة على تحقيق التنمية، مشيرًا إلى أن الثورة بمثابة نقطة انطلاق نحو بناء دولة حديثة تمتلك رؤية واضحة للمستقبل. وأوضح ""محسب"" أن مصر كانت تواجه قبل ثورة 30 يونيو أوضاعًا بالغة الصعوبة على المستويات السياسية والاقتصادية والأمنية، حيث انعكست حالة الاضطراب وعدم الاستقرار على مختلف مؤشرات الاقتصاد، وتراجعت معدلات الاستثمار، وتضررت قطاعات حيوية مثل السياحة، بينما سادت حالة من القلق بشأن قدرة الدولة على مواجهة التحديات المتراكمة واستعادة مسار النمو. وأشار إلى أن استعادة الاستقرار السياسي والأمني عقب ثورة 30 يونيو مثلت الخطوة الأولى نحو إعادة بناء الاقتصاد الوطني، مؤكدًا أن التنمية لا يمكن أن تتحقق في ظل حالة من الفوضى أو غياب اليقين، وأن ما شهدته مصر من إصلاحات اقتصادية ومشروعات تنموية كبرى خلال السنوات التالية كان نتاجًا مباشرًا لاستعادة الدولة لقدرتها على التخطيط واتخاذ القرار. وأضاف وكيل لجنة الشئون الاقتصادية بمجلس النواب، أن الثورة فتحت الباب أمام مرحلة جديدة انتقلت خلالها الدولة من إدارة الأزمات اليومية إلى تبني رؤية استراتيجية طويلة الأجل، تجسدت في إطلاق العديد من المشروعات القومية التي استهدفت بناء بنية تحتية حديثة وتطوير قدرات الدولة الاقتصادية وتعزيز تنافسيتها. وأوضح أن السنوات التي أعقبت 30 يونيو شهدت تنفيذ شبكة ضخمة من الطرق والمحاور الاستراتيجية، والتوسع في إنشاء المدن الجديدة ومدن الجيل الرابع، إلى جانب تطوير الموانئ والمناطق اللوجستية، بما ساهم في تحسين بيئة الاستثمار ورفع كفاءة الاقتصاد الوطني وقدرته على جذب الاستثمارات المحلية والأجنبية. وأكد ""محسب"" أن الدولة نجحت كذلك في تحقيق طفرة كبيرة في قطاع الطاقة، سواء من خلال القضاء على أزمة الكهرباء أو التوسع في مشروعات الطاقة المتجددة، وهو ما وفر أحد أهم مقومات التنمية الاقتصادية وجذب الاستثمارات، فضلًا عن تطوير المنطقة الاقتصادية لقناة السويس لتصبح مركزًا واعدًا للتجارة والصناعة والخدمات اللوجستية. وأشار إلى أن ما يميز المرحلة التي أعقبت ثورة 30 يونيو هو أن المواطن كان في قلب عملية التنمية، وهو ما ظهر بوضوح في المبادرات والمشروعات التي استهدفت تحسين جودة الحياة، وفي مقدمتها المشروع القومي لتطوير الريف المصري ""حياة كريمة""، وجهود القضاء على المناطق غير الآمنة وتوفير سكن ملائم للمواطنين، والتوسع في شبكات الحماية الاجتماعية والرعاية الصحية. وأضاف أن الدولة لم تكتف بتنفيذ مشروعات البنية الأساسية، بل عملت في الوقت ذاته على بناء الإنسان المصري والاستثمار في قدراته، من خلال تطوير منظومات التعليم والصحة والتدريب والتأهيل، بما يتماشى مع أهداف الجمهورية الجديدة ومتطلبات التنمية المستدامة. وشدد ""محسب"" على أن ما تشهده المنطقة والعالم من أزمات اقتصادية وجيوسياسية متلاحقة يؤكد أهمية ما حققته مصر من خطوات لتعزيز قدرتها على الصمود ومواجهة التحديات، مشيرًا إلى أن امتلاك بنية تحتية قوية واقتصاد أكثر تنوعًا ومؤسسات دولة مستقرة أسهم في تعزيز قدرة الدولة على التعامل مع المتغيرات الإقليمية والدولية. وأكد النائب أيمن محسب على أن ثورة 30 يونيو ستظل علامة فارقة في تاريخ مصر الحديث، ليس فقط لأنها أنقذت الدولة الوطنية وأعادت الاستقرار، ولكن لأنها أرست الأساس لمرحلة جديدة من البناء والتنمية الشاملة، ووضعت مصر على طريق الجمهورية الجديدة التي تستند إلى التخطيط والعمل والإنتاج، وتسعى إلى تحقيق مستقبل أفضل للأجيال القادمة.",2026-06-14T09:41:21.065109+00:00,
youm7,tier1,https://www.youm7.com/story/2026/6/13/%D8%AA%D8%B9%D8%B1%D9%81-%D8%B9%D9%84%D9%89-%D8%B3%D8%B9%D8%B1-%D8%A7%D9%84%D8%AF%D9%88%D9%84%D8%A7%D8%B1-%D9%85%D9%82%D8%A7%D8%A8%D9%84-%D8%A7%D9%84%D8%AC%D9%86%D9%8A%D9%87-%D9%81%D9%89-%D8%A8%D9%86%D9%83-%D8%A7%D9%84%D8%A5%D8%B3%D9%83%D9%86%D8%AF%D8%B1%D9%8A%D8%A9-%D8%A7%D9%84%D9%8A%D9%88%D9%85/7447258,تعرف على سعر الدولار مقابل الجنيه فى بنك الإسكندرية اليوم السبت - اليوم السابع,كتب أيمن رمضان الشريف,2026-06-13 17:00:00+00:00,استقر سعر الدولار مقابل الجنيه المصرى، اليوم السبت 13 يونيو 2026، فى بنك الإسكندرية عند 51.83 جنيه للشراء، و51.93 جنيه للبيع.,اليوم السابع,ar,176,"استقر سعر الدولار مقابل الجنيه المصرى، اليوم السبت 13 يونيو 2026، فى بنك الإسكندرية عند 51.83 جنيه للشراء، و51.93 جنيه للبيع. وثبت سعر الدولار فى البنك المركزى المصرى عند 51.91 جنيه للشراء، و52.05 جنيه للبيع، وفي البنك الأهلي المصري 51.93 جنيه للشراء، و52.03 جنيه للبيع. واستقر سعر الدولار فى البنك التجارى الدولى-cib عند 51.90 جنيه للشراء، و52 جنيها للبيع. وسجل سعر الدولار في البنوك كالتالي: سعر الدولار في البنك المركزي المصري - 51.91 جنيه للشراء. - 52.05 جنيه للبيع. سعر الدولار في البنك الأهلي المصري - 51.93 جنيه للشراء. - 52.03 جنيه للبيع. سعر الدولار في بنك مصر - 51.93 جنيه للشراء. - 52.03 جنيه للبيع. سعر الدولار في بنك الإسكندرية - 51.83 جنيه للشراء. - 51.93 جنيه للبيع. سعر الدولار في البنك التجاري الدولي ""cib"" - 51.90 جنيه للشراء. - 52.00 جنيها للبيع. سعر الدولار في مصرف أبو ظبي الإسلامي - 52.16 جنيه للشراء. - 52.26 جنيه للبيع. سعر الدولار في بنك البركة - 51.90 جنيه للشراء. - 52.00 جنيها للبيع. سعر الدولار في بنك قناة السويس - 51.95 جنيه للشراء. - 52.05 جنيه للبيع.",2026-06-14T09:41:21.422735+00:00,
