site,tier,url,title,author,published_at,description,site_name,language,word_count,text,extracted_at,error
akhbarelyom,tier2,https://akhbarelyom.com/news/newdetails/4834529/1/%D8%A7%D9%84%D9%85%D8%AD%D9%83%D9%85%D8%A9-%D8%A7%D9%84%D8%A7%D9%82%D8%AA%D8%B5%D8%A7%D8%AF%D9%8A%D8%A9-%D8%A8%D8%A7%D9%84%D8%A5%D8%B3%D9%83%D9%86%D8%AF%D8%B1%D9%8A%D8%A9-%D8%AA%D8%A4%D9%8A%D8%AF-%D8%AD%D9%83%D9%85-,المحكمة الاقتصادية بالإسكندرية تؤيد حكم حبس كروان مشاكل سنتين,akhbarelyom,2026-06-13 11:43:36+00:00,بوابة أخبار اليوم الإلكترونية,بوابة اخبار اليوم,,174,قضت المحكمة الاقتصادية بالإسكندرية ، برئاسة المستشار أحمد فوزى رئيس المحكمة، وبعضوية كل من المستشار ياسمين العناني والمستشار خالد أصلان، والمستشار محمد عصام فؤاد فى القضية المقيدة برقم 855 لسنة 2026 جنح الاقتصادية بتاييد الحكم المعارض عليه بمعاقبة المتهم كروان مشاكل بالحبس سنتين مع الشغل وكفالة 50 ألف جنيه وتغريمه مبلغ 200 ألف جنيه بتهمة نشر مقطع فيديو خادش للحياء والقيم. اقرأ أيضًا| حبس كروان مشاكل عامين بتهمة نشر فيدوهات خادشة للحياء وكانت نيابة الشئون الاقتصادية بالإسكندرية، قد تلقت بلاغ بقيام المتهم كروان مشاكل في غضون شهر مايو 2026 نشر مقطع فيديو مصور عبر مواقع التواصل الاجتماعي، يحتوي علي عبارات خادشة للحياء ، حيث قررت إحالة المتهم «ا.ع.م» وشهرته كروان مشاكل إلى محكمة جنح الاقتصادية لمحاكمته، لاتهامه بنشر مقطع فيديو من خلال حساب منشأ علي مواقع التواصل الاجتماعي تيك توك من شأنه خدش الحياء العام. وعقب تقنين الإجراءات تمكنت الأجهزة الأمنية بمديرية أمن الإسكندرية، من إلقاء القبض علي المتهم كروان مشاكل طبقاً لمواد الاتهام بالمادتين 166 مكرر و178 من قانون العقوبات والقانون رقم 175 لسنة 2018 بشأن مكافحة جرائم تنقية المعلومات وقانون تنظيم الاتصالات.,2026-06-14T09:41:39.999102+00:00,
akhbarelyom,tier2,https://akhbarelyom.com/news/newdetails/4834621/1/%D8%A7%D9%84%D9%82%D8%B5%D9%81-%D8%A7%D9%84%D8%A5%D8%B3%D8%B1%D8%A7%D8%A6%D9%8A%D9%84%D9%8A-%D9%8A%D9%85%D8%AA%D8%AF-%D8%A5%D9%84%D9%89-%D9%85%D8%AE%D8%AA%D9%84%D9%81-%D9%85%D9%86%D8%A7%D8%B7%D9%82-%D8%BA%D8%B2,القصف الإسرائيلي يمتد إلى مختلف مناطق غزة ويزيد من معاناة المدنيين,akhbarelyom,2026-06-13 14:22:09+00:00,بوابة أخبار اليوم الإلكترونية,بوابة اخبار اليوم,,207,قال بشير جبر مراسل القاهرة الإخبارية، إن العمليات العسكرية الإسرائيلية لا تقتصر على مناطق محددة داخل قطاع غزة ، بل تمتد إلى مختلف المناطق المصنفة ضمن خرائط الإخلاء والمناطق السكنية التي لا تزال تضم أعدادًا كبيرة من المدنيين، مشيرًا إلى أن السكان يواجهون بشكل يومي أوضاعًا أمنية وإنسانية بالغة الصعوبة نتيجة استمرار القصف والاستهدافات المتواصلة. وأوضح «جبر» أن المناطق التي شهدت في السابق إنذارات أو عمليات إخلاء لا تزال تتعرض لعمليات تدمير وقصف يومية، كما أن المناطق السكنية التي يقيم فيها المواطنون الفلسطينيون تشهد بدورها غارات واستهدافات متكررة تنفذها الطائرات المسيّرة الإسرائيلية أو الطائرات الحربية، ما يوسع نطاق الخطر ليشمل أجزاء مختلفة من القطاع. وأشار المراسل إلى أن الأيام الأخيرة شهدت استهدافات مباشرة لمنازل ومنشآت في مدينة دير البلح ومخيم المغازي، إضافة إلى مناطق أخرى تعرضت للقصف سابقًا مثل مخيم الشاطئ ومدينة خان يونس جنوب القطاع، مضيفا أن هذه الهجمات تأتي في إطار تصعيد عسكري مستمر يطال ما تبقى من البنية التحتية والمرافق المدنية. وأكد «جبر» أن استمرار العمليات العسكرية يؤدي إلى تفاقم حجم الدمار والخسائر في قطاع غزة، لافتًا إلى أن العديد من المنشآت والمباني تعرضت للتدمير خلال فترة الحرب الممتدة منذ أكثر من عامين ونصف، وأن ما تبقى من المرافق والبنية العمرانية يواجه تهديدًا مستمرًا في ظل تواصل القصف والغارات على مناطق متفرقة من القطاع.,2026-06-14T09:41:40.394813+00:00,
akhbarelyom,tier2,https://akhbarelyom.com/news/newdetails/4834622/1/%D8%AA%D8%B5%D8%B9%D9%8A%D8%AF-%D8%A5%D8%B3%D8%B1%D8%A7%D8%A6%D9%8A%D9%84%D9%8A-%D9%88%D8%A7%D8%B3%D8%B9-%D9%81%D9%8A-%D8%A7%D9%84%D8%B6%D9%81%D8%A9-%D8%A7%D9%84%D8%BA%D8%B1%D8%A8%D9%8A%D8%A9-%D9%8A%D8%B4%D9%85,تصعيد إسرائيلي واسع في الضفة الغربية يشمل اقتحامات واعتداءات للمستوطنين,akhbarelyom,2026-06-13 14:22:11+00:00,بوابة أخبار اليوم الإلكترونية,بوابة اخبار اليوم,,216,قالت ولاء السلامين مراسلة «القاهرة الإخبارية»، إن قوات الاحتلال الإسرائيلي كثفت خلال الساعات الأخيرة إجراءاتها العسكرية في مناطق متفرقة من الضفة الغربية ، حيث أغلقت بلدة الخضر جنوب بيت لحم بشكل كامل، بما في ذلك المدخل الرئيسي والطرق الفرعية، دون الإعلان عن أسباب واضحة لهذا الإجراء، في وقت تشهد فيه عدة مدن وبلدات فلسطينية تصعيدًا ميدانيًا متواصلًا. وأوضحت «السلامين» أن قوات الاحتلال اقتحمت مخيم الدهيشة جنوب بيت لحم، ما أدى إلى اندلاع مواجهات مع الشبان الفلسطينيين وإصابة عدد من المواطنين بحالات اختناق جراء إطلاق قنابل الغاز المسيل للدموع، كما أشارت إلى إصابة شاب من ذوي الإعاقة خلال اقتحام بلدة دوما التابعة لمحافظة نابلس، وسط استمرار العمليات العسكرية في عدد من المناطق الفلسطينية. وأضافت أن بلدة دير أبو مشعل شهدت هجومًا نفذه مستوطنون، تخلله إطلاق نار باتجاه عدد من الفلسطينيين، بالتزامن مع محاصرة أحد المساجد في المنطقة، كما لفتت إلى تعرض التجمعات البدوية شرق مدينة رام الله، وخاصة في محيط بلدة الطيبة، لضغوط ومضايقات متكررة من قبل المستوطنين، في مساعٍ لدفع السكان الفلسطينيين إلى مغادرة أراضيهم. وأكدت المراسلة أن الضفة الغربية تشهد بصورة شبه يومية اقتحامات واعتقالات ومداهمات للمنازل الفلسطينية، إلى جانب تجريف الأراضي والاستيلاء على ممتلكات ومواشٍ في بعض المناطق، مشيرة إلى أن هذه العمليات تمتد من شمال الضفة إلى جنوبها، وسط تصاعد ملحوظ في وتيرة الاعتداءات التي ينفذها الجيش الإسرائيلي و المستوطنون على حد سواء.,2026-06-14T09:41:40.735652+00:00,
akhbarelyom,tier2,https://akhbarelyom.com/news/newdetails/4834643/1/-%D9%81%D9%8A-%D9%86%D9%81%D9%82-%D8%AA%D8%AD%D8%AA-%D8%A7%D9%84%D8%A3%D8%B1%D8%B6--%D8%AC%D9%8A%D8%B4-%D8%A7%D9%84%D8%A5%D8%AD%D8%AA%D9%84%D8%A7%D9%84-%D9%8A%D8%B9%D9%84%D9%86-%D8%A7%D9%84%D9%82,«في نفق تحت الأرض ».. جيش الإحتلال يعلن القضاء على 7 عناصر من حزب الله,akhbarelyom,2026-06-13 15:33:27+00:00,بوابة أخبار اليوم الإلكترونية,بوابة اخبار اليوم,,124,"أعلن الجيش الإسرائيلي القضاء على 7 عناصر من حزب الله داخل نفق تحت الأرض في جنوب لبنان، وذلك في إطار سلسلة عملياته المتواصلة للبنى التحتية التابعة للحزب. وفي سياق متصل، كان أعلن جيش الاحتلال الإسرائيلي ، أمس-الجمعة، أنه نفذ نحو 310 غارات جوية على أهداف تابعة ل«حزب الله» في جنوب لبنان خلال الأسبوع الماضي. وقالت المتحدثة باسم الجيش الإسرائيلي، إيلا واوية إن هذه العمليات أسفرت عن مقتل 80 من عناصر "" حزب الله "" خلال الأسبوع الأخير. وأضافت أنه تم قتل 20 شخصا في قطاع غزة واعتقال أكثر من 50 آخرين خلال الفترة نفسها. وتأتي هذه التطورات الميدانية في ظل تصعيد عسكري مستمر؛ حيث تشهد المنطقة اشتباكات متكررة وأوامر إخلاء عسكرية متجددة شملت مؤخراً سكان 20 بلدة وقرية في قضائي النبطية وجزين جنوبي لبنان.",2026-06-14T09:41:41.115095+00:00,
akhbarelyom,tier2,https://akhbarelyom.com/news/newdetails/4834647/1/%D8%B1%D8%A6%D9%8A%D8%B3-%D9%88%D8%B2%D8%B1%D8%A7%D8%A1-%D8%A8%D8%A7%D9%83%D8%B3%D8%AA%D8%A7%D9%86-%D8%A5%D8%AA%D9%85%D8%A7%D9%85-%D8%A7%D9%84%D8%AA%D9%81%D8%A7%D9%87%D9%85-%D8%A8%D9%8A%D9%86-%D8%A5%D9%8A%D8%B1,رئيس وزراء باكستان: إتمام التفاهم بين إيران والولايات المتحدة خلال 24 ساعة,akhbarelyom,2026-06-13 15:39:33+00:00,بوابة أخبار اليوم الإلكترونية,بوابة اخبار اليوم,,97,"توقَّع رئيس الوزراء الباكستاني شهباز شريف إتمام التفاهم بين إيران والولايات المتحدة خلال 24 ساعة. وقال ""شريف""، اليوم السبت في منشور على منصة إكس: ""نحن أقرب إلى اتفاق سلام من أي وقت مضى.. ومع توقع إتمام الاتفاق خلال الساعات ال24 المقبلة"". وأشار إلى أن ""باكستان تستعد للتوقيع الإلكتروني على اتفاق السلام بين أمريكا وإيران فور إتمامه، على أن تعقب ذلك محادثات فنية الأسبوع المقبل"". وأعرب ""شريف"" عن شكره للولايات المتحدة وإيران على ""التزامهما المستمر خلال المفاوضات""، كما قدم امتنانه لدول المنطقة على دعمها. وأضاف: ""نحن واثقون بأن هذا الاتفاق التاريخي للسلام سيشكل أساسًا قويًا لتحقيق سلام دائم"".",2026-06-14T09:41:41.396260+00:00,
akhbarelyom,tier2,https://akhbarelyom.com/news/newdetails/4834567/1/%D8%B9%D8%B6%D9%88-%D8%A8%D8%A7%D9%84%D8%B4%D9%8A%D9%88%D8%AE-%D8%AA%D9%88%D8%B1%D9%8A%D8%AF-46-%D9%85%D9%84%D9%8A%D9%88%D9%86-%D8%B7%D9%86-%D9%82%D9%85%D8%AD-%D8%B1%D8%B3%D8%A7%D9%84%D8%A9-,عضو بالشيوخ: توريد 4.6 مليون طن قمح رسالة نجاح جديدة للدولة المصرية,akhbarelyom,2026-06-13 12:47:59+00:00,بوابة أخبار اليوم الإلكترونية,بوابة اخبار اليوم,,199,ثمّن النائب إبراهيم عيسى، عضو لجنة الزراعة والري ب مجلس الشيوخ ، إعلان الحكومة وصول كميات القمح المحلي الموردة من المزارعين إلى 4.6 مليون طن حتى الآن، مؤكداً أن هذا الرقم يعكس نجاح الدولة في تنفيذ استراتيجية متكاملة لتحقيق الأمن الغذائي وتعزيز الاعتماد على الإنتاج المحلي. وقال عيسى ، إن الدولة المصرية بقيادة الرئيس عبد الفتاح السيسي أولت ملف الزراعة اهتماماً غير مسبوق، من خلال التوسع في الرقعة الزراعية، وتطوير منظومة الصوامع، وتقديم حوافز حقيقية للمزارعين، وهو ما انعكس بصورة مباشرة على ارتفاع معدلات التوريد هذا الموسم. اقرأ أيضًا.. بعد تصدره منصة X.. مقترح عضو بالشيوخ لإنشاء نقابة لصناع المحتوى يحقق تفاعلاً واسعاً وأضاف أن ما تحقق من أرقام يؤكد ثقة المزارعين في سياسات الدولة الزراعية، ونجاح الحكومة في توفير بيئة داعمة للإنتاج، مشيراً إلى أن الفلاح المصري أثبت مجدداً أنه شريك أساسي في معركة التنمية وتحقيق الأمن الغذائي. وأكد عضو مجلس الشيوخ أن زيادة كميات القمح الموردة تسهم في تقليل فاتورة الاستيراد وتخفيف الضغوط الناتجة عن التقلبات العالمية، بما يدعم الاقتصاد الوطني ويعزز قدرة الدولة على تأمين احتياجات المواطنين من السلع الاستراتيجية. وأكد النائب إبراهيم عيسي ، أن استمرار دعم المزارعين وتوفير مستلزمات الإنتاج بأسعار مناسبة سيظل أحد أهم الركائز لضمان تحقيق طفرة زراعية مستدامة خلال السنوات المقبلة.,2026-06-14T09:41:41.535332+00:00,
akhbarelyom,tier2,https://almsaey.akhbarelyom.com/news/newdetails/3538132/1/%D8%B1%D8%A6%D9%8A%D8%B3-%D8%A7%D9%84%D9%88%D8%B2%D8%B1%D8%A7%D8%A1-%D9%8A%D8%B3%D8%AA%D9%82%D8%A8%D9%84-%D9%88%D8%B2%D9%8A%D8%B1-%D8%AE%D8%A7%D8%B1%D8%AC%D9%8A%D8%A9-%D8%A3%D9%88%D8%B2%D8%A8%D9%83%D8%B3%D8%AA%D8%A7,رئيس الوزراء يستقبل وزير خارجية أوزبكستان,akhbarelyom,2026-06-13 10:04:11+00:00,موقع الأخبار المسائى,الأخبار المسائى,,526,استقبل الدكتور مصطفى مدبولي، رئيس مجلس الوزراء، صباح اليوم، بختيار سعيدوف، وزير خارجية جمهورية أوزبكستان الصديقة، وذلك بحضور السفير منصور بيك كيليتشيف، سفير جمهورية أوزبكستان لدى مصر، والسفير عمرو حمزة، مساعد وزير الخارجية للشئون الآسيوية وشئون استراليا ونيوزيلندا وجزر المحيط الهادئ. وفي مستهل اللقاء، رحب رئيس الوزراء بوزير الخارجية الأوزبكي، مثمناً الزخم الإيجابي والاهتمام المتزايد من جانب البلدين بتعزيز العلاقات الوثيقة، ومُعرباً عن تطلعه لتدعيم علاقات التعاون الثنائي بين مصر وأوزبكستان في العديد من المجالات ذات الاهتمام المشترك. وأكد الدكتور مصطفى مدبولي تطلع مصر لمواصلة أطر التنسيق مع أوزبكستان في المحافل الدولية، واهتمام مصر بدعم مجالات التعاون الاقتصادي مع أوزبكستان من خلال تنفيذ مشروعات واستثمارات تُسهم في زيادة حجم التبادل التجاري في ضوء الإمكانات المتاحة، فضلاً عن التطلع لتأسيس غرفة التجارة المصرية الأوزبكية، وعقد مجلس الأعمال المشترك، بجانب استمرار التفاوض من أجل التوصل إلى اتفاقية تجارة حرة تفضيلية. وأوضح رئيس الوزراء أن موقع مصر الاستراتيجي يتيح لأوزبكستان النفاذ إلى أسواق العديد من الدول في الشرق الأوسط وأفريقيا، بالإضافة إلى الأثر الايجابي لنشاط عدد من الشركات المصرية العاملة في أوزبكستان، خاصة في مجال البنية التحتية، وكذلك الاستثمارات المصرية في مجال إنتاج الأجهزة الكهربائية مع إمكانية التعاون المُشترك في مجال إنتاج الدواء. وتطرق اللقاء لبحث تطورات الأوضاع الإقليمية في المنطقة، والجهود المصرية الرامية لتسوية الأزمات الإقليمية وخفض التوترات وتعزيز الأمن والاستقرار في المنطقة، وكذا الإشارة إلى الرؤية المصرية في هذا الصدد؛ خاصة الجهود المرتبطة بتسوية القضية الفلسطينية. من جانبه، أعرب بختيار سعيدوف، وزير خارجية جمهورية أوزبكستان، عن تقديره لحسن الاستقبال وكرم الضيافة الذي لمسه في مصر، كما نقل تحيات الرئيس شوكت ميرضياييف، رئيس جمهورية أوزبكستان؛ إلى الرئيس عبد الفتاح السيسي، رئيس الجمهورية. وأشاد الوزير الأوزبكي بجهود الرئيس عبد الفتاح السيسي في تسوية الأزمات في المنطقة، مُعرباً عن تطلعه لتطوير العلاقات مع مصر في مختلف المجالات ذات الاهتمام المشترك، ومؤكداً أن هذه الزيارة تمثل دفعة نحو تطوير العلاقات الثنائية بين البلدين. وأكد بختيار سعيدوف، تطلع بلاده لإقامة مشروعات مشتركة مع مصر في عددٍ من المجالات على رأسها البنية التحتية، وكذا العمل على تطوير العلاقات المشتركة وعقد اجتماعات مجلس الأعمال بين البلدين، ودفع حجم التبادل التجاري إلى المستويات المأمولة بما يرقى إلى مستوى العلاقات السياسية الوطيدة بين البلدين، وذلك عبر دعم العلاقات الاقتصادية المشتركة. وأشار الوزير الأوزبكي إلى أهمية السوق المصرية بالنسبة لبلاده للنفاذ إلى أسواق الدول المجاورة، وكذلك أهمية أوزبكستان لمصر للنفاذ لدول آسيا الوسطى، حيث استعرض عدداً من مجالات التعاون المشترك مثل تصنيع المعدات الزراعية عبر الاستفادة بالمناطق الحرة في مصر، وكذا إمكانية التعاون في تصنيع السيارات والأسمدة والمواد الكيميائية والدواء، بالاضافة إلى إمكانية التعاون بين البلدين على مستوى المناطق الاقتصادية أو الصناعية أو المحافظات. وأشاد بختيار سعيدوف، بمستوى التطور الاقتصادي الذي شهدته مصر، مُشيراً إلى أن الاقتصاد الأوزبكي شهد بدوره تطوراً ملموساً وهو ما يسمح بدعم التعاون المشترك. وأكد الوزير الأوزبكي دعم بلاده للجهود المتواصلة لتسوية القضية الفلسطينية وإقامة الدولة الفلسطينية المستقلة على خطوط الرابع من يونيو ١٩٦٧ وعاصمتها القدس الشرقية، مُشيراً إلى الدعم المقدم من جانب بلاده للشعب الفلسطيني في قطاع غزة، خاصة في القطاع الطبي، كما تناول اللقاء سبل التعاون الثنائي في المحافل الدولية خاصة في إطار حركة عدم الانحياز. وفي ختام الاجتماع، أكد الدكتور مصطفى مدبولي، توجيه وزارة الخارجية والتعاون الدولي والمصريين بالخارج، بوضع مجمل مقترحات التعاون التي تم طرحها موضع التنفيذ؛ بما يدفع نحو تعزيز التعاون الثنائي بين البلدين نحو الآفاق المأمولة.,2026-06-14T09:41:42.456495+00:00,
akhbarelyom,tier2,https://akhbarelyom.com/news/newdetails/4834620/1/-%D8%A7%D9%84%D9%82%D8%A7%D9%87%D8%B1%D8%A9-%D8%A7%D9%84%D8%A5%D8%AE%D8%A8%D8%A7%D8%B1%D9%8A%D8%A9--%D8%A7%D9%84%D8%AC%D9%8A%D8%B4-%D8%A7%D9%84%D8%B3%D9%88%D8%AF%D8%A7%D9%86%D9%8A-%D9%8A%D8%B5%D8%AF-%D9%87,«القاهرة الإخبارية»: الجيش السوداني يصد هجمات للدعم السريع في النيل الأزرق,akhbarelyom,2026-06-13 14:20:25+00:00,بوابة أخبار اليوم الإلكترونية,بوابة اخبار اليوم,,229,قال محمد إبراهيم مراسل «القاهرة الإخبارية»، إن التطورات الميدانية في السودان تشهد تسارعًا ملحوظًا على عدة جبهات، مشيرًا إلى أن الجيش السوداني تمكن من صد هجوم شنته قوات الدعم السريع بالتعاون مع الحركة الشعبية بقيادة جوزيف توكا في ولاية النيل الأزرق، وذلك بعد محاولة التقدم نحو مناطق داخل الولاية، قبل أن تتصدى لها القوات الحكومية وتمنع اختراق مواقعها. وأوضح «إبراهيم» أن ولاية شمال كردفان شهدت هجمات جديدة بالطائرات المسيّرة، حيث استهدفت مسيّرة تابعة لقوات الدعم السريع محطة وقود داخل سوق مدينة الأبيض، عاصمة الولاية، مضيفا أن الأيام الماضية شهدت أيضًا استهداف أحياء مدنية بالمسيّرات، ما أسفر عن سقوط قتلى وجرحى، في مؤشر على استمرار ما بات يعرف ب «حرب المسيّرات» بين طرفي الصراع. وأشار المراسل إلى وقوع هجوم في منطقة تندلتي بولاية النيل الأبيض، وهي منطقة قريبة من ولاية شمال كردفان، بالتزامن مع تصاعد العمليات العسكرية في إقليم دارفور، لافتا إلى أن الجيش السوداني نفذ هجمات عبر الطائرات المسيّرة استهدفت مواقع لقوات الدعم السريع في شمال دارفور ومحيط مدينة الفاشر، حيث لا تزال القوات التابعة للدعم السريع تحتفظ بوجود عسكري داخل المدينة. وأكد «إبراهيم» أن الجيش السوداني يواصل عملياته باتجاه عدد من المدن الرئيسية في إقليم دارفور، وفي مقدمتها مدينة نيالا عاصمة ولاية جنوب دارفور، التي تعد أحد أبرز معاقل قوات الدعم السريع ومركزًا لإدارة عملياتها، كما أن التحركات العسكرية تشمل أيضًا مناطق في ولايات شمال ووسط وشرق دارفور، ما يعكس اتساع نطاق المواجهات واستمرار المعارك على جبهات متعددة.,2026-06-14T09:41:42.141447+00:00,
