site,tier,url,title,author,published_at,description,site_name,language,word_count,text,extracted_at,error
youm7,tier1,https://www.youm7.com/story/2026/5/30/%D8%A8%D8%B9%D8%AB%D8%A9-%D9%85%D9%86%D8%AA%D8%AE%D8%A8-%D9%85%D8%B5%D8%B1-%D8%AA%D8%B7%D9%8A%D8%B1-%D8%A7%D9%84%D9%8A%D9%88%D9%85-%D8%A5%D9%84%D9%89-%D8%A3%D9%85%D8%B1%D9%8A%D9%83%D8%A7-%D9%84%D9%84%D9%85%D8%B4%D8%A7%D8%B1%D9%83%D8%A9-%D9%81%D9%8A-%D9%83%D8%A3%D8%B3/7431753,بعثة منتخب مصر تطير اليوم إلى أمريكا للمشاركة في كأس العالم - اليوم السابع,حاتم رضا,2026-05-30 06:11:57+00:00,تغادر بعثة منتخب مصر الأول ، اليوم السبت، مطار القاهرة متجهة إلى الولايات المتحدة الأمريكية علي متن طائرة خاصة للمشاركة في بطولة كأس العالم 2026.,اليوم السابع,ar,453,"تغادر بعثة منتخب مصر الأول ، اليوم السبت، مطار القاهرة متجهة إلى الولايات المتحدة الأمريكية علي متن طائرة خاصة للمشاركة في بطولة كأس العالم 2026. 26 لاعباً في بعثة المنتخب تضم البعثة 26 لاعبا وفقا لتعليمات الاتحاد الدولي لكرة القدم، بجانب أعضاء الجهاز الفني والإداري والطبي. حسام حسن يمنح اللاعبين إجازة وحصل لاعبو المنتخب الوطني علي إجازة لمدة 24 ساعة أمس الجمعة ، وتحديدا عقب المباراة الودية أمام روسيا باستاد القاهرة والتي انتهت بفوز مصر بهدف مصطفي زيكو، علي أن يتجمع المنتخب اليوم مجددا استعدادا للسفر إلى أمريكا. تصريحات إبراهيم حسن من جانبه، أكد إبراهيم حسن مدير منتخب مصر ، أنه لا يوجد أي تحفظ أو أسباب غير فنية تمنع انضمام أي لاعب إلى قائمة منتخب مصر المشاركة في كأس العالم 2026 بالولايات المتحدة الأمريكية. وأوضح إبراهيم حسن، خلال تصريحاته ، قائلاً: ""الجهاز الفني بقيادة حسام حسن لا يفكر سوى في مصلحة منتخب مصر فقط، ونراعي ربنا وضميرنا في عملنا ولا نظلم أحد فى اختيارات اللاعبين.. وفي حال استمرارنا في القيادة الفنية للفراعنة عقب كأس العالم، فهناك لاعبون سينضمون للمنتخب أيضًا، ولدينا بعض الخطط التي نسعى لتنفيذها"". وأشار إبراهيم حسن إلى أنه كان يتمنى تواجد إسلام عيسى، لاعب منتخب مصر، الذي تعرض للإصابة بقطع في الرباط الصليبي، بعدما قدم مستوى مميزًا في المباراتين الوديتين أمام إسبانيا والسعودية. منتخب مصر يتوج بكأس العاصمة الجديدة وتوج منتخب مصر بكأس العاصمة الجديدة بعد الفوز على روسيا ودياً بهدف دون رد فى المباراة التى جمعتهما مساء الخميس على استاد القاهرة الدولي استعدادًا لكأس العالم 2026. وحرص جوهر نبيل، وزير الشباب والرياضة، والمهندس هاني أبوريدة، رئيس الاتحاد المصري لكرة القدم، على التواجد داخل غرفة خلع ملابس المنتخب الوطني الأول لكرة القدم عقب مباراة روسيا، وذلك لدعم الجهاز الفني واللاعبين قبل بطولة كأس العالم. وأكد وزير الشباب والرياضة، خلال حديثه مع اللاعبين، ثقته الكاملة في الجهاز الفني والمنتخب الوطني بتقديم مستوى يليق باسم مصر في كأس العالم، مطالبًا اللاعبين بمواصلة العمل والتركيز خلال المرحلة المقبلة، مشددًا على أن الجماهير المصرية تنتظر منهم الكثير، وأنهم قادرون على إسعاد الشعب المصري وتحقيق نتائج مميزة. ومن جانبه، أكد المهندس هاني أبوريدة أن المنتخب خاض العديد من التجارب الودية القوية أمام مدارس كروية مختلفة خلال التوقفات الدولية الأخيرة، ونجح في تحقيق نتائج مميزة تعكس تطور مستوى الفريق، مشددًا على ثقته التامة في الجهاز الفني، بقيادة حسام حسن واللاعبين. وأضاف رئيس اتحاد الكرة أن المرحلة المقبلة تتطلب المزيد من التركيز والاجتهاد، مؤكدًا أن المنتخب يمتلك عناصر مميزة قادرة على المنافسة وتقديم صورة مشرفة للكرة المصرية على المستوى العالمي. ومن جانبه، قدم حسام حسن، المدير الفني لمنتخب مصر الشكر إلى جوهر نبيل والمهندس هاني أبوريدة والشركة المتحدة على الدعم المستمر للمنتخب الوطني، مؤكدًا أن الجميع داخل الفريق يعمل بروح واحدة من أجل تحقيق أفضل النتائج، وإسعاد الجماهير المصرية. وشهد اللقاء حضور خالد الدرندلي، نائب رئيس الاتحاد المصري لكرة القدم، ومحمد يحيى، رئيس الشركة المتحدة للرياضة.",2026-05-30T08:35:41.609507+00:00,
youm7,tier1,https://www.youm7.com/story/2026/5/29/%D8%AC%D8%AF%D9%88%D9%84-%D8%AA%D8%B1%D8%AA%D9%8A%D8%A8-%D8%A7%D9%84%D8%AF%D9%88%D8%B1%D9%8A-%D8%A7%D9%84%D9%85%D8%B5%D8%B1%D9%8A-%D8%A7%D9%84%D9%85%D9%85%D8%AA%D8%A7%D8%B2-%D9%85%D9%88%D8%B3%D9%85-2025-%E2%80%93-2026/7432294,جدول ترتيب الدوري المصري الممتاز موسم 2025 – 2026 - اليوم السابع,كتب _ عمر مراد,2026-05-29 19:38:00+00:00,انتهت منافسات موسم الدوري المصري الممتاز (2025 – 2026) اليوم الجمعة الموافق 29 مايو 2026، وهو الموسم الذي شهد الكثير من الإثارة والمتعة.,اليوم السابع,ar,123,انتهت منافسات موسم الدوري المصري الممتاز (2025 – 2026) اليوم الجمعة الموافق 29 مايو 2026، وهو الموسم الذي شهد الكثير من الإثارة والمتعة، سواء على صعيد صراع حصد اللقب أو منافسات الهروب من الهبوط. ​الزمالك بطل الدورى المصرى الممتاز ونجح فريق الزمالك في حصد لقب بطولة الدوري المصري الممتاز بعد اعتلائه الصدارة برصيد 56 نقطة، بينما جاء فريق بيراميدز في المركز الثاني برصيد 54 نقطة، وحل النادي الأهلي في المركز الثالث برصيد 53 نقطة. 4 أندية تهبط الى دورى المحترفين الموسم المقبل على رأسهم الإسماعيلى على الجانب الآخر، تأكد هبوط أربعة أندية إلى دوري المحترفين في الموسم المقبل عقب تذيلهم جدول ترتيب المسابقة، وهي أندية: الإسماعيلي ، حرس الحدود، فاركو، وكهرباء الإسماعيلية. جدول ترتيب مسابقة الدوري المصري الممتاز جدول ترتيب الدورى المصرى الممتاز,2026-05-30T08:35:41.466825+00:00,
youm7,tier1,https://www.youm7.com/story/2026/5/29/%D8%AA%D8%B6%D9%85-27-%D9%84%D8%A7%D8%B9%D8%A8%D8%A7-%D9%85%D9%84%D8%A7%D9%85%D8%AD-%D8%A7%D9%84%D9%82%D8%A7%D8%A6%D9%85%D8%A9-%D8%A7%D9%84%D9%86%D9%87%D8%A7%D8%A6%D9%8A%D8%A9-%D9%84%D9%85%D9%86%D8%AA%D8%AE%D8%A8-%D9%85%D8%B5%D8%B1-%D9%82%D8%A8%D9%84-%D8%A7%D9%84%D8%A5%D8%B9%D9%84%D8%A7%D9%86/7431709,تضم 27 لاعبا.. ملامح القائمة النهائية لمنتخب مصر قبل الإعلان الرسمي - اليوم السابع,كتبت ندى مجاهد,2026-05-29 09:40:00+00:00,ينتظر محبى و عشاق كرة القدم إعلان حسام حسن المدير الفني لمنتخب مصر، اليوم الجمعة، قائمة اللاعبين النهائية لبطولة كأس العالم 2026..,اليوم السابع,ar,227,"ينتظر محبى و عشاق كرة القدم إعلان حسام حسن المدير الفني لمنتخب مصر ، اليوم الجمعة، قائمة اللاعبين النهائية لبطولة كأس العالم 2026 ، والتي تضم 26 لاعبا ما يعني استبعاد لاعب واحد من القائمة المبدئية التي تضم 27 لاعبا. وتضم قائمة منتخب مصر المبدئية لكأس العالم 27 لاعبا هم: - حراسة المرمى: محمد الشناوي (الأهلي)، مصطفى شوبير (الأهلي)، المهدي سليمان (الزمالك)، محمد علاء (الجونة). - خط الدفاع: محمد هاني (الأهلي)، طارق علاء (زد)، حمدي فتحي (الوكرة القطري)، رامي ربيعة (العين الإماراتي)، محمد عبد المنعم (نيس الفرنسي)، ياسر إبراهيم (الأهلي)، حسام عبد المجيد وأحمد فتوح (الزمالك)، كريم حافظ (بيراميدز). - خط الوسط: مروان عطية وأحمد سيد ""زيزو"" وإمام عاشور (الأهلي)، مصطفى عبد الرؤوف ""زيكو"" ومهند لاشين (بيراميدز)، نبيل عماد ""دونغا"" (النجمة السعودي)، محمود صابر (زد). - خط الهجوم: محمد صلاح (ليفربول الإنجليزي)، محمود حسن ""تريزيجيه"" (الأهلي)، هيثم حسن (ريال أوفييدو الإسباني)، عمر مرموش (مانشستر سيتي الإنجليزي)، إبراهيم عادل (نورشيلاند الدنماركي)، أقطاي عبد الله (إنبي)، حمزة عبد الكريم (برشلونة الإسباني). إجازة 24 ساعة للاعبي منتخب مصر قبل السفر لأمريكا للمشاركة في كأس العالم يحصل منتخب مصر اليوم علي إجازة لمدة 24 ساعة قبل السفر غدا السبت، إلي الولايات المتحدة الأمريكية استعدادا لخوض منافسات بطولة كأس العالم. وفضل الجهاز الفني بقيادة حسام حسن حصول اللاعبين علي هذه الإجازة لقضاء بعض الوقت مع أسرهم تزامنا مع احتفالات عيد الأضحى المبارك قبل السفر غدا لأمريكا لدخول ""مرحلة الجد"" استعدادا لكأس العالم.",2026-05-30T08:35:42.424013+00:00,
youm7,tier1,https://www.youm7.com/story/2026/5/29/%D9%84%D9%88-%D8%B9%D8%A7%D9%8A%D8%B2-%D8%AF%D8%AE%D9%84-%D8%B4%D9%87%D8%B1%D9%89-%D8%AB%D8%A7%D8%A8%D8%AA-%D8%A3%D8%B9%D9%84%D9%89-%D8%B4%D9%87%D8%A7%D8%AF%D8%A7%D8%AA-%D8%A7%D9%84%D8%A7%D8%AF%D8%AE%D8%A7%D8%B1-%D9%81%D9%89-%D8%A7%D9%84%D8%A8%D9%86%D9%88%D9%83/7432143,لو عايز دخل شهرى ثابت.. أعلى شهادات الادخار فى البنوك - اليوم السابع,كتب - أحمد يعقوب,2026-05-29 14:59:00+00:00,يبحث المواطن عن أدوات استثمارية تدر دخلاً شهرياً ثابتا يدعم الموارد المالية بجانب الراتب أو المعاش..,اليوم السابع,ar,560,"يبحث المواطن عن أدوات استثمارية تدر دخلاً شهرياً ثابتا يدعم الموارد المالية بجانب الراتب أو المعاش. وقرر البنك المركزى المصرى قبل أيام تثبيت أسعار الفائدة على الإيداع والإقراض. ويعرض التقرير الحالى التفاصيل الكاملة لأعلى شهادات الادخار فى أكبر 4 بنوك تعمل فى مصر. وتطرح بنوك الأهلى ومصر والقاهرة شهادة بفائدة 17.25% بعائد يصرف شهريا لمدة 3 سنوات. ويطرح البنك الأهلى المصرى الشهادة الذهبية لمدة 3 و 5 و 7 سنوات وهى بالدولار الأمريكى واليورو. وأعلن البنك التجارى الدولى CIB عن طرح شهادات ادخار جديدة بعائد متغير يصل إلى 19.5% سنويًا، مع دورية صرف شهرية، لتصبح أعلى العوائد المطروحة في السوق حاليًا. كما يتيح البنك شهادة أخرى بعائد متغير يبلغ 19.25% سنويًا بدورية صرف يومية، وبفارق 0.25% أعلى من سعر الكوريدور لدى البنك المركزي، ما يعني تحرك العائد تلقائيًا صعودًا أو هبوطًا وفقًا لقرارات الفائدة. ويتيح البنك إصدار الشهادة بحد أدنى 1000 جنيه، ولمدة 3 سنوات، بعائد أعلى من سعر الإيداع لدى البنك المركزي ب 0.50%، ليكون العائد 19.5% حاليًا. كما طرح البنك شهادة أخرى، وهي شهادة الادخار اليومية ""Everyday "" ذات العائد المتغير يصل إلى 19.25% يصرف يوميًا. ويمكن للبنك إصدار الشهادة، بحد أدنى 1000 جنيه، ولمدة 3 سنوات، بعائد أعلى من سعر الإيداع لدى البنك المركزي ب 0.25%، ليكون العائد 19.25%. وأكد محمد الأتربي الرئيس التنفيذي ل البنك الأهلي المصري أن لجنة الألكو بالبنك قررت تعديل العائد على الشهادات البلاتينية ومدتها 3 سنوات ذات العائد الشهري لتصبح 17.25% بدلا من 16%. وأعلن بنك القاهرة عن طرح شهادة ادخارية لمدة 3 سنوات بعائد شهري تنافسي، إلى جانب إتاحة وديعة ادخارية لأجل 18 شهرًا بعائد مميز، بما يعزز من من تنوع الخيارات الاستثمارية المتاحة للعملاء . ما أعلى عائد في البنوك المصرية حاليًا؟ وتبدأ الشهادة من مليون جنيه، وتمنح عائدًا شهريًا بنسبة 17.25%، بما يوفر للعملاء فرصة ادخارية مستقرة تلائم الباحثين عن دخل دوري منتظم. كما يتيح البنك وديعة ادخارية لمدة عام ونصف (18 شهرًا) بعائد 22% يُصرف في نهاية المدة عند الاستحقاق، بما يوفر فرصة مناسبة للعملاء الراغبين في تعظيم العائد على مدخراتهم خلال فترة زمنية متوسطة. وسعر العائد على الشهادة بالدولار يصل إلى 4.75% لأجل 3 سنوات وتصل 4.90% دولار لأجل 7 سنوات ويصل العائد إلى 4.85% لأجل 5 سنوات. ويمكن الاقتراض بضمان هذه الشهادات من أى من فروع البنك الأهلى المصرى وفقاً والتعليمات السارية، فيما لا يمكن الاسترداد قبل مضى 6 اشهر، ويمكن استردادها قبل نهاية المدة وفقاً للقواعد والشروط المعلنة فى البنك. وقررت لجنة السياسة النقدية بالبنك المركزى المصرى فى نهاية اجتماعها الأخير، تثبيت أسعار الفائدة على الإيداع والإقراض لليلة واحدة عند 19%، و 20% على الترتيب. ويطرح البنك الأهلى المصرى العديد من شهادات الادخار بالجنيه المصرى ذات معدلات عائد مرتفعة. وبدأ استحقاق شهادة 27% و 23.5% خلال يناير الماضى ولمدة 4 أشهر حيث يبحث المواطن عن أعلى عائد للشهادات فى الوقت الحالى. ويبلغ سعر العائد على الشهادة البلاتينية بالجنيه المصرى ذات العائد الشهري لمدة 3 سنوات 17.25%. ويطرح البنك الأهلى المصرى الشهادة الادخارية لمدة سنة والتى تعد من الشهادات ثابتة العائد بمعدل 14% وبعائد يصرف شهريا. وشهادات الادخار تتيح عوائد للمواطنين تكون ثابتة شهرياً أو متغيرة على حسب سعر الفائدة المعلن من البنك المركزى المصرى. ويستخدم البنك المركزى أداة سعر الفائدة للسيطرة على التضخم - يعنى ارتفاع أسعار السلع والخدمات - عبر خفض سعر الفائدة مع تراجع التضخم أو زيادة أسعار الفائدة مع ارتفاع معدل زيادة الأسعار. وتتدرج مدد شهادات الادخار بالبنوك من سنة حتى 7 سنوات، وبأنواع مختلفة تشمل ثابتة العائد ومتغيرة العائد ومتناقصة العائد. ويبحث المواطن عن أعلى عائد على شهادات الادخار لمدة سنة.",2026-05-30T08:35:42.720621+00:00,
youm7,tier1,https://www.youm7.com/story/2026/5/29/%D9%87%D8%A7%D9%86%D9%8A-%D9%81%D8%A7%D8%B1%D9%88%D9%82-%D9%84%D9%80-%D8%A5%D9%83%D8%B3%D8%AA%D8%B1%D8%A7-%D9%86%D9%8A%D9%88%D8%B2-%D8%A3%D9%85%D9%86-%D8%A7%D9%84%D8%AE%D9%84%D9%8A%D8%AC-%D8%AE%D8%B7-%D8%A3%D8%AD%D9%85%D8%B1-%D9%84%D9%85%D8%B5%D8%B1/7432120,"هاني فاروق ل""إكسترا نيوز"": أمن الخليج ""خط أحمر"" لمصر.. ولا بديل عن تسوية شاملة - اليوم السابع",محمد شرقاوى,2026-05-29 15:08:00+00:00,"أكد هاني فاروق، مدير تحرير جريدة الأهرام، أن استمرار الهجمات الإيرانية على الدول العربية والخليجية، وآخرها استهداف دولة الكويت الشقيقة، يكشف عن ""نوايا خبيثة"" لدى طهران..",اليوم السابع,ar,284,"هاني فاروق، مدير تحرير جريدة الأهرام ، أن استمرار الهجمات الإيرانية على الدول العربية والخليجية، وآخرها استهداف دولة الكويت الشقيقة، يكشف عن ""نوايا خبيثة"" لدى طهران للسيطرة والهيمنة على المنطقة تحت مسميات استعمارية قديمة، مشدداً على أن الأمن القومي الخليجي هو جزء لا يتجزأ من الأمن القومي المصري. موقف مصري حاسم وتاريخي وأوضح ""فاروق""، خلال مداخلة هاتفية على شاشة ""إكسترا نيوز""، أن الدبلوماسية المصرية، سواء الرئاسية أو عبر وزارة الخارجية، تتبنى موقفاً ثابتاً وراسخاً في دعم الأشقاء بالخليج. وأشار إلى أن الرسالة المصرية واضحة وصريحة: ""مصر لن تقف مكتوفة الأيدي أمام أي اعتداء يمس مقدرات أو سيادة الدول العربية""، مؤكداً أن الروابط التاريخية والجغرافية وقيم العروبة والإسلام تجعل من استقرار الخليج أولوية قصوى للقاهرة. الخليج ضحية الصراع الأمريكي الإيراني وفي تحليله للمشهد، رأى مدير تحرير الأهرام أن دول الخليج باتت ضحية للأطماع المتبادلة بين واشنطن وطهران، لافتاً إلى أن الولايات المتحدة التي تمتلك قواعد عسكرية في المنطقة ""تركت أراضي الخليج مستباحة"" أمام الصواريخ والمسيرات الإيرانية التي تستهدف المدنيين والأبرياء، مما يستوجب تحركاً دولياً لردع هذا السلوك غير المسؤول. ضرورة وجود صوت خليجي في المفاوضات وشدد هاني فاروق على أهمية أن يتضمن أي اتفاق مرتقب بين الولايات المتحدة وإيران ""الشواغل الأمنية"" لدول الخليج، مؤكداً أنه لا يمكن إبرام تسويات تتجاهل أمن واستقرار المنطقة أو تتركها عرضة للاستهدافات المتكررة. وأضاف أن مصر، بالتعاون مع قوى إقليمية ودولية فاعلة، تسعى جاهدة لوضع حد لهذه الحرب ""غير العادلة والدائرة"" من خلال دفع الأطراف نحو طاولة المفاوضات بشروط تضمن حقوق الجوار. تحذير من عواقب التصعيد واختتم فاروق تصريحاته بالتحذير من أن استمرار حالة ""لا سلم ولا حرب"" والتمادي في التصعيد العسكري سيؤدي إلى عواقب كارثية على الاقتصاد والأمن الإقليمي، داعياً المجتمع الدولي لتحمل مسؤولياته في حماية الممرات المائية الدولية وضمان سلامة الملاحة في الخليج العربي ضد أي تهديدات إيرانية.",2026-05-30T08:35:43.350572+00:00,
youm7,tier1,https://www.youm7.com/story/2026/5/30/%D8%AD%D8%AA%D9%89-%D9%84%D8%A7-%D8%AA%D9%82%D8%B9-%D9%81%D8%B1%D9%8A%D8%B3%D8%A9-%D9%84%D9%84%D9%83%D9%8A%D8%A7%D9%86%D8%A7%D8%AA-%D8%A7%D9%84%D9%88%D9%87%D9%85%D9%8A%D8%A9-%D9%82%D8%A7%D8%A6%D9%85%D8%A9-%D8%A7%D9%84%D8%AC%D8%A7%D9%85%D8%B9%D8%A7%D8%AA-%D8%A7%D9%84%D8%AE%D8%A7%D8%B5%D8%A9-%D8%A7%D9%84%D9%85%D8%B9%D8%AA%D9%85%D8%AF%D8%A9/7431628,حتى لا تقع فريسة للكيانات الوهمية.. قائمة الجامعات الخاصة المعتمدة فى مصر - اليوم السابع,محمد صبحى,2026-05-30 06:00:00+00:00,"ينشر ""اليوم السابع"" قائمة الجامعات الخاصة المعتمدة ب وزارة التعليم العالى حتى لا يقع الطلاب فريسة للكيانات التعليمية الوهمية..",اليوم السابع,ar,188,"مع قرب انطلاق ماراثون امتحانات الثانوية العامة 2025، وبدء إعلان عدد من الجامعات الخاصة إتاحة التسجيل المبكر للالتحاق بكليات الجامعات الخاصة، ينشر ""اليوم السابع"" قائمة الجامعات الخاصة المعتمدة ب وزارة التعليم العالى حتى لا يقع الطلاب فريسة للكيانات التعليمية الوهمية. وتضم قائمة الجامعات الخاصة المعتمدة فى مصر 34 جامعة خاصة وهي على النحو التالي: 1. جامعة 6 أكتوبر. 2. جامعة أكتوبر للعلوم الحديثة والآداب. 3. جامعة مصر للعلوم والتكنولوجيا. 4. جامعة مصر الدولية. 5. الجامعة الألمانية بالقاهرة. 6. جامعة الأهرام الكندية. 7. الجامعة البريطانية في مصر. 8. الجامعة الحديثة للتكنولوجيا والمعلومات. 9. جامعة سيناء. 10. جامعة فاروس بالإسكندرية. 11. جامعة النهضة ببنى سويف. 12. جامعة المستقبل. 13. الجامعة المصرية الروسية. 14. جامعة الدلتا للعلوم والتكنولوجيا بجمصة. 15. جامعة هليوبوليس. 16. جامعة الجيزة الجديدة. 17. جامعة دراية بالمنيا. 18. جامعة بدر. 19. جامعة حورس. 20. جامعة المصرية الصينية. 21. جامعة ميريت. 22. جامعة سفنكس. 23. جامعة السلام. 24. جامعة بدر بأسيوط. 25. جامعة الصالحية الجديدة. 26. جامعة الحياة. 27. جامعة مايو. 28. جامعة الريادة للعلوم والتكنولوجيا بمدينة السادات. 29. جامعة الابتكار. 30. جامعة المدينة بالقاهرة. 31. جامعة رشيد. 32. جامعة باديا. 33. جامعة وادي النيل بالفيوم. 34. جامعة اللوتس",2026-05-30T08:35:43.771785+00:00,
