site,tier,url,title,author,published_at,description,site_name,language,word_count,text,extracted_at,error
google_news,general,https://www.annahar.com/economy/314339/%D8%AA%D8%B1%D8%A7%D8%AC%D8%B9-%D9%85%D8%B1%D8%AA%D9%82%D8%A8-%D9%84%D9%84%D9%86%D9%85%D9%88-%D9%81%D9%8A-%D9%85%D8%B5%D8%B1-%D9%88%D8%A7%D9%84%D9%85%D8%BA%D8%B1%D8%A8-%D9%88%D8%B3%D8%B7-%D8%B6%D8%BA%D9%88%D8%B7-%D8%A7%D9%84%D8%AD%D8%B1%D8%A8-%D9%88%D8%A7%D8%B1%D8%AA%D9%81%D8%A7%D8%B9-%D9%83%D9%84%D9%81%D8%A9-%D8%A7%D9%84%D8%B7%D8%A7%D9%82%D8%A9,توقعات نمو الاقتصاد المصري والمغربي حتى 2027,,2026-05-28 09:52:00+00:00,تقرير البنك الأفريقي: تباطؤ نمو الاقتصاد المصري والمغربي بسبب ارتفاع أسعار الطاقة والضغوط المالية، مع توقعات بتحسن تدريجي في 2027.,annahar.com,ar,423,"توقّع تقرير حديث صادر عن البنك الأفريقي للتنمية أن يشهد الاقتصادان المصري والمغربي تباطؤاً في معدلات النمو خلال العامين المقبلين، في ظل تداعيات الصراع الدائر في الشرق الأوسط، وما يرافقه من ضغوط على أسعار الطاقة وسلاسل التوريد والتوازنات المالية. وبحسب تقرير ""التوقعات الاقتصادية لأفريقيا 2026""، فإن النمو في مصر مرشّح للتراجع من 4.4% في عام 2025 إلى نحو 4% في 2026، على أن يعود ليرتفع بشكل طفيف إلى 4.3% في 2027، في حال استقرار الظروف الجيوسياسية وتحسّن بيئة الاقتصاد الكلي. تقشف وضغوط مالية في مصر يعزو التقرير هذا التباطؤ إلى إجراءات تقشفية تتخذها القاهرة بهدف احتواء تداعيات ارتفاع أسعار الطاقة وتخفيف الضغط على المالية العامة، إلى جانب استمرار الضغوط التضخمية، التي لا تزال عند مستويات من خانة العشرات رغم التراجع النسبي في معدلاتها أخيراً. وفي هذا السياق، أشار التقرير إلى أنّ فاتورة استيراد الغاز في مصر ارتفعت بشكل ملحوظ منذ اندلاع الحرب، إذ قدّر رئيس الوزراء المصري مصطفى مدبولي في آذار/ مارس أن الكلفة الإضافية بلغت نحو مليار دولار شهرياً. كذلك لفت التقرير إلى استمرار العجز المالي وتأثير انخفاض قيمة العملة على الأسعار، ما يحدّ من قدرة السياسة النقدية على كبح التضخم بشكل سريع. وعلى صعيد قطاع الطاقة، تواصل القاهرة خططها التوسعية في التنقيب، عبر إطلاق مسوحات زلزالية جديدة واستثمارات تُقدّر بنحو 5.7 مليارات دولار، تشمل حفر عشرات الآبار النفطية والغازية خلال السنوات المقبلة، في محاولة لتعزيز الإنتاج المحلي وتقليل الاعتماد على الاستيراد. تباطؤ في المغرب رغم دعم الميزانية أما في المغرب، فيتوقع البنك الأفريقي للتنمية أن يتراجع النمو من 4.7% في 2025 إلى 4.2% في 2026، قبل أن يرتفع مجدداً إلى 4.3% في 2027، مدفوعاً بتأثيرات ارتفاع أسعار الطاقة وتقلبات سعر الصرف. وأشار التقرير إلى أن تراجع قيمة الدرهم المغربي يفاقم كلفة الواردات، ما يضغط على الميزان المالي ويزيد الحاجة إلى توسيع الإنفاق الحكومي للتخفيف من آثار الأزمة. وفي هذا الإطار، ذكرت وكالة رويترز أن الحكومة المغربية تدرس رفع ميزانية عام 2026 بنحو 20 مليار درهم (ما يقارب ملياري دولار) لدعم الاقتصاد ومواجهة انعكاسات ارتفاع كلفة الطاقة. آفاق أفريقية أكثر حذراً على المستوى القاري، توقّع البنك أن يتباطأ نمو الناتج المحلي الإجمالي الحقيقي في أفريقيا إلى نحو 4.2% في 2026، على أن يعاود الارتفاع إلى 4.4% في 2027، في حال لم يمتد الصراع لفترات أطول أو يتفاقم تأثيره على التجارة العالمية وأسعار السلع الأساسية. وحذّر التقرير من أن طول أمد الاضطرابات قد ينعكس سلباً على سلاسل الإمداد العالمية وأسعار الطاقة والأسمدة، ما ينعكس بدوره على الاقتصادات النامية، خصوصاً تلك الأكثر اعتماداً على الاستيراد. كما أشار إلى أن التوقعات الحالية تفترض سيناريو بقاء الصراع محدوداً زمنياً، في حدود شهرين إلى ثلاثة أشهر، مع إمكانية حدوث تعافٍ تدريجي لاحقاً في حال استقرار الأوضاع الجيوسياسية.",2026-05-28T10:09:45.633011+00:00,
google_news,general,https://www.alaraby.co.uk/economy/%D8%A7%D9%84%D8%A7%D9%82%D8%AA%D8%B5%D8%A7%D8%AF-%D8%A7%D9%84%D9%85%D8%B5%D8%B1%D9%8A-%D8%AA%D8%AD%D8%B3%D9%91%D9%86-%D8%B9%D9%84%D9%89-%D8%A7%D9%84%D9%85%D8%B3%D8%AA%D9%88%D9%89-%D8%A7%D9%84%D9%83%D9%84%D9%8A-%D9%88%D8%AA%D8%B9%D9%85%D9%91%D9%82-%D8%A7%D9%84%D9%81%D8%AC%D9%88%D8%A7%D8%AA-%D8%A7%D9%84%D8%AA%D9%86%D9%85%D9%88%D9%8A%D8%A9,الاقتصاد المصري... تحسّن على المستوى الكلي وتعمّق الفجوات التنموية,"إبراهيم سيف,",2026-05-27 21:22:37+00:00,وصلت إلى القاهرة الأسبوع الماضي في زيارة عمل. إثر وصولنا أصر مضيفنا على أن نتناول طعام الغداء في أحد المطاعم التي تقدم الوجبات التقليدية على طريق المطار,العربي الجديد,ar,852,"وصلت إلى القاهرة الأسبوع الماضي في زيارة عمل. إثر وصولنا أصر مضيفنا على أن نتناول طعام الغداء في أحد المطاعم التي تقدم الوجبات التقليدية على طريق المطار؛ أثناء الرحلة من المطار إلى المطعم ارتكب سائقنا بعض الأخطاء، وأخذ بعض المسارات الخاطئة، مما زاد من معاناتنا مع موجة الحر، لكن الغضب الشديد انصبّ علينا من بقية السائقين المتعجلين، والذين لا يعترفون بقانون السير والساعين للوصول إلى وجهتهم النهائية، لكن الإحساس بأن معركة ما محتدمة على المساحات المتاحة في الشارع المزدحم يتعزز رغم التحسينات التي جرت في السنوات الأخيرة لتخفيف حدة الأزمة المرورية. تلك الأزمة والفوضى التي ترافقها تعكسان على نحو ما صورة التنافس الشديد بالبحث عن لقمة العيش وفرصة العمل بشكل غير منتظم. ومنذ أواخر العام 2022 تطبق مصر برنامجاً للإصلاح الاقتصادي مع صندوق النقد الدولي في إطار ما يُعرف ""التسهيل الائتماني الممتد"" بقيمة ثلاثة مليارات دولار على فترة ثلاث سنوات ونصف، إلا أن الأزمة كانت أعمق من أن تحل خلال تلك الفترة؛ وبحلول مارس/آذار من العام 2024 تم تمديد العمل في البرنامج وزيادة قيمة التسهيلات الممنوحة من خلاله إلى ثمانية مليارات دولار في واحدة من أكبر صفقات الإقراض التي حظيت بها مصر في تاريخها الحديث. في قلب هذا الاتفاق ثلاثة شروط مفصلية؛ أولها تبنّي نظام صرف مرن والذي نفذ فعلاً في مارس عام 2024 وكانت نتيجته تراجعاً في قيمة الجنيه، لكنه أعاد الثقة للمستثمرين وفتح أبواب رأس المال الأجنبي، وثانيها الإصلاح المالي عبر ضبط الإنفاق العام ورفع الإيرادات الضريبية التي قفزت بنسبة 36% في السنة المالية 2024-2025، وثالثها تسريع برنامج الخصخصة وتهيئة بيئة أعمال أكثر تنافسية يفسح فيها المجال للقطاع الخاص الذي يشهد منافسة من مؤسسات الدولة، وبخاصة المؤسسة العسكرية التي تستحوذ على جانب مهم من الاقتصاد المصري ، وتعمل ضمن شروط غير تنافسية تمنح أفضلية للجيش، الأمر الذي يحبط المستثمرين من القطاع الخاص المحلي والأجنبي، ويجعلهم مترددين في الإقدام على استثمارات طويلة الأمد في قطاعات مختلفة، كذلك وضع هذا الموضوع المؤسسة العسكرية تحت مجهر المؤسسات الدولية في إشارة واضحة إلى غياب الرضا عن هذا التوجه. وجاءت النتائج الأولية لبرنامج الإصلاح مشجعة وخاصة على المستوى الكلي للاقتصاد. إذ ارتفعت الاحتياطيات الأجنبية إلى حوالي 57 مليار دولار وبلغ نمو الناتج المحلي 4.4% في السنة المالية 2024-2025 مقارنة ب 2.4% قبلها ووصل إلى 5.3% في الربع الأول من عام 2026، وهو أعلى معدل منذ أكثر من ثلاث سنوات، وفقاً للتقديرات الأولية لوزارة التخطيط المصرية. التحسّن في المؤشرات على المستوى الكلي للاقتصاد لم ينعكس بالضرورة على مستوى المعيشة للعامل المصري من الطبقات الدنيا أو الطبقة الوسطى، والإحصاءات تؤكد ذلك، إذ يعيش نحو 30% من المصريين دون خط الفقر وهناك شريحة أوسع تكافح عند حدود ذلك الخط، وبلغ التضخم ذروته في سبتمبر/أيلول 2023 عندما بلغ 38% وحتى بعد تراجع التضخم إلى نحو 12% في أواخر عام 2024 فإن الأسعار المرتفعة لم تعد إلى ما كانت عليه وهذا يعكس صعوبة الأوضاع وتفاقمها. وهذه الصورة المتناقضة بين الأداء المرضي للمؤسسات الدولية من جهة وحالة الشارع المصري المثقل بأعباء الحياة اليومية من جهة أخرى، صعّبت مهمة صانع السياسات، كذلك تثير أسئلة صعبة وجوهرية حول المستفيد الحقيقي من الإصلاحات وتفاوت مستوى الدخول وتعمق الفجوة التنموية بين الريف والمدن الكبيرة التي تحظى بالنصيب الأكبر من منافع النمو. ورغم هذه التحديات، هناك قطاعات يمكن أن تساهم بتعزيز زخم النمو وتوسيع دائرة المستفيدين من آثاره الإيجابية، مثل قطاع الطاقة الذي يتطلب تعزيز كفاءته والتركيز على مصادر الطاقة المتجددة، وقطاع تكنولوجيا المعلومات الذي يمكن أن يستفيد من الكوادر البشرية المؤهلة، كذلك قطاع الزراعة الذي يمتلك آفاقاً كبيرة رغم التحديات الصعبة التي تواجهه. تثار أسئلة صعبة وجوهرية حول المستفيد الحقيقي من الإصلاحات وتفاوت مستوى الدخول وتعمق الفجوة التنموية بين الريف والمدن الكبيرة وتتميز هذه القطاعات بأنها مكثفة الاستخدام للأيدي العاملة وتمتد جغرافياً لتغطي مناطق واسعة في مصر وتسهم في إحداث نوع من التنمية المتوازنة التي تحتاجها مصر كثيراً. ويبقى قطاع السياحة من أهم القطاعات، لكنه يرتبط بتحسّن البيئة الإقليمية التي لا تتحكم فيها مصر. وتبقى أمام مصر فرصة لاجتذاب الاستثمار الأجنبي، والعقبات أمام المستثمر الأجنبي موثقة ومعروفة؛ تعقيد البيروقراطية وبطؤها، وتذبذب السياسات التنظيمية بما يصعب التخطيط بعيد المدى، وصعوبة تحويل الأرباح بالعملة الأجنبية رغم التحسّن الملحوظ بعد اتفاق الصرف المرن، وهيمنة الكيانات الحكومية والعسكرية على قطاعات عديدة بما يضيق هامش المنافسة العادلة، كذلك تراجع مصر في مؤشر الشفافية، وهو ترتيب لا يشجع المستثمر الذي لديه خيارات أخرى. مصر تمتلك في 2026 ما لم تكن تمتلكه في أزماتها السابقة: برنامج إصلاح مدعوم دولياً واحتياطيات أجنبية مريحة نسبياً، وقطاع سياحي في طور التعافي وطاقة شبابية هائلة، لكن هذه الأدوات لا تعمل من تلقاء نفسها؛ فكسر الدائرة يتطلب ثلاثة مسارات متزامنة وهي: إصلاح مؤسسي يضمن المنافسة العادلة بين القطاعين العام والخاص بما في ذلك مراجعة جادة لدور المؤسسة العسكرية الاقتصادي، واستثمار في التعليم والتكنولوجيا يبقي الكفاءات في البلد بدلاً من تصديرها، وزراعة حديثة تعزز الأمن الغذائي وتقلص فاتورة الاستيراد. مصر تمتلك في 2026 ما لم تكن تمتلكه في أزماتها السابقة: برنامج إصلاح مدعوم دولياً واحتياطيات أجنبية مريحة نسبياً، وقطاع سياحي في طور التعافي وطاقة شبابية هائلة يبقى رهان الثقة وترسيخ مبدأ التشاركية هو الأساس بأن آثار النمو والإجراءات الإصلاحية ستطاول كل فئات المجتمع ولن تعمق الفجوات القائمة؛ كذلك قناعة المستثمر بأن القواعد لن تتبدل بين ليلة وضحاها، وثقة الشاب المصري بأن أمامه فرصة حقيقية لتحسين ظروف معيشته؛ هذه الثقة لا يرسيها خطاب رسمي ولا رضا المؤسسات الدولية فقط؛ بل نهج السياسات الجادة والمؤسسات الشفافة والفرص الحقيقية التي يتوق إليها الشباب الذين يكدّون على الطرق ليجدوا مساحتهم ويحددوا مسارهم.",2026-05-28T10:09:46.260926+00:00,
google_news,general,https://www.alborsaanews.com/2026/05/27/1970330,"أمين ""التجارة الحرة الإفريقية"": مصر ضمن أسرع الدول استفادة من الاتفاقية",البورصة خاص,2026-05-27 14:57:02+00:00,أكد أمين منطقة التجارة الحرة القارية الإفريقية أن الدول ذات الاقتصادات الكبرى والأكثر تصنيعًا في القارة، وفي مقدمتها مصر وجنوب إفريقيا,جريدة البورصة,ar,345,أكد أمين منطقة التجارة الحرة القارية الإفريقية أن الدول ذات الاقتصادات الكبرى والأكثر تصنيعًا في القارة، وفي مقدمتها مصر وجنوب إفريقيا ونيجيريا والمغرب، تحقق استفادة أسرع من اتفاقية التجارة الحرة القارية الإفريقية، بفضل قوة قواعدها الصناعية والتصديرية. وقال وامكيلي ميني، في تصريحات صحفية على هامش ختام منتدى “بياشارا إفريقيا 2026” بالعاصمة التوجولية لومي، إن الاتفاقية تسعى في الوقت نفسه إلى ضمان استفادة جميع الدول الإفريقية، بغض النظر عن حجم اقتصاداتها أو مستوى تنوعها. وأوضح أن القارة تحتاج إلى استثمارات مكثفة في التصنيع والبنية التحتية وتنمية القطاع الخاص، مشيرًا إلى أن صندوق التكيف التابع للاتفاقية بدأ بالفعل تمويل مشروعات تستهدف بناء قواعد صناعية وتعزيز القدرة التنافسية بعدد من الدول الإفريقية. وكشف ميني عن شراكات مع البنك الإفريقي للتنمية ومؤسسة Africa50 لتمويل مشروعات استراتيجية، من بينها إنشاء أول مركز بيانات في موزمبيق، إلى جانب تطوير مناطق اقتصادية خاصة في سيراليون وجامبيا. وأشار الأمين العام إلى أن التحديات العالمية الحالية، مثل آلية تعديل الكربون الأوروبية “CBAM” والغموض المتعلق بمستقبل قانون النمو والفرص في أفريقيا “AGOA”، تعزز أهمية بناء سوق إفريقية قوية قادرة على تحقيق قدر أكبر من الاكتفاء الاقتصادي، لافتًا إلى أن حجم الإنفاق الاستهلاكي والتجاري داخل القارة يبلغ نحو 3.4 تريليون دولار. وأضاف أن الأزمات الدولية، بداية من جائحة كورونا مرورًا بالحرب الروسية الأوكرانية وصولًا إلى الحرب في الشرق الأوسط، أثبتت ضرورة تسريع بناء السوق الإفريقية الموحدة وتقليل الاعتماد على الأسواق الخارجية، مع الحفاظ على الشراكات الدولية. وفي ملف الطاقة والتغير المناخي، أكد ميني أن إفريقيا تتجه بقوة نحو دعم الطاقة النظيفة والمتجددة، بما يشمل الطاقة الشمسية والكهرومائية، في إطار مبادرة التصنيع الأخضر الإفريقية التي أطلقها الاتحاد الإفريقي لدعم التنمية الصناعية المستدامة. وأوضح أن المؤسسات المالية الإفريقية تعهدت بتعبئة 100 مليار دولار لتمويل التجارة الخضراء والتصنيع الأخضر ومشروعات الطاقة المتجددة، مشيرًا إلى أن هذا الالتزام تم توقيعه خلال قمة أفريقيا للمناخ التي عقدت في أديس أبابا خلال سبتمبر الماضي. وشدد على أن القارة الإفريقية، رغم مساهمتها بأقل من 4% من الانبعاثات العالمية، تتحمل التأثير الأكبر للتغير المناخي، بما يشمل موجات الجفاف والفيضانات التي تضرب منطقة الساحل وعددًا من الدول الإفريقية، مؤكدًا أن الشراكة مع القطاع الخاص أصبحت عنصرًا رئيسيًا في دعم التحول الأخضر وتعزيز أمن الطاقة بالقارة.,2026-05-28T10:09:46.363111+00:00,
